Name,,Type,,CP Change,,Active,,Chained,,Description,,Notes
Starting CP,,6,,10000,,True,,False,,,,
Location,,0,,00,,False,,False,,Roll 1d8 for location or pay 50cp to change freely.%%%%1. Seryuu City (The starting city of Satou’s journey, home of the Devil’s Labyrinth.)%%%%2. Labyrinth City Selbira (The most well-known labyrinth in Shiga Kingdom. Say hello to Ban, will you?)%%%%3. Saga Empire (The home of most summoned heroes.)%%%%4. Shiga Kingdom Royal Capital (The great center of a powerful hero’s legacy.)%%%%5. Boruenan Forest (The home of most elves and the World Tree.)%%%%6. Weasel Empire (Shunned by most nations for ‘taboo’ practices, it is the closest in technology and values to the modern world due to numerous reincarnated residents.)%%%%7. Dragon’s Valley (I hope you’re prepared for a major beating.)%%%%8. Free Choice (You can choose anywhere where normal people reside in.),,
Dreamer,,0,,00,,False,,False,,This is the drop-in origin. You awoke in this world after going to sleep (probably while working on your computer game). You have no extra memories holding you down, but at the same time you will have to make your way in this world without any helpful knowledge.,,
Reincarnator,,0,,00,,False,,False,,You died, and you were given another chance by a powerful being that calls themself “God”. You are normally supposed to be reborn as a baby or toddler, but you can start your entrance to this world as a teenager or young adult, depending on the age you roll.,,
Summoned Hero,,0,,00,,False,,False,,Congratulations! You were summoned by the great god Parion to become a regular isekai hero! Not only do you become a widely recognized figure in this world, you will receive the support of various countries in order to defeat a demon lord. You can override your location to that of Saga Empire, the typical summoning place for heroes.,,
Local,,0,,00,,False,,False,,You are one of the inhabitants of this world. While life in this world can vary from a literal demonic hellhole to a season of pastoral boredom, you are still more knowledgeable about this world than these people from foreign dimensions.,,
Notes,,0,,00,,False,,False,,Every human and demi-human in this world gets a random number of skill points between 2 and 12 when they level up. All the factors that go into this are not clear, but Humans tend to average lower than 6 and Demihumans tend to average higher than 7 per level, while Demons and Dragons just kind of ignore this and have as many skill points as they need to be ridiculous.%%%%Most creatures do not get to decide where their skill points go, they are automatically assigned for them based on the activities they perform.%%%%You, jumper, will get a set number of skill points each level based on your race and other perk choices and may assign them however you like based on the types of activities performed before level up. (Ie. If you were studying fire magic you can put all your points into fire magic or some into fire magic, some into reading, and some into the language the book was written in.)%%%%%%As a general guideline, a level 1 Human with a 1 in all stats is basically comparable to a newborn baby, while a level 50 human with a 50 in all stats would be comparable to MCU Steve Rogers - Captain America, a supposedly peak human (really he is a good bit better) in every way, able to lift about 5 tons run 60 mph across difficult terrain while doing advanced calculus and differential equations in your head. A level 99 Human with 99 in all stats would be more comparable with a really fast slightly smarter Peter Parker - Spiderman (who is one of the smartest people in the world by comic book standards), able to lift about 50 tons run between 120 mph and 600 mph depending on the terrain jump about 600 feet and cure cancer while quickly grabbing a hotdog. A level 140 Demon [Demon Lord] with some stat boosting spells and skills is on par with a weakened grand servants and might be able to swings swords so hard he can leave craters like the Grand Canyon behind, move at relativistic speed (actual relativistic speed like dodging lightning for fun), or magically wiping continents with a few spells.%%%%%%The relationship between levels and abilities seems to represent an upwards curve along the lines of if you double your level and specific stat, the actual increase in application of that stat is increased by an order of magnitude. (Level 12 Strength 12) = 100lbs or .05 tons, (Level 25 Strength 25) = lift 1,000 lbs or .5 tons, (Level 50 Strength 50) = Lift 10,000 lbs or 5 tons, (Level 100 Strength 100) = Lift 100,000 lbs or 50 tons. The experience required to level up before the soft cap at level 50 is 50% more per level than the total required experience to get to the last level, after the soft cap the levels become even harder to earn. ( So if it takes 10xp to get to level 2, it will take you 15xp (25 total xp) to get to level 3, 37.5xp (62.5 total xp) to get to level 4, 93.75xp (156.25 total xp) to get to level 5... This is an extremely brutal xp curve and explains why most people have lower levels)%%%%%%,,
Human,,0,,1000,,False,,False,,You are a pretty normal average human in this world. You start at level 1 and start with a 5 in every stat (which you may rearrange at the start of the jump, i.e. give one stat a minus one to put a +1 into another) You receive 5 skill points each level and gain one stat point per level. Your HP, SP, and MP increases by 5 per level and for each stat point put into the appropriate stat.,,
Demihuman,,0,,-500,,False,,True,,You are a Demihuman. Choose an existing fantasy race such as elves or animal people. These races have minor benefits over normal humans, like heightened mana for elves or better smell and hearing for dog people. You can also take this race for free if you give it a minor flaw that balances out their ability, like heightened mana but less physical strength for elves or the option of sensory overload for dogpeople.%%%%You start at level 1 with a 5 in every stat (which you may rearrange at the start of the jump, i.e. give one stat a minus one to put a +1 into another) with an additional 5 to spend as you want. You receive 10 skill points and 1 stat point each level and a bonus stat point every other level.%%%%You get one free purchase of Unfair Advantage without having to take Disadvantage and one free purchase of I'm Quite Skilled You Know. Your HP, SP, and MP increases by 10 per level and for each stat point put into the appropriate stat.,,
Demon,,0,,-3000,,False,,True,,You are a Demon, quite a powerful race (by this world's standards), so you start at a higher level then normal, with some more or less unique abilities. You could also be a higher nature spirit such as a dryad or even an angel (just a good aligned demon), as such you may choose between [Demon] or [Divine] skills or even a neutral counterpart to represent fae if you wanted.%%%%Choose a general theme like manipulation or sword fighting and you will get some appropriate skills for the general theme, such as the manipulator gaining a charm ability and some illusion magic or the sword fighter getting a unique fighting stance and some experience with the sword. Where a dragon is all around awesome, you are more focused on your physical or magical aspects.%%%%You can even have a natural environmental advantage such as wings and flight or underwater swimming and breather, or deep poison forests.%%%%You start at level 1 with a 10 in every stat (which you may rearrange at the start of the jump, i.e.give one stat a minus two to put a +2 into another). You gain 15 skill points per level and 2 stat points each level. You get the perk Don't Stop Me Now for free plus one free purchase of Unfair Advantage, Have You Seen This Before?, and Special Snowflake* without having to take Disadvantage. Your HP, SP, and MP increases by 15 per level and for each stat point put into the appropriate stat.,,
Dragon,,0,,-5000,,False,,True,,You are a full true dragon, a lord of the natural world, every natural environment is fair game to you, but you have a particular inclination to one specific terrain based on your subspecies and always possess the ability to fly as the sky is your true calling and realm. Your body is immensely strong and you aren't a slouch at magic either. Your body is a treasury of magical, natural, and alchemical resources. You can use [Dragon] [skills] naturally.%%%%You start at level 1 with a 10 in every stat (which you may rearrange at the start of the jump, i.e. give one stat a minus two to put a +2 into another) with an additional 10 to spend as you want. You gain 15 skill points per level and 2 stat points each level with a bonus stat point every other level.%%%%You get the perk Don't Stop Me Now for free plus three free purchases of Unfair Advantage and Have You Seen This Before? without having to take Disadvantage.%%%%Your HP, SP, and MP increases by 20 per level and for each stat point put into the appropriate stat.,,
Half and Half,,0,,-1000,,False,,True,,You are a hybrid, maybe a half demon or a half dragon, maybe you were born this way or maybe through a ritual or a failed reincarnation you were transformed. Either way, you may purchase two other races through this option and get all the advantages of both races while minimizing the flaws. You will gain two titles one for each race purchased, if you purchase demon you will get the [Half Demon] title, if you purchase elf you will get the [Half Elf] title and so on. Humans cost 0cp and do not provide their +100 cp boon, Demihuman can be purchased twice for two different types of demihuman.,,
Sparkly Main Cast,,1,,00,,False,,True,,It wouldn't be an Isekai if the main cast wasn't a group of the most beautiful people around. This perk gives you a nearly perfect look in a style you want, be it rippling muscles or dangerous curves or even just a little girl. You also don’t get dirty and should you get hurt or something similar it will always only enhance your appearance with scars and injuries in all the right places. It also makes you exceptionally lucky with your appearance, even if you were to get transformed into something random it would always be something that people could find aesthetically pleasing. You are a 9 out of 10.%%%%This is also an appearance booster for the rest of the population so that even people who are overweight look better then they have any right to do. You are able to decide whether it applies only to you and companions or everyone at the start of each jump.,,
Demon - Don't Stop Me Now,,1,,-1000,,False,,True,,You are level 50 now. Hurray! Not only that you will not have to suffer through the level 50 soft cap on levels, or any soft cap on levels ever again. If it would normally be achievable within a system you may choose to experience a continual arithmetic experience requirement rather than a geometric or exponential one. You gain one title of your choice not offered elsewhere in this jump.,,
Dont Stop Me Now - What A Fancy Glass Hat,,1,,-2000,,False,,True,,Instead of being level 50, you have broken the level cap and become level 100. Even better! In the future you may ignore any hard cap to your max level in a system you are using.You gain one title of your choice not offered elsewhere in this jump.,,
What A Fancy Glass Hat - Once More With Feeling,,1,,-500,,False,,True,,Increase your level by 50. You gain one title of your choice not offered elsewhere in this jump. Can be purchased multiple times.,,
Unfair Advantage,,1,,00,,False,,True,,Choose 1 stat from among Endurance (Kinda like HP), Magic Power (Basically MP), Stamina (Like Stamina bar in action games), Strength (muscles without muscles?), Vitality (more like resistance), Dexterity (like dex plus agl), or Intelligence (not just how smart you are but how powerful your magic is) that you do not have disadvantage on. There are also the Agility and Mind stats based on setting choices.%%%%You gain a 25% comparative boost to that stat and for every 2 stat points you put into that stat (or a similar stat in different jumps) you will get one extra point in that stat. You may double up on a stat advantage gaining a 50% comparative boost and for every point you put into that stat you will get an extra point into that stat. You may put points into your advantaged stat over the limits.%%%%%%You MUST take the drawback Disadvantage once for each purchase of this perk for no additional cp, unless it is given by a racial origin.%%%%Each time you purchase this perk for CP it costs 50 CP more than the last time you purchased it, price starts at 50 CP.,,
I'm Quite Skilled You Know,,1,,-500,,False,,True,,Choose any two fairly common skills that could be available to you and isn't on offer elsewhere. You gain those skills and two sub skills of your choice to go with them. You could grab the skill [Fire Magic] and the spell [Fire Bolt] to go with it. Some skills require you to have a specific title to acquire and use and others require you to be of a specific race. You would need to acquire a dragon title or be a dragon to gain [Fire Magic: Dragon] and the spell [Dragons Fire Breath], or you would need a similar connection with elves to acquire [Archery: Elven] and [Elven Swift Shot] compared to normal archery skills.%%%%This perk can be purchased multiple times.,,
Have You Seen This Before?,,1,,-500,,False,,True,,Choose any one fairly uncommon or rare skill that could be available to you and isn't on offer elsewhere. You gain that skill and a sub skill of your choice to go with it. You could grab the skill [Magic Manipulation] and [Counter Spell] to go with it. Like some common skills, you may be required to have a specific title to acquire and use and others still require you to be of a specific race or faction. These skills are more powerful than common skills and can be so rare as to be believed to be unique, as only one person might have them.%%%%This perk can be purchased multiple times.,,
Special Snowflake,,1,,-1000,,False,,True,,Choose any skill or sub skill that is not on offer elsewhere in this jump, even unique skills regardless of requirements. You gain that skill. This could be a skill like [Phantasmagoric] which lets you rearrange your anatomy like an eldritch monstrosity or even acquire the legendary lost fire spell [Vermillion Lance]. You can create your own, as long as its power is similar to that of the other Unique Skills. Sometimes, in exchange for these potent abilities, Unique Skills can cause their users to become mentally and spiritually unstable due to overuse, but this CP-backed perk will not, unless you tako certain drawbacks.%%%%This perk can be purchased multiple times.,,
Titles,,1,,-500,,False,,True,,Gain two [Title] of your choice not on offer elsewhere in this jump. Some titles may be built off of or enhanced from other ones. You must purchase prerequisite attributes as needed.%%%%May purchase multiple times. (Titles to acquire lower tier skills such as elven magic only take 1 title, to acquire middle tier skills would require two titles in sequence such as demon slayer titles, and to acquire higher tier skills would require 3 or 4),,
Job,,1,,-500,,False,,True,,Gain one [Job] of your choice not on offer elsewhere in this jump. Some jobs may be built off of or enhanced from other ones. You must purchase prerequisite attributes as needed. Can be purchased multiple times.,,
Class,,1,,-1000,,False,,True,,Gain one [Class] of your choice not on offer elsewhere in this jump. Some classes may be built off of or enhanced from other ones. You must purchase prerequisite attributes as needed. Can be purchased multiple times.,,
Combo Breaker!,,1,,-1000,,False,,True,,Just like how Satoo's [King] and [Hero] [Titles] merged into one, you may choose any two titles you have to combine and strengthen them. You may not combine any of the 600cp titles with each other, and a title can only be combined once. Can be purchased multiple times.,,
In Today's Economy Sometimes You Need More Than One,,1,,-1000,,False,,True,,You gain an extra [Job] slot. This may or may not be more useful depending on the version of this setting you use. Does not come with a job. Can be purchased multiple times.,,
Back to School,,1,,-2000,,False,,True,,You gain an extra [Class] slot. Can be purchased multiple times.,,
[Jumper] of the House Targaryen, First of Her Name, the Unburnt, Queen of the Andals and the First Men, Khaleesi of the Great Grass Sea, Breaker of Chains, and Mother of Drag...,,1,,-3000,,False,,True,,While not technically cannon, you gain an extra [Title] slot. Can be purchased multiple times. Have fun.,,
Welcome to [Menu]s and Stuff for all Your Shopping Needs,,1,,-5000,,False,,True,,Capstone Booster%%%%You have acquired Satou's most famous of unique skills [Menu], which functions as an incredibly robust and adjustable menu system and HUD as a means to interact directly with the gamer system of this world while acting as an improved amalgamation of other following skills:%%%%%%[Storage]; Unlimited and Timeless. Truly an infinite and well organized inventory system. Store enough water inside for actual tsunamis. In addition, crafting, deconstructing, and even manipulating items within is simple. Though not everything can be manipulated to a fine enough detail within it, Satou wasn't able to extract salt from saltwater with just this or brew potions.%%%%[Map]; expandable/shown if areas are explored, also shows a list of locations of those who were tagged as important.%%%%[Radar]; similar to [Map], but shows indicators and other information. Is capable of differentiating between foes, neutral parties, and people of special interest.%%%%[Map Search]; Expands the map in an area you have not yet explored, updates and stores entire cartographical information, and incorporates any data received from external sources and makes searching maps easy.%%%%[Column List]; able to edit self-info and reorganize the [Menu] to more easily search for information or fool a [Status Check] like skill or ability, except those of higher order or strength.%%%%[Memo Pad] Allows you to write down your thoughts and contains photocopy capabilities in addition to allowing Satou to use it like a search engine for books that he reads in AR.%%%%[AR] is also known as [Augmented Reality]. Has the ability to photograph, scan, and manipulate structures in a CAD Computer Aided Design. Data is also interchangeable with other systems.%%%%[Magic Column] has a list in the AR that shows all the spells that you have ever used and simply reading or selecting the spell from the menu causes it to be cast without the use of chant and bypasses the need for rituals, somatic, or verbal elements. Components can be pulled [Storage].%%%%[Recipe Column] details the construction process of all the items you have ever made ranging from improvised weapons to magic potions.%%%%[Self Status] You can review, analyze, and apply your stat and aspect distributions and selections.%%%%[Analyse] It is an amalgamation of [Appraisal] and [Status Check]. It's similar to other [Status Check]s but unlike them it is also able to see their HP, SP and MP and it can detect if a person is using a skill or ability to lie or hide about their status. It also has the same skills as appraisal in terms of determining the status and capability of items.%%%%[Clock] The menu also comes with a clock and a calendar.%%%%[Automatic loot] If you or your allies were to kill enemies within the range, items that remain that could even be of remote use are automatically put into your inventory. Things such as corpses and animal parts count too. You may also selectively add things within range directly to storage.%%%%[Log] informs him of any direct action against him and informs him if he gains any skill or title%%%%[Unknown] Satou also has the unusual ability to pierce through space and spatial barriers with his%%bare hands and body.%%%%[Integration] Many different spells and items that require some sort of control or command can be controlled via the menu.%%%%%%These do not describe everything shown or done with this menu/gamer system. In addition to this skill, you will be able to assign skill and stat points however you wish and receive an additional +5 skill points and 1 extra stat point each level. You achieve new titles and the ability to buy into far more skills compared to other people at a massively accelerated rate, simply seeing or being hit once with a fire shot spell can be enough to acquire the options to buy into magic resistance, fire resistance, fire magic, fire magic resistance, and the specific spell. Killing a single creature of a creature type will award you the slayer title for it and having one small fall could grant you a feather fall skill. This perk will integrate with and incorporate any other gamer or system style perks you have or will acquire.,,
