Name,,Type,,CP Change,,Active,,Chained,,Description,,Notes
Reincarnator - Wardrobe,,2,,-2000,,False,,True,,You have a fairly large wooden wardrobe of your design, within this wardrobe is an infinite supply of fairly mundane clothes. Any make, model, and design in whatever colors, materials, and styles you like are available for anything that could be considered a clothing or fashion accessory like shoes, hats, or jewelry. The quality of these clothes is top tier and they are very robust and durable.%%%%Simply wearing these clothes will boost a person's appearance by 2 on a scale of 10.%%%%The clothes come with all the added properties of the Basic Gear clothing: self repairing, self cleaning, and very comfy in all climate conditions and can grant those properties to anything else placed inside.%%%%In the back is an emergency escape portal that can take those you select to one of your properties.,,
Reincarnator - The City of Today, I mean Tomorrow... Yesterday?,,2,,-4000,,False,,True,,This is a mega city of around the size of Tokyo, so 7000 Km^2, it has all of the amenities and technological capabilities of a modern city circa 2013 and then fully upgraded with magic to achieve things like zero waste production nuclear power, mana reactors and engines, faster than light telecommunications, infinite storage capacity hard drives, and flying and floating cars and boats and so much more. Absolutely no expense was spared in the construction of this city with maglevs, solar panels, power plants, electricity, subways, skyrails, parks, vertical indoor farms, even large hadron colliders, water treatment, processing, and storage facilities, energy efficient lighting, and even comes with things like a world wide satellite network, an international space station, full space programs and facilities, medical research facilities, hospitals, cellular technology, computers and so much more.%%%%The city is completely autonomous, self-sustaining, and repairing. It has automata of all designed for cleaning, police, and even military engagement and resources to support a population well in excess of 20 million indefinitely.%%%%This city can be imported into any jump as desired and redesigned as needed to fit the land or aesthetics as or may also function as a warehouse attachment. This city is beyond outside detection, has whatever aesthetics you desire, and will not attract the attention of Outsiders. Additionally, the city completely restricts the power and influence of Gods, spirits, and divine beings near or within it and they weaken as desired the closer they get.%%%%All the aspects of this city can be imported into any other properties that you own. Every aspect of this city and its tech is under your control and the amount of system control you share with others is up to you.,,
Reincarnator - To Infinity and Beyond,,2,,-6000,,False,,True,,An infinite supply of Travel Gates is what you have here. While standardly they take on the size and shape of three large stone torii in a row, feel free to redesign yours whenever you want to selectively appear as anything you desire, made of any material you have access to, and size, so yes you could have snazzy golden stargates if you want. These gates form a network allowing for instantaneous travel across any distance or even dimensions and restrictions and methods can be put in places for others to use these gates. No one and nothing can enter or use these gates against your will.%%%%Whenever you need a new gate to place somewhere, just reach into a currently existing gate and pull out the pieces of or the entirety of a new gate. An indestructible master gate will be added to your warehouse or as an attachment, if you don't have a cosmic warehouse of some sort, you do now with a shape of 200ft by 200ft by 200ft. If you do have a cosmic warehouse of some sort its size is at least doubled in size to accommodate. The Master Gate can occupy up to the size of one wall and represents the largest gate possible.%%%%The gates can be self charged and detonated with a magical explosion equivalent to a 100 MT nuclear detonation. The self charge feature can also be used as a means of supply for magical energy. Any powers and items of transportation, teleportations, conjurations, portals, or other can be fully integrated with this item.%%%%Whenever you enter a jump, you may have gates automatically inserted into the setting at choice locations, even in other local dimensions or planets. The number of gates that can be automatically inserted is equal to 2 times the number of jumps you've entered.%%%%Any area within about 200ft of these gates is considered your property for the purposes of other perks or items and powers. Post-Chain or Spark all individual aspects of this item are increased by at least an order of magnitude.,,
Summoned Hero - Advanced Gear,,2,,-1000,,False,,True,,You get some advanced gear like a suit of armor or a coat with some nice enchantments. You also get a weapon of your choice. The options are a Staff (better magic), a melee weapon, like a sword or an axe(pretty self explanatory, I think) or a magical gun (shoots, but with magic instead of combustion).%%%%The gear is self repairing and self cleaning as well as really comfy and the weapon is of exceptional quality so that it will always stay functional and is really, really hard to break.%%%%Should you manage to break it anyway, a new one will appear in your warehouse or other property as needed a few hours later. If you already possess similar gear it can be imported to gain this one's qualities.,,
Summoned Hero - Mount of Champions,,2,,-2000,,False,,True,,Unlike the pet option, this can be basically any animal up to and including a wyvern, a powerful and intelligent magical creature somewhere between a demon and a true dragon, specifically trained for and [skilled] in personal and mounted combat, maneuverability options, and tactics, while also have powerful abilities like dragon magic and fire breathing. Feel free to design them however you like. They will be at half your level. He loves you with all his heart and always will.,,
Summoned Hero - Adventure Party,,2,,-4000,,False,,True,,Sometimes a hero needs a team. So here is a team. Four followers who fill in the roles of a fantasy party to help the [Hero] out on their adventure. Like almost everything else, feel free to design them however you like. They can be human or demi-human at your discretion, but function as if they have the demi-human origin in terms of capabilities, they each also get a different title, job, and class, and 4 additional skills and sub-skills to start with. They will always be at half your level but may pick up new skills or titles on their own. You may assign their skill and stat points for them. They each come with their own level appropriate gear at the star and mount (They remain followers, and can be brought into future jumps, but can not be imported, all of this is the item),,
Summoned Hero - {Godreaper},,2,,-6000,,False,,True,,There was a blade being built that was never completely finished, the perfect weapon. A paradox in the form of a scythe, for the Godreaper could only become a god reaper by reaping a god. The original was unfinished, but still the most powerful weapon ever created, though not its final form. This is the perfect unachieved version.%%%%This is a melee weapon of your choice, in any style or design you like. This weapon is perfectly balanced in your hands. It can cut through anything you desire as if it wasn't there: the physical, the immaterial, the intangible, mental, spiritual, and even magical. It is completely indestructible, unerasable, and immutable by others while in your possession. It is formed from the finest materials ever conceived, forged by the hands of the greatest craftsman to ever exist, infused with thousands of years of pure divinity across many faiths, and tempered into a god. Yes, this blade is a God in and of itself.%%%%It will instantly kill anything, at every conceivable level, that it gets a hit on and absolutely nothing can block it, it can even strike beings that try to teleport past it. It will drain any divinity from what it strikes storing it for use by its wielder.,,
Local - Craft Services,,2,,-1000,,False,,True,,With all the food around here it’s hard not to get hungry. You get a self-refilling table piled with any and every food and drink that appears in the series, the food never goes bad and the table provides the perfect picnic environment clearing away unwanted pests. Comes with all the chairs, utensils, and tableware you need for such a grand feast.,,
Local - Witches Cauldron,,2,,-2000,,False,,True,,A large witches cauldron containing an infinite supply of any potion, elixir, concoction, medicine, stew, soup, sauce, or liquid, ect, crafted or poured into it, preserved and kept at the perfect temperature. The cauldron will clean and clear itself out with a simple command making it a pretty nifty trash disposal and can refill itself with any prior substance. Comes with an elixir made with almost impossibly pure and rare materials that can cure any injury or disease as long as the receiver is still alive and powerful enough to even repair fractured souls and psychies, makes for a great tasting energy drink. (What's it taste like? whatever you want, or even the thing that would taste best to the drinker, or worst if you don't like someone you need to heal) Also comes with an infinite supply of clay jars and vials of nearly any make and size to preserve whatever you need to put inside.,,
Local - Gunship,,2,,-4000,,False,,True,,A flying air and spaceship of your design built to fight gods and space kaiju. Comes with a 20m railgun and every type of ammo imaginable, magical and otherwise. Also has the ability to travel via sub-space, whether it can reach other dimensions is unknown. While basically functioning as a flying automated fortress of doom, it is self repairing, you don't need to worry about fuel or power sources and has infinite ammo of every conceivable kind.%%%%If lost, stolen, or destroyed, a replacement will arrive within 24 hours. Comes with snazzy telepathic control key staff.,,
Local - Kingdom Hearts,,2,,-6000,,False,,True,,You are now the owner of a Kingdom and City Core, a floating 20-sided shining blue crystal. Your kingdom contains a population of about 1,000,000 followers across an area basically the size of... you know, for as many maps as we get to see in the anime, there's a lot I would give for one well labeled correctly scaled map in this series... pick any sized country between Denmark and France. You gain a kingdom of that size of your specifications, with amazingly fertile land and natural resources, good climate, a collection of major cities and smaller towns and outposts, and well developed infrastructure.%%%%Your city core can create smaller, weaker copies of itself for you to give to other nobles to help run your territories and it has in fact already done so for all the major cities in your territories or that you otherwise already own. The smaller created cores can make even smaller cores as needed with appropriately fractional power, but each core grows in power depending on the size and population of its cities and overall kingdom. Right now with just this item, the master City Core provides you with power on par with a level 60 Demi-human magic focused [Hero] and within your territories, a substantial boost, but it also functions as a massive well of magical power.%%%%The City Core draws abundant magical power from The Source, and exists for the purpose of letting the person who becomes its master to make use of that vast magic power. The entire network of City Cores builds a magical network that can be used to transfer information and redistribute large amounts of magic and power over a vast area. The entire administration method of this network is up to you and it's completely loyal to you, while the network doesn't have a personality per say, it does have a kind of will of its own prioritizing the safety and wellbeing of you its administrator, itself, then its current overseer, the city it is integrated with and its people. An administrator could establish their City Core to allow citizens to freely use it's ritual magic or restrict it as much as needed.%%%%Truly various and strange magics are available through the core; it could create walls that could defend against attack from high-ranking demons, restructure the entire city and function as its avatar, attack magic that can reduce armies to ashes, climate magic that could manipulate weather, or so much more.%%%%You may import your kingdom and or city core however you wish into any jump or as an attachment to your warehouse and space will be made for it.,,
Import A Companion,,3,,-500,,False,,False,,Bring into this jump 1 companion. They will receive 600cp for purchases they would like to make, but they can not take drawbacks.,,
Import Entourage,,3,,-2500,,False,,False,,Bring into this jump 8 companions. They will each receive 600cp for purchases they would like to make, but they can not take drawbacks.,,
Takeout,,3,,-1000,,False,,True,,Incompatable with Dragon God%%%%Choose a character in setting and fate will guarantee you meet this person on at the best possible terms, providing you the opportunity to become friends or more. You may ask this person to join you in your chain and if they agree they will become a companion. Alternatively, you may preemptively purchase this and ask someone you just happen to meet in this chain to join you, but if they refuse this purchase is wasted. You will have till the end of the jump to get them to say yes, but no coercion.,,
Dragon God,,3,,-5000,,False,,True,,Dragon God is your best friend. Why? Because she says so, that's why. She is a multiversal deity and the most powerful being seen in this setting, but she does have a lot of limits. She will join you into your chain if you purchase this. The only things that you can do that will bother her are as follows: doubt your friendship, try to leave her behind, sexualize her in any way (you are the best of best friends, nothing more, absolutely nothing less), and become a lolicon. The first two will just result in pep talks, pestering, jabbing, ribbing, and other such things. The third will probably result in getting severely admonished or beaten up and the last might just get you killed.%%%%Other than that she probably understands you better than you understand yourself and will accept you no-matter what and wants you to do whatever you want. She will "import" herself into any jump even if you don't pay the cp to bring her in, but she won't gain any power from that jump, if even that is impossible she will still show up as an illusion providing encouragement and affirmation or just a good old talk when you need it. This does not mean she will solve all your problems, hack she might not even solve any of your problems, because she wants to encourage you to be able to do things on your own.,,
Is This... A Different Version?,,4,,00,,False,,False,,This is a toggle, for people who would like to choose between the manga, the anime, web novel and the light novel. Otherwise, you will be in a world blended with elements from all sources.,,
Disadvantage,,4,,500,,False,,False,,Choose one stat that you do not have an Unfair Advantage in. For the remainder of this jump that stat is reduced by 25%. This may be purchased multiple times for different stats and or double up for a 50% disadvantage.,,
I'm not a Loli,,4,,500,,False,,False,,You look like a child to everyone and absolutely no one will take you seriously as they would an adult, this might actually let you get away with stuff that kids could get away with here. But remember, this is a world where people are totally cool with selling a child into slavery because he forgot his town pass on raid night.%%%%For an additional 100 you will constantly be grabbing the attention of creepy perverts of a less desirable persuasion, some of whom will actively try to kidnap you or bribe officials into having you enslaved, or outright ruining your life just to get their hands on to you.%%%%For an additional 150 you're pretty much a kid, all the hell of highschool puberty all over again, awkward motor skills, voice changes, the works, no matter what form you take. (Flying as a dragons gonna be ruff) failing your drivers test (how do you fail to pass a driving test for a horse and buggy, no one knows but your gonna do it several times), complete inability to hold your liquor let alone procuring it and god help you if you try to smoke a hooka, rampant moods swings out the wazoo. You have all the grace of a chicken with its head cut off and all stats are reduced by 30% and the other aspects of this just get worse.,,
I’m Not A Lolicon,,4,,1000,,False,,False,,All of your charms are redirected to people you aren’t interested in. Like mature women? Now you attract lolis like a cake attracts wasps. The default is lolis/shotas but if you are after these (and I know some / a lot of you are) this turns into the opposite of your prefered partner.%%%%For an additional 200 cp, almost everybody is going to take this the wrong way and think you are the pervert. It will take serious time to convince people otherwise and in the meantime you might end up with an entire village chasing you out of town for something you didn't even do. Noble knights, soldiers, and officers of the law may take serious issue with you or even decide to take justice into their own hands.%%%%For another 300 cp, this just got so so much worse. You are another best friend of the Dragon God. Wait, how is that bad you might say? Well let me let you in on the real plot of the Story, The Dragon God is a multiversal entity that is best friends with every single version of Satou across the multiverse, but one version of him committed an unspeakable crime so she took all the other versions of him from across the multiverse to combined them together to make our Protag and send him to kill the vile and villainous version of himself because she could not bare to do it herself. What was his great crime you may ask, why he was lolicon! (Seriously she didn't care one blip about the mass murder, betrayal of the elves, or the system of suffering, he became a lolicon so he must die) She hasn't quite resorted to doing the same for you, but she probably will before your time here is up unless you can convence her you arent one, and frankly shes not in the mood to see you right now pervert.,,
TOO MUCH POWER!,,4,,1500,,False,,False,,Absolute power corrupts absolutely, and that statement has so much more meaning in this world than most can realize. None of your spiritual, mental, or soul protections work against this setting's innate powers. Miasma in high enough concentrations can corrupt or kill you if your soul vessel is found wanting, and be warned that gaining unique skills outside of CP purchase invites whispering into your mind and an inability to fight against the god whose fragments you have embedded. Using these powers will increase their volume and once you can no longer hear yourself think and the pain from the cacophony in your soul is too great, you will collapse and you will for all purposes be dead. Not using a power for a long time will slowly cause its whispering to reduce to the point of absolute silence. Your willpower is all you have to fight the voices off.%%%%For an additional 150 (300 total), even the unique skills purchased with cp here will be from other gods of your choice. Having unique skills from various gods might slow down the ultimate collapse of your being as the fragments fight for control but the conflicting voices may drive you to madness and rage quicker. Any powers you have bolstering your willpower are removed making you far more vulnerable to the voices.%%%%For another 150 (450 total), every single power, perk , and ability you posses has a whisper in your mind, begging to be used, pushing you to act in a way that it desires, the strength of the voice determined by the strength of the ability getting louder far faster when used one ups when used provide particularly malicious suicidal thoughts.,,
Resource Deprivation,,4,,2000,,False,,False,,It seems that the legacy of one of the precursor civilisations here now affects you. You find that the material resources needed for crafting any sort of advanced technology are not only scarce, but nearly nonexistent. The gods of this world are also watching in case anyone becomes too technologically advanced for comfort, and using anything that is fairly obviously advanced technology will provoke their intervention.,,
Not So Shiny Toys,,4,,3000,,False,,False,,Mandatory for no points during All Gods Must Die scenario%%%%All none imported items, followers, and pets (Except an empty warehouse) are barred from jump.,,
Level Drain,,4,,3000,,False,,False,,Mandatory for no points during All Gods Must Die scenario%%%%I sure hope you haven’t become too complacent in your powers Jumper. By taking this drawback you lose access to all out of jump powers, abilities, and perks (Except your body mod). Here’s hoping skill beats out power for you.,,
Complete Zero: (0),,4,,3000,,False,,False,,Oh did I say you got to keep your memories of the outside world. Silly me, you now know nothing about this world or jumpchain in general beyond a vague notion of what you're supposed to be doing here and the goals of the scenarios you choose for yourself which will be recorded into your system for recall, your memories of other jumps are wiped clean, it is as if you wake up in this world after going to sleep the night before jumpchain started for you. Not too bad, right? Unfortunately for you, you can no longer be a complete-drop in, you had a life here that "you" can no longer remember, people just won’t stop recognising you and it seems you constantly meet people who act as if you’ve known each other forever. If this wasn’t bad enough not all of them are guaranteed to be friendly.,,
The Three Great Demon Lords,,4,,5000,,False,,False,,It appears that your existence has been noted by the Golden Wild Boar King, Goblin Demon Lord, and the Dog-Head Ancient King. Realizing the threat you might pose, but poses no insight into what you can specifically do, they have formed an alliance with each other and numerous other Demon Lords to take you down. These three Demon Lords have all exceeded the 100 Level cap and the Dog-Head will be at the power he was when he fought Satou.. All of these Demon Lords have somehow become mentally stable again as a result of your entrance, now using their powers in a more intelligent manner. Should you prevent one or more of these Demon Lords from reforming, a different Demon Lord with similar capabilities will take their place.,,
Head of State,,4,,7000,,False,,False,,When Satou fought the Dog-Head Ancient King, the King was nowhere near the power he was in ancient times. But now, the King is back, baby! The Dog-Head Ancient King will be just as powerful as he was the day he was slain by the pillar gods, the day he decided to overthrow the Demon God and the supposed god at to run to the others for help. Beware Jump, this is a being that took the combined might of all eight of the human gods in ancient times to kill. Though it's doubtful he would succeed against even one and definitely not two today. This being has taken an interest in you, if you prove a worthy jumper he will want to eat you all the more. He will study you, your tactics, and become aware of any ability you use in this setting and plan accordingly. He won't confront you for at least six month but you never know when he will strike. You can always seek him out to destroy him early if you want, but this is a being who could hide from and assassinate lesser gods in mass. If taken with The Three Great Demon Lords the King from that drawback will be a new demon lord and all four will work together.,,
