Name,,Type,,CP Change,,Active,,Chained,,Description,,Notes
Summoned Hero - Where Did You Find That?,,1,,-1000,,False,,True,,As a great and noble hero you have got to have the best equipment and while people may often be willing to shower you with gifts, the best treasures come from adventure. You have a disturbingly high chance of finding whatever you need whenever you need it, the shop keeper will suddenly remember were there were a few extra rolls of toilet paper even when they should have been sold out for weeks, you'll be sitting on the ground and notice a pretty flower that just happens to be a very very uncommon alchemy ingredient, and you'll probably find four and five leaf clovers on a daily basis. Yes yes, the kingdom regularly refills the local training dungeon with treasure, so why exactly was a legendary lost weapon found there? because of you, that's why.%%%%You might not always get what you want, but you'll get something. Counts as a general luck boost.,,
Summoned Hero - Activation Phrase,,1,,-2000,,False,,True,,Some magical objects in this place require a cry of some sort to use their special abilities, namely the holy swords. This isn’t the case for you%%%%Whatever objects or abilities you use, you do not have to do anything to telegraph your attacks by shouting, speaking, waving, or whatever would reveal your intended action. You can now use any item, skill, spell without shouting some stupid combination of words or do a silly dance that might give away what you are trying to do.,,
Summoned Hero - Better Toys for Better Living,,1,,-2000,,False,,True,,Demon Lords and Monsters may outpace Heroes in raw power, but heroes are uniquely prepared, as mentioned previously. They don't just have the best equipment, they bring out the best from their equipment, any items or artifacts you wield are twice as powerful, effective, and durable, ect, in your possession as they are with other people.,,
Summoned Hero - Corrupted Within,,1,,-4000,,False,,True,,While many people percieve Parion to be a noble, righteous, and kind goddess, for all intents and purposes she is more cruel and manipulative than the Demon God ever attempted to be. She pushes others around like expendable pawns and risks their lives to the corruption she brought into the world.%%%%While this perk provides no protection from the corruption or the ill effects of outside forces, items or powers you use, you will grow ever stronger and more dangerous as negative and cursed forces claim you. A curse strong enough to take your life would see your power and ferocity grow by an order of magnitude by the time you reached your final minutes. You may willingly accelerate your own corruption to gain these benefits and you may also now enter a a berserker state similar to a barbarians rage increasing your resistances and strength for a period of time, but after which you will experience fatigue, exhaustion, stress and will be more susceptible to corruption.,,
Summoned Hero - [True Hero],,1,,-6000,,False,,True,,Huh, it appears that you have already defeated a demon lord, thus granting you the [True Hero] title. You are now a good bit more powerful than a regular [Hero] without even equipping the title.%%%%Whereas a [Demon Lord] gets a mild improvement across the board but an insane boost in a specific area to fit an archetype, you get major overall improvement across the board for your stats and skills.%%%%You can now acquire [Divine] skills, any powers that could be described as light, good, holy, and divine are improved by about 50%, and you are equally effective at destroying and resisting the powers of dark, evil, unholy, or demonic.%%%%Equipping this title improves your powers over light and against darkness and makes you much more powerful than a regular [Hero] but a bit weaker than a [Demon Lord]. But what sets you truly apart from a [Demon Lord] is your oneness of self, your body just feels lighter to you, more freedom of movement, your will power boosted to match your new self confidence and understanding, and you understand your limits perfectly operating at up to 90% of you peak without any effort or stain.%%%%With the title equipped you can operate at 99% of your peak effortlessly and your force of will grows greater, being able to push yourself with great effort and strain to actually operate at 110% and truly become on par with a [Demon Lord]. To show off your achievements here are 50 levels and a free [Unique Skill] (which should technically come from the God Parion, but we will make an exception).,,
Boosted [True Hero] - [Half Apostle],,1,,00,,False,,True,,Most apostles are automatons crafted from raw divinity and brought forth from the seedbed, but every so often a mortal will be so infused, creating a half apostle.,,
Local - Inconspicuous,,1,,-1000,,False,,True,,Being a local of this world gives you an Aura that makes you a really uninteresting target for the plot and potential BBEGs. As long as you don't do anything out of order, most people are just gonna ignore you. Can be toggled, but if you intentionally break the illusion it has a cooldown of about 24 Hours. Owning or managing a shop or inn is now easy for you. Minor charisma boost.,,
Local - Plot Magnet,,1,,-1000,,False,,True,,The opposite of Inconspicuous, this perk gives you good chances to just randomly stumble into the plot. Whether it’s a Hero who decides to be friends with you or some random villain takes you hostage, it almost feels like you are being pulled into the plot regardless of what you do. Cannot be used with Inconspicuous but can be toggled and or scaled based on the setting to allow for big or small adventures to just fall into your lap. Comes with minor luck boost, especially in rewards or interest in these plots and a small protection against the dangers of these plots.,,
Local - Knighthood,,1,,-2000,,False,,True,,Functionally, this is a mostly late period medieval setting with magic and as such one of the "easiest" ways to raise your station in life or prevent your complete descent into serfdom as the eighth born son of a noble is to join with the military or knights. It looks like you have done just that or something similar presently or in the past. You get a set of [Titles], [Jobs], [Classes], and two mundane [Skills] like [Marksman] or [Swordsman], representing your new station and skills. Your body has been reforged to the pinnacle of ability through decades of training and actual combat experience (even if you're a kid somehow).%%%%Whenever you start to learn a new form of martial training or art you suddenly have a decade of practical experience focused in that art. Your physical abilities and skills will not diminish over time. Mechanically this is also granted as a flat +5 to all physical abilities score and a 5% boost to them.,,
Local - Knight in the Hood, Witch in the Woods,,1,,-2000,,False,,True,,This world is far older than the system implemented by the Demon God and Parion, old magics powers, and bloodlines that the system only begins to scratch at. The system does not define every power, but it does denote them so others can conceptualize what they are and tries to limit their influence in the world. But you have subverted these systems, general suppressions of powers, skills, and actions through either a manipulation of the very mechanics of the universe or as an act of law, they simply don't apply to you anymore if the intent was to suppress. The entire community could ban witchcraft, the ability of citizens to arm themselves, and be in the middle of the witch trials or fuedal and yet they would not bring actions against you unless your specificly commiting other kinds of crimes, such as assault or murder with your actions. There is an aura of fear and intimidation that crossing the line against you would lead to grave repercussions, this wont stop particularly ambitious individuals from trying to accomplish their goals, but they won't be convincing the masses to rally against you, unless you harm those people personally. You gain two rare [Skills] and subs skills of your choice, and may acquire skills, titles, jobs, and classes representing these old world traits, bloodlines, and powers which lie outside the system.,,
Local - It's Great to Be King,,1,,-4000,,False,,True,,Nobility in this world is a powerful thing, it's not that the people don't necessarily want to rise up against the nobles for being jerks, it's that the nobility get a lot of nice benefits in this world that make such a thing impractical. Now, you too can share in these benefits. You get a set of [Titles], [Jobs], [Classes], and even two fairly mundane [Skills] like [Accounting] or [Politics] to represent your actual station, such as just noble, or duchess, or even king (though it's kind of like how aladin is king without a kingdom).%%%%From now on whenever you like, you will possess an air of authority about you that is unquestionably noble whether for good or tyranny, providing a massive boost to charisma, persuasion, intimidation, influence, and such things.%%%%Secondly, you are a sovereign and will always have a sovereign immunity wherever you may find yourself, protecting you from taxes, jail, or other similar issues.%%%%Lastly, you have an extreme boost in capabilities, defenses, and power wherever you hold claim, the more claim over a territory you have the stronger the boost is upto 150% and you may apply negatives within your territories up to -50% on others based on those same claims. These attributes are closely tied in with luck and administration of a kingdom.,,
Local - Miko of the Jumper Temple,,1,,-6000,,False,,True,,Aren't you the charming one, well the gods seem to think so at least. Wherever you go, gods and spirits both natural, angelic, and demonic just seem to like you and are far more predispositioned to help you out, not screw you over in deals, listen to your petitions or just hangout even if you are currently the priest of an enemies temple.%%%%It might have something to do with the fact that you now have an immense willpower and purity of conviction and faith in whatever you selectively choose to believe in, or that any of your offerings and sacraments empowers them far more than even a small army of zealots, your worship alone could sustain a god (though, wouldn't make them very powerful by itself), whatever the reasons, these kinds of beings genuinely like you, will shower you with gifts and blessing, and do a lot more to get you to be their MIKO.%%%%So what is a Miko, well it is a shrine maiden, a practitioner of faith that helps protect, watchover, and supplicate a temple. But due to the nature of this world, they also tend to be like holy knights and paladins to a minor degree, some fall more on the warrior side and some fall more one the healer side. You now have the [Miko] title, job, and class (we don't actually see a class, for this but you get it anyway). You also gain the [Holy Magic] skill of your choice for any of the gods in setting granting you powers based on that god, or make up your own god and it will be one of the other tribes that survived the massacre of the Dog-Headed Demon.%%%%You will gain the [Oracle] skill which puts a kind of divine telepathic radio into your head, allowing you to communicate, recieve messages, visions, prophecies, and even a level of clairvoyance with the gods, the afterlife, divine realms, the system itself, and even the natural world (lets you even talk with trees and plants and rocks, no one can mess with it, so gods couldn't disguise a vision as a prophecy to deceive or gaslight you) .%%%%All divine channeling abilities are strengthened and you will receive several blessings from your god, empowering you and allowing you to function beyond normal limits, though not to a level of a [Hero], however with your [Miko] title equipped you would still be just below a [Hero] in personal physical capability, you have better boosts across the board, and all the spiritual powers and blessing you channel are improved by two fold. You have been granted an [Authority] or more specifically a fragment of an {Authority}.%%%%You may purchase [Holy Skills].,,
Boosted Miko of the Jumper Temple - Wakemitama,,1,,00,,False,,True,,Huh, turns out you are actually a piece of a god. You were created for a very specific purpose or role to fill, but you won't be subject to your god and can even turn against them if you like. You are no longer intrinsically under the system, but are now a part of the system itself and maybe a bit above it. You were most likely split off and forged for the purpose of resurrecting the god in case of their death or to act as a gate into the physical world.%%%%As such, you will gain a one-up to bring yourself back from the dead once per jump or ever 10 years, whichever comes first, and you can sacrifice yourself to summon anything/anyone fully and alive (or just their corpse if you really want) into the world bypassing any obstacle, even such as death, timelocks, or dimensional prisons. (this could be used offensively to force someone hold up in their personal dimension out and to confront you)%%%%Entities are even more charmed by you and the benefits you offer, but more importantly they are more generous with their gifts and now have a high level of respect for you, even as an enemy.%%%%As a fragment of a god you are quite powerful allowing you to compete with a Lvl 100 [Hero] and pushing your channeled powers and blessings to be an order of magnitude greater without even having attributes filled.%%%%As you are an actual aspect of a god, you no longer rely on the continued blessings of other beings, once a blessing or power is granted it is a part of you and you are now the source.%%%%Once per jump you may choose a set of powers and blessings gained from a being or being part of a particular faith and they will continue with you, fiat backed.%%%%You may gain two more [Authorities] or turn a previous [Authority] into an {Authority}.,,
Basic Gear,,2,,00,,False,,True,,You get a basic set of clothes, boots, gloves, a nice cloak, a travel bag of holding, and an infinite water skin. These are self repairing, self cleaning, and very comfy in all climate conditions. Can be imported as any set of clothing that you already have. You can’t pull out or store items that won't fit through the opening of the bag of holding, but it also has limitless storage capacity. Unlike the [Storage] sub-skill of [Menu], the bag is not timeless and as such food will deteriorate. An water skin is of a very high quality and will produce an infinite amount of fresh, perfectly pure, and clean water as can pass through the head.,,
Pets,,2,,-500,,False,,True,,You may pick any mundane or semi-magical animal, like a unicorn, within this world. You now have a completely loyal pet of that type. They will always be healthy and in whatever age category you want, if lost by any means they will reappear by your side or in your warehouse within 24 hours. You can purchase any animals you have previously owned to grant them fiat backing and these abilities.,,
[Maze Master] Core,,2,,-3000,,False,,True,,Congratulations! You are now the owner of a pretty big maze or labyrinth. While this was an attempt to recreate a City Core, it actually failed on many levels and ended up being closer to a Dungeon Core in function, which oddly fits the intended purpose of the facility better. Either way, it is still an immensely powerful object and place.%%%%The maze and core do not grow over time, but it does sucks up magic power from its surrounding and refines it into magic cores which can then be used by it's facilities. The maze has three prototyping facilities. A facility to cultivate monsters, a facility that produces golems, and a facility to create dolls that act as servants, all of which can range anywhere between level 1-30.%%%%The maze can generate a staggering number of monsters and servants with the ability to equip them with level appropriate gear, enough to output and maintain armies if need be. It will generate all the resources and materials requested of it as it can produce from mundane materials of any kind, mythril, magic cores, and any parts of monsters or animals needed that could be acquired within the 30 level range. The maze has an explosive self-destruct system. The maze can consist of anywhere between 20 levels of 500 meters diameter floors with systemically perpendicular passages up to a 200 level colossal monstrosity of a maze tree that pierces the sky.%%%%Just like any Core, the owner of it is granted an immense amount of power, enough to rival a level 30 human and within the maze itself more than doubling these boons, having near absolute control and power to reconfigure the maze to desire, monitor everything inside, or keep others out.%%%%Comes with surrounding spirit populated forests, a couple of dryads, and a mountain range to boot.%%%%May be dropped into any jump or turned into a warehouse attachment. Everything produced is backed.,,
Dungeon Core,,2,,-6000,,False,,True,,Well, it seems that you hit the jackpot. You now own a dungeon core, which is capable of everything the maze core is and so much more.%%%%It grants you power able to rival a level 90 Demon [Demon Lord] and, within the territories it grants you, near-absolute control and power over the surroundings so that you could put a god in timeout.%%%%You can produce rare magical items like Gift Orbs, Holy Swords, Magic Sword, Mythril, Orichalcum, Hihiirokane and so much more from your Dungeon Points. The entire Dungeon and Core system was designed to collect, regulate, convert, and produce magic, miasma, and souls. As it performs these functions it generates Dungeon Points which can be spent to improve, increase, expand, grow, empower, and generate, ect, items, the dungeon itself, the core, and a myriad of other things and it does this through the core function.%%%%The dungeon is starting at 3 times the size of the maze and surrounding areas included are easily 10 times larger. Even in worlds where there is nothing similar to souls, miasma, or magic this dungeon will still generate at the base level, 3 times greater in capacity for amount, level, and rarity monsters and resources created.%%%%While normal dungeon cores in this world forbid you from leaving or getting too far away from the dungeon and or handing over your [Dungeon Lord] title to others. This version allows you to move your dungeon, leave the dungeon, and give ownership or sub-ownership of this dungeon to others.%%%%This dungeon can be imported into any future jump and/or act as a warehouse attachment.,,
Dreamer - Cellphone,,2,,-1000,,False,,True,,It's a very nice cellphone of your choice with a few minor upgrades. It can attach itself to any kind of cell, radio, internet, or satellite signal it comes into contact allowing for free undetectable , untraceable, and encrypted use. It can run off your ambient magic, has a massively increased storage capacity, a much higher quality camera and video both front and back facing, never strains its cpu no matter how many tasks it tries to complete at once, comes preloaded with all your favorite apps even new better more user friendly ones designed by you, games, music, books, and movies. Not to mention several websites of your choice for offline use. (Wait, didn't he have an early 2000s flip phone... Don't look a gift phone in the mouth),,
Dreamer - Carriage,,2,,-2000,,False,,True,,Here you got a pretty darn big carriage that is way too big for the two horses pulling it, but still it comes in a design of your choice, closed/open, cloth/ all wood/metal trim, black/brown/ rainbow flowers, ect has no problems crossing ridiculously challenging natural terrain and is substantial faster than a carriage should be soit can be used as an escape. The horses, or really any fairly mundane animal or heck feel free to make it a golem carriage, never tire or need maintenance and are completely loyal.%%%%The interior of the carriage is bigger on the inside but not by insane amounts but still it is noticeable enough that ten people can sleep in this thing without being crammed in like sardines and there is still supposedly tons of space for it to operate as a full merchant shipping carriage and then some. And even if you go with an open face design, the interior is somehow climate control and pest free at all times. Can actually travel to hell and back safely.%%%%Exact specifications are up to you.,,
Dreamer - Trazayuya’s Blueprints,,2,,-4000,,False,,True,,In these papers are extensive information on the creation of magic and holy weapons, the creation and manipulation of city and dungeon cores, the complete process to make the maze cores, traps, and even flying ships, and that’s just scratching the surface. These papers contain all the knowledge, research, schematics, and experimentation in the fields of crafting, metallurgy, carpentry, herbology, medicine, alchemy, zoology, architecture, engineering, technology, and magic ,ect (academia in general), known within the world both widely and by a select few geniuses, along with the beginnings of research and experimentation into any lost or forgotten technology that will get you halfway between the currently available tech and the lost tech. (IE, you would have half the R&D process between the Maze Core and the lost art of making City Cores already available when you enter the jump)%%%%These papers are heavily notated with references and counter references needed to learn from them but it would still take a genius decipher the more advanced parts.%%%%You will receive more papers in every world you enter and all papers start well organized and conveniently bound by subjects and references. Can be used as a nifty reference guy to know who the major contributors to science and magitech are within a world.%%%%Comes with a free office workspace pocket dimension/ warehouse attachment you can access through almost any door to store, manage, research, and work.,,
Dreamer - Echigoya Firm,,2,,-6000,,False,,True,,You seem to have built yourself up a nice Little, hmm.. sorry about that I mean TINY, ... you know what, screw it. You have a company; a very big company, I mean it, this thing could rival the East India Company at the peak of its power without hardly trying, it will have offices in every major and middling city and in many of the smaller towns too with outposts dotted around to grant it influence pretty much everywhere, it will have the means of production, transportation, storage, and security to rival most countries and can easily do all this following whatever economic and ethics policies you have in place.%%%%The wealth of this company is so great as to be able to influence governments in mass while handling its own mint and treasury if needed and no one will complain about this. All taxes for the company are simply taken care of and it wont come under any particular legal scrutiny or malpractice question unless you expressly order to violate the law, it also won't violate local laws unless explicitly ordered to do so.%%%%The company and its employees are quite capable of learning to manufacture almost anything if provided the means and they are all very loyal to you and the vision you lay out. It easily maintains about 75,000 direct employees who act as followers, the company is quite efficient with the number of employees it has and is well organized. You will receive 300,000,000 1oz gold coins a year along with a hefty amount of supplies and resources for personal use such as Mythril, Orichalcum, Hihiirokane, different types of lumber and wood, magical plants, animals, animal parts, monster parts ect.%%%%The company maintains itself and has even more resources available to be used for R&D or mass production.%%%%You may import this company into any future jump, it adjusts itself to the setting and you may choose to receive resources and money from this setting, the new setting, or a mix of both.,,
Reincarnator - Papers Please,,2,,-1000,,False,,True,,This world kinda sucks with the whole slavery, taxes, and trade papers thing. So here are a collection of papers, or small stone idols, or whatever is needed and used in each world. These are always on hand and can't really be stolen or destroyed. They are 100% real and trying to claim them as fake would get people laughed at for clearly making false claims. They cover a bunch of areas but are not limited to things such as travel papers, visas, boarding passes, self identification, family identifications, proof of taxes, and receipts, titles, deeds, possession, authority, education, occupation, qualifications, and so forth. While these can not exactly be used to forge your identity, they will cover all your taxes, fees, and bonds needed to keep up with such identifications and keep you out of jail or slavery.%%%%Proofs of qualifications can cover anything which you would be skilled enough to perform, but proofs of education would require an actual degree to back you, these documents will update to be setting appropriate and if someone tries to locate master copies or backups, everything will be correct, legitimate, and consistent whenever search or located.,,
