Name,,Type,,CP Change,,Active,,Chained,,Description,,Notes
God,,1,,-10000,,False,,True,,Congratulations, you are now a God. While you are not yet on par with the human gods of this world, such as Parion, Tenion, and Zaikuon, etc., you are simply beyond what most beings are capable of understanding. Physically you are quite powerful, but the real seat of your power is in the ethereal and spiritual realms. There aren't really any clear comparisons that we are given to the full capabilities of gods, partially because they exist beyond the system itself and partially because they aren't as thoroughly analyzed as they should have been, as such we are going to make some guesswork and just shotgun this.%%%%Firstly, in any system that has a randomized number of stats or skills given each level, you will always get the maximum number available. What does that mean for this jump where we've already provided a set average? You will start with an extra 5 points in every stat, gain 5 extra skill points per level, and 1 extra stat point per level. Second, you have a +100% or 2 times additive divine multiplier on everything after all other boosts. (Aka As a Human Deity with 50 strength, you'd be twice as strong as a Human with the same 50.) Any time you gain a skill whether in this jump or otherwise, you will also gain another skill representing the same thing except this is a [Godly: Skill] that is similar to a unique skill version of the same skill but beyond the system.%%%%You will gain a [Deity] => [Race], [Class], [Job], [Skill], and [Title] that occupy their own exclusive slot boosting all the other attributes you have equipped or are benefiting from.You have a flat 90% damage, debuff, and duration reduction that will combine with any other reductions, such that if you had a 50% damage reduction you would have a 95% damage reduction, another 90% would give your 99%, another 90% and another 50% would give you a 99.5% These defences can not be bypassed by even godly sources and all of your abilities pierce everything else's defences by the same rate.%%%%You will gain a full {Authority} of your choice, this represents what you are primarily the god of and is an expression of power and control in the world far beyond the system itself. Your {Authority} could be something like {Sun} providing an influence over clear physical aspects such as light, fire, and the sky, but also metaphorical aspects such as hope, cycles, or tyranny. This authority can taint all your other abilities.%%%%As a god you are immortal, while normally gods could reform given time if they were to be destroyed and are fully able to operate in the spiritual world after their body is destroyed, you will simply get a one-up. You are ageless and have no true biological needs such as sleep, eating, or even breathing or need for upkeep and can thrive in extreme conditions such as outer space or even survive on the surface of the sun.. Your body can reasonably take on any form that your stats can support, or you can simply express all your power through the shape of a rabbit or dragonfly or even more intangible things like a giant shining cloud with only the things able to pierce your defences able to pierce your form, even if you had a limb chopped off it would instantly reform and you would simply have a representational loss of health or energy, you don't even have to bleed if you don't want every hit causing hard light sparks of your aura to shatter across the wind with each strike. You have a unique aura that is deeply connected with any expression of yourself, and can be used to enhance the awe, terror, mesmerizing, or beauty factor of your presence by an order of magnitude.%%%%You can now design your own [Holy Magic: Jumper] that you may freely allow any being to use as you wish or allow. It is an expression of your godly powers and will grow in strength and capability based on the amount of divine power you wield. You can travel through local dimensions to a minor extent, and can teleport to and appear wherever you hold a seat of power or one of your worshippers reside. You can transition freely between your ethereal and material states, possess people and objects, wielding their abilities freely. You can split off small aspects of your soul to haunt,watch, possess, bless, or function like guardian angels to specific people and places.%%%%Lastly you have the [Deity] skill, at level 10 so to speak, representing your outside of system powers, your actual godly capabilities vs the system. You start off 10% beyond any system, not just the game and magic systems present in this world but the literal laws of physics. You aren't 10% stronger, but 10% beyond the concept of strength itself able to provide leverage, torque and range where there were none, or forge metals that are both 10% lighter and 10% denser and 10% heavier and 10% sharper than the very laws of physics permits.%%%%You can build up your divine power by accumulating divinity or by coelessing miasma *See Notes. These resources are spent to achieve a wide variety of effects. You can also grow your powers and soul by handing out percentages of your power or cultivated [Unique Skills] to people to then collect on their powers, energy, and souls when they die. It's your choice how corrupting you wish your powers to be on others. With that said, with your current accumulation of excess power, you can only create about three new [Unique Skills] or a single [Authority] of your design. These two resources are used for a whole lot of applications by the gods such as crafting treasures, creating matter, overcharging spells and abilities along with the creation of beings like apostle's or demons.%%%%If you are not one of the human gods you must be one of another tribe or other race, as such you will gain a second {authority} representing this race or groups of races such as {birds}, {demons}, or {dragons} such that you hold power of these species in all future jumps and anytime you enter a jump you may have these species begin to populate the world all similar species functioning a familiars for yourself. Here are 100,000 followers to act as worshippers and faithful, knights, templars, and priests of your faith, they are split up in power based upon the strength of race you individually purchase here where if you had bought dragon about 1% would be on par with dragons, 10% on par with demons and the like, and 90% on par with demi humans. (feel free to design a new species not originally seen in this world like snake - Naga or bird - Aarakocra, but once designed and the {authority} chosen it is set) Increasing your worshipers by an order of magnitude may at most increase your abilities beyond by 1%. Any followers and companions will count amongst your faithfull.%%%%While it is stated several times that gods are omniscient and omnipresent, this is simply not true. As a god you can possess a vast and near absolute awareness of everything that happens within a large range around you, if you choose to focus on such things, at your level of power that range is probably around ten thousand miles and you may freely just appear wherever and however you want within that range, but you do have a diminishing awareness and ability to translocate beyond that. Your eyes and other senses possess a constant true sight able to see that which is invisible or touch what is intangible. These abilities of perception extend into overlapping dimensions such as the ethereal plane and even slightly multiversal planes such as parallel worlds, realities, and timelines. But be warned a few beings have the ability to hide from your view and areas can be protected against it or even your travel.%%%%You will gain your own personal sub dimension representing you divine realm that will travel with you between jumps, it is completely up to your design and acts as a seat to your power, it may be incorporated into any greater cosmology and gives you power over the spiritual afterlife of your faithful or others that you may hold or position such claims over their souls.,,
Dreamer - I Remember This,,1,,-1000,,False,,True,,You may have just entered the world, but you aren't completely clueless. You have either similar experiences from a video game in your old world or have the memories of a childhood in this one. Whenever you enter a new jump you will get a quick briefing and summary covering everything important in the world you are entering. This also acts as a minor luck boost.,,
Dreamer - [Hidden Power Manager],,1,,-1000,,False,,True,,Regardless of how overpowered you are, sometimes you just want to enjoy a normal life. This perk gives you the ability to hide your crazy powers and appear just like any generic citizen of this world. It protects you from all sorts of detection so if someone hasn’t seen you use the power, they’ll never find out. If you also have some sort of interface, it gives you the ability to customize what is shown to other people. Like Satoo, you get the ability to lower any of your powers in intensity (on a scale of 0 - 10) or shut them off completely if you want to. You can either do this in your mind or use your interface(should you already have one it’s going to get integrated).,,
Dreamer - Unique Soul,,1,,-2000,,False,,True,,Well, aren't you special. In all of the multiverse there isn't anyone else quite like you, that's because you just happen to be the combination of almost all of the different versions of yourself across said multiverse. Firstly your soul and by extension your soul vessel has expanded by several orders of magnitude in power, capability, and resilience, but that doesn't really lead to much direct power. Secondly, you will find memories, skills, and familiarities with events hidden away inside yourself making it much harder to be caught off guard and much easier to relate to other people and their experiences. And lastly, it's no longer possible to copy you, your powers, or creations perfectly depending on the relative skill or ability of the copier there is always something that makes it clearly not you or yours, everything you do and are has a uniquely you feel that simply can't be denied. You may selectively toggle elements of this as needed to hide, forge, or impersonate, ect.,,
Dreamer - [All Map Exploration],,1,,-2000,,False,,True,,Once per jump, or every 10 years whichever comes first. You may instantaneously know the exact whereabouts of any beings or items within and the general layout of a given territory. Nothing can be hidden from the perception of this perk's use, not even gods or warded locations. You will also gain the skills [trap discovery] and [treasure discovery] and the spell version of the [All Map Exploration] along with [Nature Magic: Foreign World].,,
Dreamer - Engineer,,1,,-4000,,False,,True,,Wow, aren't you the smart one, or is it just that the entire world seems like it was built from the ground up by an alternate version of yourself? Either way, your intuition, creativity, and ingenuity have been massively enhanced. Additionally, you can now learn in days what would take others years to learn (if you need an exact number learning multiplier, let's say 50).%%%%But more importantly, you now know how to craft any fiat backed items you own and can easily develop new items or combine the techniques and knowledge together in unique ways or understand substitutions and the differences they make. It can function like a path of victory for crafting, granting intermediary knowledge needed, such as: you own a computer, you will have the knowledge of all the steps needed to build the devices needed to build the computer.%%%%Whether you have the actual capability to do so is another story, just because you know how to make gold coins and completely understand their structure doesn't mean you can just create gold out of thin air. And something like a magic book filled with all the engineering knowledge of a planet, this perk would only provide you the knowledge and skills to make an infinite book not the contents inside of it.,,
Dreamer - [Meteor Storm],,1,,-6000,,False,,True,,Three times per jump, you may call down divine meteors, killing everything in a defined area and destroying a substantial portion of that area (area limited to about a continent to begin). This can easily kill gods and spiritual beings, I didn't stutter when I said everything, please do not waste them. You will also gain the [Disaster Magic] and [Destruction Magic] skills, along with the [Meteor Storm] spell, which is a much weaker and limited but still very powerful version of this perk, plus the [Authority]. This is the only way to get the [Meteor Storm] spell in jump.,,
Boosted [Meteor Storm] - [Indestructible] [God Slayer],,1,,00,,False,,True,,Whelp, looks like you have the [Indestructible] [Skill], sorry no you're not actually indestructible. If your body is destroyed, you can continue on as an ethereal ghost, moving and even interacting with the world selectively to a large extent and you may also reconstitute yourself anytime you wish. While the protagonist can use this as much as he likes, you only get it as a one-up that can be used in tandem and combination with your other one-ups. It does provide a minor boost to all defences and resiliency through especially to your ethereal or spiritual self and aspects, say 5% and 15% respectively.%%%%Seems you've also killed a God, lucky you! don't sweat it they aren't mad about it or anything, they actually probably planned it so they could give you all this stuff. To start with, you've got the [God Slayer] title, making you much more effective against gods and god-like beings . A good portion of your resistances and defences will hold up in the face of anything including but not limited to gods, along with all of your attacks and powers over penetrating anything defence at about a 20% proportional rate.%%%%While the title is equipped you will gain a multiplier against god-like beings up to 2 against actual gods in all your abilities, aka that 20% pierce would function as a 25% pierce against greater demons, 30% against demon lords, and 40% against gods. A bit blasphemous but you can wield the clerical powers of the gods as your own, you gain a [Holy Magic] of your design or choice to represent the god you killed and you may purchase [Holy] skills, even using them against the very gods who created them, as the power originates from you now.%%%%Lasty, here have a one time lump sum of 50 levels, a fragment of an {Authority} also know as an [Authority], 5 holy "swords" ranging in power from average to well above average of any type and style you like, 10 insanely high quality magic weapons of your design, 100 handguns, 50 rifles, 10 magic-guns, 5 magic-rifles, 100 magic and enchanted or blessed dragon skin armors, 100 magic and enchanted or blessed dragon scale armors, 10,000 pieces of dragon themed weapons and jewelry of various materials upto Mythril,Hihiirokane, and even Orichalcum with strong magical effects, 20,000 pieces of scale tribe mundane weapons and armor, 10,000,000 hefty gold dragon coins (30g each) (~303 metric tonnes of 24-carat gold by weight), 40,000 Saga Empire Gold Coin (7g each), 10,000 Ancient Empire silver and copper coins, 7,000 coins of various sizes and materials from many kingdoms, and 30,000 Furu Empire crimson treasures (~15g each)(red coin philosopher's stones), the dragon gods fang, and 79,600,000 assorted items and materials such as but not limited to iron ingots, copper ingots, medicinal plants, timber, and stone, random body parts, scales, and even hole corpses of lizardmen, dragonewts, dragons, and the god you killed. (I leave the specifics to you on this),,
Reincarnator - Straight Dealing,,1,,-1000,,False,,True,,You happen to be a princess reincarnated from another world, or a demon with the face of a wolf? No problem, everyone will be far more receptive of you and your ideas, even if they buck against tradition. You won't have people discrediting your work because you just happen to have hair of an ill omen color or belong to a tribe of knife ears. Comes with a general charisma boost.,,
Reincarnator - Good thing I was a [...],,1,,-1000,,False,,True,,Well, you are a reincarnated being. Meaning you've had a past life or two. As such whenever you enter a jump including this one design a normal past life for yourself, maybe you were a school teacher, maybe you were a fisherman, an olympic athlete anything within the limits of a normal human or your race. You will gain all of the skills and experiences that come from these lives. Additionally you will find that these lives provide particularly relevant or useful experiences to your new life.,,
Reincarnator - [Multiple Personality Disorder],,1,,-2000,,False,,True,,Ok, this is getting weird, how many of you are there? Three ok, there are three of you... for now. You can now spend 30 levels whenever you want to create an independent personality, this personality's level will always be half of your ultimate total level.%%%%Aka, if you are at level 60 and spend 30 levels to create a personality you have two 30 level personalities or modes you can access. Your new total level is 90 but this comes with some caveats, first you've already spent 60 of those levels to gain two personalities. So your main personality is level 30, but your alt personalities are level 45 each. If you were to gain 50 levels , your ultimate total level would be 140, but you would be level 80 and each other personality would be 70, and you could spend 30 to be level 50 and each personality would still be 70 but you have three personalities.%%%%Second, you may design each personality as you wish when you create them and each may maintain separate memories as needed. Each personality may assign stat and skill points separately from the main you but each must maintain 50% of the points as the main you has set for each. For every 4 [Skills] you have, you will get another skill of equal quality for each other personality, which is exclusive for that personality's use. Choose 50% of your skills, titles, classes, jobs, and stats, these are held by all personalities. Once a skill is chosen it can not be changed out . Your other personalities can not have more skills than the main you. Sub skills can be completely changed out under different personalities.,,
Reincarnator - Luck of the Draw,,1,,-2000,,False,,True,,Seems like most of the reincarnated around here really get the short end of the stick, with more than half of them turning into some kind of undead monster or other, though they do get to be better than the common local. You have picked up on this and have gained an extra [Race] and slot to support it, along with two appropriate [Skills] an [Sub Skills]. This race needs to be something like undead, lich, vampire, ghost possessed armor, or even something like werewolf or something as simple as monster%%%% You will gain this monstrous form as alt forms for all of your other forms and or added traits while the [Race] is equipped. Additionally, you are just better than your monstrous peers, any racial advantages that are normally experienced by any monstrous race you happen to be a member of are significantly enhanced beyond the norm for the alpha of that race, such as your senses, speed, reflexes, and strength for a werewolf or a vampires stealth, durability, hypnosis, and charm. Any racial weakness that may be present in you significantly reduced such that vampires that could only survive two minutes in sunlight could go four minutes and only receive half the damage, even when being a super awesome vampire means you would die instantly. (You get the best of all worlds),,
Reincarnator - Without Corruption,,1,,-4000,,False,,True,,Many years into the summoning cycle, the Demon God rigged some of the [Unique Skills] given to the reincarnated. These Unique Skills eventually caused a loss of sanity with overuse and the collapse of the soul, turning the people who possessed such things into Demon Lords, with those having too many of those skills suffering the same fate. This is not the case with you. No matter which abilities, powers, perks, entities, or items you gain or wield, you will never be negatively affected by them or denied their power, whether from possessing them, being possessed by them, or from using them, or any other weird tag along inconveniences that come along with them.,,
Reincarnator - [Demon Lord],,1,,-6000,,False,,True,,Congrats, I guess? You now have the [Demon Lord] title making one of the strongest beings that plague this world. You are now a good bit more powerful than a regular [Hero] without even equipping the title. Whereas a [Hero] and [True Hero] get a major overall improvement across the board for their stats and skills, you get a mild improvement across the board but an insane boost in a specific area or archetype of your choice.%%%%You can now acquire [Demon] skills, any powers that could be described as dark, evil, unholy, or demonic are improved by about 50%, and you are equally effective at destroying and resisting the powers of dark, evil, unholy, or demonic. Equipping this title makes you much more powerful than a regular [Hero] and a good bit more powerful than a [True Hero], usually requiring a party consisting of a [Hero] and a team of similarly skilled people, all around your same level for you to be defeated and improving your powers over darkness and against light.%%%%What truly separates you from others is the absolute strangeness of your nature and powers, your very being infecting all your [Skills] and abilities mixing in strange and unique ways, having ice magic allows you to create cold fire or regen causing temporary hardening and strengthening of the flesh. Equipping this title pushes your admixtures to the extreme further reinforcing their bizarre nature and lessening their weaknesses and enhancing strengths.%%%%To show off your status as a simply better being take these 50 levels and a free [Unique Skill] (which should technically come from Demon God or consolidated miasma, but we will make an exception).,,
Boosted [Demon Lord] - [ - - - - ],,1,,00,,False,,True,,Well it seems that you have transcended the boundaries of your form and your soul has collapsed, or not as the case may be. So, many of the various demon lords' powers are centered around the manipulation and acquisition of power because their very existence is a plot to do so. You now hold all their gifts to a weakened extent.%%%%Similar to the Dog-Headed demon's abilities to steal powers or hide from detection, you will not only grow stronger from slaying creatures of the light, but may actively steal fragments of powers, abilities, and skills from anything you defeat and no acts of premonition or clairvoyance will see you coming%%%%Like the Black and Boar demons you may reduce your level and or HP/MP/SP and split off pieces of yourself to become faithful servants and summons that can go off and collect memories and experiences and power for you, able to remerge, healing you by more than double what it took to make, resists large amounts, and shapeshift to an extreme degree.%%%%Or similar to the Goblin demon's power, you can mass replicate any of the [Skills] you acquire and hand out watered down versions of them or imbue them into objects.%%%%If you want powers equal or technically greater in strength and versatility to the main demon lords mentioned here you will have to have many many [Unique skills] to cover the differences for each one. Such as these two free [Unique Skills]. These powers are not tied to your [Title] but not having it equipped will greatly reduce them further; anything you kill beyond providing the usual experience will ever so slightly strengthen the weight of your title.%%%%The last gift of this is your ability to manipulate and utilize miasma directly, growing stronger and more powerful as you take in more as your form is partially composed of the substance and acts as a vessel for it, the substance is much weaker than divinity but has a multitude of uses such as acting like a poison, corrosive agent or corrupting souls or even apostles. With enough of it you could even create monsters or demons, infuse or forge it into weapons and armor or enchantments, cast spells with it in place of mana.%%%%It's a sad fact that the Demon God doesn't have true apostles, this is due to the nature of his power but were this boost lacks the raw power provided by the other capstones upfront it makes up for it by granting you endless potential one day you to may reach the heights of the four great demon kings who live in the moon or even dare I say the Dog-Head Demon in his prime and beyond.,,
Summoned Hero - Monkey Wrench,,1,,-1000,,False,,True,,It really sucks getting pulled into another world without any say of your own and being tricked into thinking you're the good guy when in truth you are just another part of some machiavellian plot for power.%%%%No longer shall this stand, whenever someone summons you, you will have a distinct awareness of who is summoning you and why you are actually being summoned, it won't be so specific that you know what their full plan is but you'll know whether your just a decoy or stand in and whether the person who summoned you is secretly the bad guy. Works in reverse on the things you happen to summon and comes with some protections such as your charisma, willpower, and luck working in tandem to help you resist unwanted side effects of summoning or secretly undermine the other, but nothing absolute or particularly powerful.%%%%This does provide one guarantee though, you can not be ordered to kill yourself by a summoner, any attempts to do so will fail even from another effect or spell. Being summoned doesn't have to be magical, even a request will do.,,
