Name,,Type,,CP Change,,Active,,Chained,,Description,,Notes
Yggdrasill Mímameiðr,,2,,-5000,,False,,True,,A world tree all your own. This is a metaphysical-ish literal-ish tree whose roots and branches will expand into other realms on their own and to any world you travel to yourself. You can freely travel along the tree's paths to get to any other realm it is connected to. This tree will not let you travel to previous jumps until you gain a spark.%%%%You can put the tree wherever you like in each setting or keep it within your warehouse. No one can travel by way of your tree without your permission and restriction upon the paths and who can travel which ones are easy. Your tree has no limits to the number of worlds it can bridge and it can be used to bridge vast distances within a world by its roots dipping in and out of the dimensional soil so to speak.%%%%People who know what the plant is can attack it and try to break the connection of your tree to that dimension but this is incredibly difficult and would take capabilities on par with a mid level deity. The tree itself can supply you with an infinite amount of living wood to shape as needed. Its wood contains powerful protective and restorative energies and is capable of growing any plant or seed brought near.%%%%The tree acts as its own demi-sub-plane that grows larger as it grows and expands into other realms. Initially not being much more expansive than a two storey house, this subspace within and about the tree can grow infinity and could easily be the size of an average city within a few thousand years. You may look out to all its branches and roots in different realms from this subspace.%%%%As long as you are in contact with any part of the tree you are in contact with this subspace and receive its protections and blessings; this tree will survive unharmed by even the entire collapse or intentional destruction of the omniverse, time, space, space-time, fundamental forces, dimension and so forth. If such destruction of the universe or world you are on is imminent or actually occurs, you will be pulled safely and lovingly into your trees subspace, only having to wait out the birth of a new universe/ multiverse/ omniverse which the tree will guarantee happens.%%%%You may bring others to your tree's subspace and afford them these same protections as long as there will be room for them, the tree is able to support any and all life within its subspace unaging, even desperate organisms that require radically different diets and environments will be sustained hardier.%%%%This is an item capstone booster.,,
Warrior - Megingjörð,,2,,-1000,,False,,True,,A simple belt or other garment or accessory which doubles your strength and durability when worn.,,
Warrior - Hamr,,2,,-2000,,False,,True,,Multiple purchases possible%%%%?A skin, pelt, fur, feathers, bones, or mantles from an animal, any animal you like, beautifully wrote into a garment like a shall, scarf, or drapery. When worn by someone they can take on the form of that animal. You become the animal in full with all its capabilities. The capabilities of yourself and animal form do not enhance or blend (no transfering kryptonian durability to your otter form), unless you are a capstone boosted hamrammr.,,
Warrior - Mjölnir,,2,,-4000,,False,,True,,Not necessarily the Mjolnir but an indestructible weapon of equivalent power. For comparison, Mjolnir could break or repair anything it contacted, allow the user to freely wield lightning and rain, would always return to its its own, consecrate the earth, could be shrunken down to a pendant size, would grow with its wielder both in power and size (not sure how that makes sense, since it supposedly could break anything) and act as a magic catalyst. You may import a weapon into this position.,,
Warrior - Óðrœrir,,2,,-6000,,False,,True,,The mead of poetry. Raw divine inspiration in liquid form. It tastes of perfection, the ideal beer or mead to fill those who partake of its splendor. The pinnacle of drink and drug, it can be better than alcohol, pcp, heroine, nzt, molly, acid, felix felicis, super soldier serum, Kick, and pure happiness, creativity, and luck rolled into one and tripled in strength without any of the drawbacks if you like.%%%%Anyone who is under its effects is a hamrammr. You may determine what benefits within this context it provides as you pour it. You will receive one well made and to your tastes jar every 27 days, enough for 9 people to drink to their heart's content for 9 hours. As this is equally a metaphor you could receive the benefits from just a sip, or poured over someone, if your a god of weather or simply tall enough, just add it to the rain. It may not even be a liquid or could just be water with a few drops of...%%%%%%Capstone boosted:%%You will receive a jar carved from Yggdrasil itself with a never ending supply of the sacred drink. You could turn this jar and pour out rivers or lakes in a moment or plunge it into and drain the whole ocean away. Through the gift of the world tree you could poor it straight into the minds or cups of those you you choose within the places you hold power, blessing them with its gift or curse them with savagery and madness or forced transformation into beasts or monsters like werewolves.,,
Trickster - Draupnir,,2,,-1000,,False,,True,,A simple but elegant ring of pure gold. Once every 9 days you may have it drop 8 equal rings that do not replicate. You may store the extra rings within this ring. You may freely change the metal into any natural real world pure metal or alloy you like. You may touch this ring to any pure metal and or alloy and have it become that metal; it will remember the metals it has touched so you can freely change it later.,,
Trickster - Brísingamen,,2,,-2000,,False,,True,,Multiple purchases possible%%%%?A necklace, pendant, or really any jewelry or accessory of your choice. This is the single most beautiful item in all of existence, it is inherently mesmerizing to look at, to the point that other people in the middle of a movie premier might keep taking glances at you, you can tone down this attention at will. Whoever wears this item will instantly appear to have more authority, royalty, charm, charisma, and beauty, to the point you could wear a literal used brown trash bag covered in a dead skunk and baby vomit, and everyone would say that you were the best dressed best smelling person there.%%%%But the real secret of this item is its value. It is priceless with a big T truth. You may give this item as payment for any one thing and it will be accepted no questions asked. You need 1,000,000 million pure human souls, an eternally lost golden lama, and a copy of the unreleased manuscript that doesn't exist yet to get that deal with satan going? This will cover it. Enemy army shows up demanding 100 young men and all your food to spare your land? This will cover. But what's really nifty is that it will always return to you. The more expensive or bigger the purchase, the longer it will take to return, but it will never take more than 9 years to return.,,
Trickster - Gleipnir,,2,,-4000,,False,,True,,Like the ribbons and chains used to bind Fenrir, you are being given three chains, ribbons, or ropes of binding. These three bindings will accomodate any size you wish can can be used to bind people, objects, things, personified ideas, and cosmic entities, gods, universes, dimensions, and realms, really anything with a "body" can be contained. They are composed of literally impossible things and metaphorical ideas, functionally being as light and strong as needed.%%%%Unlike the originals, these bindings can never be broken or undone by that which is bound, in fact only you can undo these bindings and they are indestructible and impassible in any way. They will completely seal the person from influencing the world in any way if you so desire. They can be as comfortable or as uncomfortable as you desire, short of actual torture, and any time they are used "in bed" they will greatly "enhance" all involved experiences.%%%%You may simply will them to undo themselves so that you can not be trapped by them in any way if you don't want to be.,,
Trickster - Mistilteinn,,2,,-6000,,False,,True,,A missle or arrow or spear or even sword of some kind made from a simple living wood or plant. It will function perfectly as any kind of mundane projectile bolt, bow, piercing, or slashing weapon, being the perfect version of it in any way by mortal standards. The weapon is unbreakable but will bend or behave as the finest possible weapon of its type. At will, this weapon can be sacrificed to pierce and kill anyone or anything; If lent out, this feature can only be used at your discretion. You will receive one of these every 9 years and you may freely change what type of weapon each is.%%%%%%Capstone boosed:%%The weapons provided by this perk are now carved from yggdrasil and full of life. They can be of any type of martial armament you like, shields, polearms, or even hammers. They carry any and all magics and enchantments superbly well, can be recalled back to their wielder, are impossibly sharp and accurate, both as light as the lightest wood in hand and as hefty as the densest metal.%%%%They are dancing armaments able to act like Andu's arrow, or guard, parry, and protect you as if wielded by a phantom of your own skill level. As they are now full of life, you may sacrifice a weapon to completely heal or raise from the dead one sentient souled being to the way it was before it died or up to an entire forest of life, flora, fana, and all even into its youth.%%%%You may now throw out your weapon into the world and it will travel to any realm your yggdrasil touches to strike down or raise your chosen target, always knowing where to go. You will receive a weapon every 9 moons, 243 days.,,
Healer - Skíðblaðnir,,2,,-1000,,False,,True,,Marvels of engineering, a glorious ship capable of carrying you and your whole clan in luxury for war unfolding to be as big as is needed. This ship can fold into a thin wood block able to fit in a pocket, and be thrown out to unfurl itself, there are no limits to its weight and plunder, and it can glide like a misty ghost across land and sea as if it always had a favorable wind.,,
Healer - Gullinbursti,,2,,-2000,,False,,True,,Multiple purchases possible%%%%?The great golden boar. The ultimate mount, a giant golden boar proportional as a mount to your true size but can shrink as needed for other forms. It can be any animal of your choosing, doesn't even have to be made of gold, could be flesh or platinum, and can be any naturally occurring animal like a giant moth or a whale, even something like a pegasus or griffin is fair game.%%%%It will always be at least 3 times faster than you and can easily get past obstacles and rough terrain. It will reflect your divine power and strength, having minor gifts based on your powers and nature, as a god of strength it could break mountains or if a god of wind it could bring forth the scent of far off lands and act as a herald for you. Being in this animal's presence will protect you and anyone you choose from any natural environmental dangers, and I mean any. You could set up camp or swim through an active volcano, outer space, the sun itself and say what a nice cool breeze we are having even if there is no air at all.%%%%It can fly under its own power even without wings, swim, and run even though air and water. It will never tire of fatigue from travel. It is incredibly smart and infinitely loving toward you, while it does have its own personality so you can't force it to like other people, it is obedient to a fault and can never be turned against you magically divinely or otherwise. Does not need food, or air, or sleep, but it can do all those things.%%%%Powers you wield while mounted upon your beast are nine fold more impressive in how they appear and present, but no discernible increase in actual strength. It can not grow sick, be poised, or killed, if it would be it will just vanish. It can be summoned or dismissed from your side instantly and functions like any familiar would. Trained for war and able to fight like an animal of its species. It comes with an equally spectacular chariot if you so like.,,
Healer - Iðunn,,2,,-4000,,False,,True,,Every moon or 27 days, you will receive an amazingly carved crate of stone or wood, elegantly inlaid and treated (a treasure in its own right) filled with 9 golden fruits of your choice. These fruits will wash away the years and return youth to those who eat from them. Each fruit will restore 9 years of youth, not just in body but in mind and spirit. You will retain your knowledge, wisdom, and joy, but it can carry away the pain, sorrows, hatred, and weariness of the age. These years can be saved up if you do not wish to grow any younger.%%%%The apples can be used to condemn others if you so choose, wiping out all 9 years of memories or any number of memories from within, or forcing a person into youth or unbirth, or condemning a person to a death like sleep for 9 years, with multiple fruits stacking or conditions set as your choice. No matter what though the fruits are the best tasting of their kind that have ever existed even by the standards of gods and can be distilled into heavenly wines, and juices, cakes, and pies each easily able to make or improve such items. A single apple could make a single bottle of wine or pie or 9 or more bottles providing a divisible amount somehow.%%%%If you took the seeds from these (if you want them to have any) you could grow far more normal silver plants of these fruits that hold all the flavor of their divine counterpart growing only where and how you wish them. The cases that you receive could be used to preserve anything that is within, restoring them and maintaining them unaging and unharmed. The cases can hold metaphysical things such as the memories of those you've taken with your fruits or or like pandora's boxes, the evils of the world, or all the anger to be released as you choose.,,
Healer - Ginnungagap,,2,,-6000,,False,,True,,An empty land, a place all your own, either within one of the nine realms or close by, connected through the world tree. This place is yours, as a mortal it would be a kingdom, as a god, a full realm equal to the other nine. It will start in a state of your choosing with buildings, halls, ports, towns, cities, and natural features however you like. It may even be populated by a race like yours, as a mortal of other skin, as an elf of similar stock, or a new tribe of gods equal to the others depending on what you chose to be.%%%%You are free to change the place over time, within your power. You make the laws of this land and can bar entry as you so choose, the people and denizens of this land will never revolt against you or attempt to harm you but they may try to leave and if you kill them all off they won't be able to repopulate. This is a private dimension and like how the asgardians use the bifrost to move from realm to realm you can always open a "bridge" into your realm and return to this home, permanent bridges or paths to and from your realm can be established or destroyed at your leisure.%%%%%%Capstone boosted:%%Not enough I see, you want your own entire cosmology. You are now a dimension lord with over 9 full dimensions or realms connected through your Yggdrasil tree as you see fit. Like any dimension lord you are safe within your realms and nigh-omnipotent. Each realm can be its own ever expanding universe like our real world, or a fantasy keep disk upon a turtle's back, or simply a floating city any way you like them. They will be mostly mundane, based on normality within norse myth, but with every jump you visit the realms can freely pick up new features as you desire. If you went to marvel, vibranium, adamantine, and uru would be available within your realms or mythril if you went to a Tolkien setting. Any substances you would purchase from those jumps in the future could be provided to you in endless amounts over time.\%%%%You can not take out anything from your realms into the main jumps that you have created with your nigh-omnipotent gifts within your realms, unless you have your spark. That includes cheating at any part such as just making a bunch of new vibranium bricks appear before you, or even locating the materials in the wild or saying your whole realm is just made of vibranium. As long as you are just using your non-dimension lord powers, perks, gifts, skills, and tools from this or other jumps the items or army you craft and build are fair game to take into the normal universes. Your realms can take on properties not just materials, from new jumps, such as dimensions composed of magic particles, or that are constantly suffusing negative matter, but you can not alter it from how those universes actually behave in their jumps without it being counted as using you nigh-omnipotence within your dimensions.,,
Teacher - Sæhrímnir,,2,,-1000,,False,,True,,Hamingja required%%%%?The great feast. With not even a gesture, full place settings, fresh food and drink, tables, chairs, servers, acutamon, and entertainment shall be brought forth or dismissed into the aether. Any food, drink, or festive joys you have ever tried can be created on a whim, filling with all the nourishment the body needs and never making one fat beyond their desires but leaving the person everable to be an endless glutton if they so choose.%%%%Sustenance for 3 days is provided at the meals leave to those who took even a single bite. No magical or special properties of any foods carry beyond taste, but the foods clear all stomach or further down pains and ails. You have now tasted from all the greatest dining options in the nine realms and could feed an endless army with this.,,
Teacher - Gjallarhorn,,2,,-2000,,False,,True,,Hamingja required, multiple purchases possible%%%%?A great and terrifying horn of amazing make, or any instrument of your choice. First, the instrument is of the highest make and quality and able to perform perfectly as it was intended, even on its own as if the greatest instrumentalist of the time was wielding it in ghostly form.%%%%Second, choose a season, climate, and weather. At anytime, you or someone chosen can "call" through this horn a sound that would reverberate through the realms ushering in the chosen states for three full seasons unending unless dismissed through a second call or limited by intent.%%%%Third, you or a chosen could perform a call though your horn as an alarm that any of your choosing may hear throughout all the realms, instantly conveying the intent of the call.%%%%Forth, you may through a "call" summon an army of lesser beings to your side 3 generals and or advisors, 9 elite officers, 27 berserkers or specialist, and 81 soldiers. Fifth, the instruments may be used to enhance song or lyrical magic by 3 fold and put people to sleep. You gain the skills to craft expert instruments that can play themselves.,,
Teacher - Svalinn,,2,,-4000,,False,,True,,Hamingja required%%%%?A shield that could put the great hammer of Thor to shame. Indestructible and able to reflect all force, power, damage, and harm back on its attackers while remaining completely unmovable except by it wielder or owner. The shield is a dancing weapon and able to return at will to its owner, resizing itself for its owners needs. Raising it could protect the world from the full force of the sun, absorbing its power for other uses or scattering it to the winds, able to raise it to the sky and cast shade upon the world. Its wielder holding power and control over the wind, snow, ice, and shadow, it acts as a dark mirror to a certain sword.,,
Teacher - Mímisbrunnr,,2,,-6000,,False,,True,,Hamingja required%%%%?The head of a man, a crystal skull, a glowing ball of light, a big white rock, whatever you want this to appear as it does so. This thing contains all the knowledge of the world your are in, every story, every version of the story whether lost or otherwise it has. It knows the location of every great artifact and the names of every family member of every clan, all the best ways to raise animals, forge weapons, or built boats, or be a good leader. It knows what everyone has said on the matter, the only things it doesn't know is what's going on inside people's minds.%%%%It doesn't know why Janet killed Todd, it only knows that Janet said she loved him before stabbing him with a spatula in the groin under the bonanza last friday while she cried. It has full knowledge of everything anyone has said or done, painted , or crafted, and can tell you all these things, but things fully in the mind are beyond it. It is able to compile information and make inferences and new advice based on that, but it is limited by what people within the world have done. It could not tell you the best way to forge steel, it can tell you the best way to forge steel based on the combined work of all the blacksmiths who have ever lived in this world, meaning it can be wrong, thereby making it the best teacher available in some respects.%%%%It would be able to make reasonable inferences like substituting in a new material never used before based on past information and know properties but it won't necessarily be correct. It will update with new information on each world you can travel to and recall anything it has ever known. It only communicates through sound or sound directly into your mind, but it can be used to functional spy on anyone in the world in real time. It wants to be helpful, and is really good at retelling stories in different styles or voices and it does happen to have all the senses in a way.%%%%This stone will protect you and any decently sized area based on distance of your choice from remote viewing and listening, scrying, divination, postcognition, clairvoyance, mind reading, control, or illusions including but not limited to magical, psionic, technological, or divine means.%%%%%%Capstone boosted:%%You will gain 9 more stones to use as you wish, including remote walking talkies and the like. The stones answer to you and can be limited in their functionality as you see fit. They will count as points of presence and power for you to exert your will. They are indestructible, inmutable, and unmovable as you desire.%%%%The limitations on sound only communication is removed and they can be used for remote viewing and scrying as you see fit and they know what is happening in the minds of others and how they truly feel and think, if your means of perception is greater than the worlds they are upon, the stones means of perception will be 3 times greater than your eye, you can already see what going on 3 galaxies over, so can the stones and they will pick up knowledge accordingly. Any and all divination, scrying, and truth seeking, mind reading, astral projecting, charming, and controlling powers used through the stones are enhanced 3 fold.%%%%You will also gain a well at the base of your Yggdrasil, at the bottom of which is a lair protected and empowered as if it was a 3 fold stone onto itself and a pool of endless water. Within this pool is pure knowledge, not simply things that have happened within the universe, but the unseen mechanics of the background, and the inner workings of the cosmos. When you drink even a cup from this pool pure knowledge will come into you, before drinking you can focus this knowledge to an extent and you will be protected from losing your mind to this gain anything that would be too much for you to bear at this time just washing away.%%%%You make let others drink from this well and either have it bless them with all the protections you are afforded with such insights or curse them to gibbering insanity. You can instantly transfer any knowledge you already possess to someone else by way of this water. Drinking from this well shall grant you heimdalls sight and an ability to comprehend and perceive on a cosmic level without danger, which may be granted to others who drink. From within the well, any of your magics, powers, and gifts may be carried through the world tree to where you desire that it reaches.,,
