Name,,Type,,CP Change,,Active,,Chained,,Description,,Notes
Healer - Valkyrja,,1,,-6000,,False,,True,,Choosers of the Slain, beings of great and terrifying power most likely elevated by Odin from among the Disir to a position closer to being a minor deity than a messenger or angel(no matter how much you look the part) acting as an extension of Odin's power and will. You have equally been elevated in power and gifts to being considered among them, if you were among the Guðkunnigr you would be equal in every way to your fellow sisters of battle becoming a very minor deity of war, death, fire, weather, healing, victory, and fate. You do not simply carry the worthy among the dead to valhalla, you choose who lives or dies, the victors and losers, in mortal battles and wars under your gaiz. You and any mount you ride is gifted with flight, under your own power, far faster than you could move on foot; at any point you may or may not have a pair of powerful awe inspiring wings. At anytime you may compose yourself out of fire and sunlight. You are free; no prison, bindings, spell, or charm can hold or restrict you or your mind or soul, no barricade can block your path. You are a bridge between the realm of the living and the dead, not restricted to either. You are an unparalleled warrior even amongst the impossible standards of the gods, skilled in every weapon or art of war with strength, speed, and strategy to match. Any of your gifts and ability to wield true magic will grow to be unparalleled by mortal standards. Short of true death you may heal and cure anyone of natural any natural disease, wound, or ailment whether physical, mental , spiritual, or something more esoteric. Your beauty is beyond compare able to strike mortals dumbstruck.%%%%%%Capstone Boosted%%You are now as Freya or Frigg, beyond a minor deity, a full on goddess by your own rights. You are the most beautiful person who has ever lived, able to strike gods dumb by revealing your full glory. Your power and skills are equally enhanced and you have become a lesser personification of freedom and hope. Your magic wielding now on par with the greatest gods of magic. You can heal and cure anything natural or otherwise given enough time and raising the dead is as easy as breathing. But more importantly you are now a chooser in your own right, no longer simply able to choose the worthy dead for valhalla you can choose for any realm. You gain an innate understanding of any being, their sins, their hopes, their desires, and their worthiness. You now hold first pick and claim among the dead. Like Freyja and her hall Sessrúmnir in Fólkvangr, you gain your own afterlife within the realms to hold your dead. Like Odin, you may elevate beings to a status similar to the valkyries, granting fragments and aspects of power dependent on your own and theirs. In worlds with afterlives of their own, psychopomps will automatically consider yours valid, and any gods that rule over the dead will accept you as a peer.,,
Teacher - Mímir,,1,,1000,,False,,True,,Hamingja Required%%%%You possess a powerful mind and your memory is formidable. You cannot forget anything you have ever experienced and you can instantly recall anything you know. Your mind will never run out of space to store information and all knowledge will be indexed in its proper place without fail. Even things you have forgotten before this will fall under this effect, once more appearing in their proper place in your mind.%%%%Your intellect is also among the best in the realms. Mental and scholarly pursuits come easily and naturally to you and you have an easy time comprehending new and complex ideas as you encounter them.,,
Teacher - Gangleri Gangari,,1,,-2000,,False,,True,,Hamingja Required%%%%You possess the gift to traverse the nine realms and beyond. You are free, as long as you are free to journey, to journey wherever you please, no land too distant or kingdom unknown. You can even travel to places beyond physical reach given time. No tireless journey by foot or under your own power would take more than the cycle of the moon or 27 nights and upon the back of a mighty steed no journey would take more than 9. This also provides you and your steeds the stamina to survive such long treks over natural terrains without break. While this does not provide any specific safety or protection from the environment or allow you to bypass blockades, walls, gates and the like it will let you come to the edge and interact if need be and improves what capabilities you hold while journeying.%%%%,,
Teacher - Haptasnytrir Foldardróttinn,,1,,-4000,,False,,True,,Hamingja Required%%%%?Like Odin, eternal seeker of knowledge, you have a gift for learning, not simply in a sense of being able to learn faster than most, but by more esoteric means being able to locate long lost or forbidden knowledge and skills, beings who have refused prior students will never refuse you, instinctively knowing where to go and what to do to acquire more knowledge and exploit it for your advantage. Your learning speed, capacity, and intuition expanded by an order of magnitude and quests to find or locate such things equally shortened.%%%%But what good is knowledge if you cannot exploit it, you now possess the ability to teach anybody almost anything, even if they are incapable to use that knowledge. You could teach a mortal how to wield divine power to create life and they would understand exactly how it works and would be capable of doing as such if they gain the ability to wield said divine power. Whenever you teach people anything, you gain power over them and what they have learned, gaining more power over them the more you teach and the more they wield your knowledge and skills.%%%%You could teach someone to be a great fisherman, but make it so they could only catch catfish and these restrictions can be selectively applied as they teach others in a chain of learning. You could teach the world magic and runes and make it so those gifts could never be used against you, or that no matter how skilled and knowledgeable they become they are unable to teach anyone these things, their mind becoming a momentarily blank. Even a third party observing you or your students would be unable to learn anything without your permission, even something as simple as making a peanut butter and jelly sandwich, however this won't stop them from making a PB&J on their own, they just won't be able to recall how you made it if they saw you do it they literally would not associate the name of the sandwich with those ingredients.%%%%If the knowledge from you is so intrinsic to a person that it is how they make a living or is what they are know for or is used in everyday life you would have the ability to manipulate their fate similar to the Norns with lesser control based on lesser connection of that knowledge, you could manipulate the fates of an entire kingdom, world or further with this. Students under you will be able to learn what you have to teach faster as if their intelligence, talent, capacity, and learning speed was increased by an order of magnitude.%%%%You are a plotter and can easily come up with both direct and indirect ways of obtaining what you want. To your eyes obstacles look like opportunities and challengers like people bearing gifts. Moreover, when seeking something that you cannot obtain or achieve at the moment the steps and measures you must take to accomplish your will naturally fall into place in your mind given a bit of time.%%%%But plans are nothing without the will to see them done. You have that will. Your determination is such that you can ignore or power through anything that would seek to stop you, should you choose to do so. From pain to loss to uncertainty to even the greatest social pressure there is nothing that can deter you from your goals but your own judgement. This will even let you break free from unnatural mental influences with effort,,
Teacher - Seiðr,,1,,-6000,,False,,True,,Hamingja Required%%%%A powerful form of skill concerned with discerning the course of destiny and enacting their wills upon the world by viewing the Oorlog and ways of the wyrd. To do this, the practitioner relies on various means to enter a trance and travel in spirit across the Nine Realms to accomplish their intended task. This can take the form of prophecies, blessings, or curses.%%%%There are seiðr rituals for divination and clairvoyance; for seeking out the hidden, both in the secrets of the mind and in physical locations; for healing the sick; for bringing good luck; for controlling the weather; for calling game animals and fish. It can also be used for the opposite of these things – to curse an individual or an enterprise; to blight the land and make it barren; to induce illness; to tell false futures and thus to set their recipients on a road to disaster; to injure, maim and kill, in domestic disputes and especially in battle%%%%%%Capstone Boosted%%Not content with simply knowing and being one with the tapestry of fate, you sought Wisdom for the sake of knowledge, cosmic secrets, and the ability to change it; you willingly hung yourself by the neck on a branch of Yggdrasil after piercing yourself with a weapon and peered downward towards the Well of Urd at the base of the World Tree surviving in this state, teetering on the precipice between life and death for nine days and nights, until finally you were found worthy, embodying arts of fate, rune, magic and weaving with which you have now gained supernatural skill. While often used simply as a written language by mortals, the runes are truth, symbols that represent some of the most powerful forces in the cosmos. Each rune allows one who comprehends their mysteries to access, interact with, and influence the fundamental forces of the world that they represent.%%%%While Odin was initiated into runic knowledge by perceiving 18 runes, these do not represent all of the runes and Odin wields them very simplistically. Compared to the Norns, who delicately utilize the runes on a grand scale to weave fate for the nine realms in an intricate tapestry, Odin is like the first man to crudely discover fire and proceed to wage war with its strength. You now have the wisdom, knowledge, skills, and power of the three Norns and Odin in wielding the runes. You will also gain 18 of your own runes unknown and unknowable by even the Norn, unless you teach them, and the sisters may or may not be willing to pay a high price for the knowledge of even one such new rune.%%%%With this new knowledge you can use the Runes by chanting or writing them to heal emotional and bodily wounds, bind your enemies and render their weapons worthless, free yourself from constraints, put out fires, expose and banish practitioners of malevolent magic, protect those you favor in battle, wake the dead, create and preserve love, and perform many other feats like these.,,
Monster - Útan Ätt,,1,,-1000,,False,,True,,Angrboða Required%%%%?Racism? Clanism? Familyism? These kinds of groupthink, to put it lightly, are rude and wrong on so many levels. Sadly, solving those issues might not be possible, especially in a world like this. But I can give you the next best thing. You will no longer suffer by association.%%%%You will not be judged by your race, skin color, eye color, hair color, last name, who you work with or who you for. You will be judged and evaluated based solely on yourself and your own personal actions and how well they relate or are known by specific people and situations. You could work for a mass murderer but as long as you weren't do any of the actual killing or operations and were just a secretary no amount of ire will fall onto you for what the group does. As a black man in the segregated south you could walk up to a white's only hospital and they would treat you the same as any rich white land owning donator of the facility. You will always get the benefit of the doubt no matter how monsterous you look. You could be a Mccoy and have just as easy of a time proposing marriage to a Hatfield.%%%%Simply put you are immune to relational judgments, even if you are an orc or goblin elvish blades and witcher talismans wont glow to warn their master. But this also goes a bit further, if a sword requires a descendant or blood relation to a specific person to use or if dragon eggs only bond to humans, you can fill in for any of those positions just fine. In some universes Thor's hammer requires you to be worthy and this perk won't let you slide on that, Sorry.%%%%What, you want more? This origin is too expensive for something so middling? Fine. You now have a passive resistance to attacks, powers, abilities, and events, really almost anything, that does not specifically target you. The more generalized the association or intent toward you, the greater the resistance will be, but if you are the specific target no resistance is provided. If an evil wizard throws a fireball at your party trying to get rid of your team, you would get a pretty solid bonus depending on how many people in the blast radius or team you have( 50% if two of you, 65% if there are three, 75% if there are four, 80% if there are 5, and so forth). However, if that wizard was specifically trying to get rid of you and there just happens to be other people on your team or in the beast, this perk will not protect you. If someone happened to drop a nuke on your city and it wasn't done to specifically kill you, your probably walking away with barely a scratch. This will only apply to negative effect; group healers are still you best friends.,,
Monster - Hólmganga,,1,,-2000,,False,,True,,Angrboða Required%%%%?Mortal Kombat!, legalised robbery, standardized property acquisitions? whichever you prefer. You now have the power to lay a claim, whether legitimate or not, on anything you have the power to possess. In doing so, you challenge the owner to a fight to the death or concession over the claim. If you win, you own whatever the claim is over. As a mortal from these realms you may be able to, at most, lay claim to an entire kingdom or a title that someone possesses, but as a higher being you could lay claim to more metaphysical things such as a power or ability that you can trade in, or years off someone's life.%%%%You must still follow all the rites of the hólmganga, allowing an ample amount of time for an individual to respond to a claim, the respondent can substitute in a champion, and rules to the event can be negotiated. Your free to not have it be to death or even have the match over a children's card game if the other party agrees, but if no agreement can be met, the event defaults into a one on one fight to the death or concession. When making a claim over something that is owned or held by multiple people, you may have to fight them all individually, taking a piece of the claim with each victory or set up a tournament to establish a final claim. Refusal to meet your challenge grants your claim automatically.%%%%This power is backed by fiat, as your claim is true, your property or titles and powers are yours by right, but it is enforced by your metaphysical level. A mortal would have the full enforcement of the government in your claims but a god may have the enforcement of the universe itself. Killing someone as part of these rites, if they do not concede or there are no rules against it, do not constitute a crime or violation; you have the right to make these claims, though people may come to despise you for it.%%%%As a side bonus, you may always claim a trial by combat and it will be honored, even in civilised democracies, or the insanity persecutions of the salem witch trials and spanish inquisitions.,,
Monster - Utlagr Vargr,,1,,-4000,,False,,True,,Angrboða Required%%%%?Magics are often rare and misunderstood things; charms and gifts not often connected to the needs of the many, but are tied to the desires of the few. Your magic is dark and terrifying, feeding on and growing the Niþ of the world around you. ?Any dark or black magics that you wield from this or other worlds will be amplified by an order of magnitude. ?This provides you a host of talents that are subsequently enhanced by the very magic this perk provides.%%%%As only a mortal, you will be gifted with all the skills and abilities needed to be a ?well respected thief , assassin, ninja, mercenarie, murderer, bandit, marauder, and corrupt politicians, your dark magics silencing your steps and actions, enhancing the lethality of your poisons and blades, blending you into the shadows and speeding up your movements, and your speeches inciting hatred and fear as desired. As a vættir with hammingja, you would also be the epitome of the dark witch in the woods or evil sorcerer, a true mirror of entities such as Grímhildr or ?Gullveig able to curse others into illness or death, afflict with pain, sorrow, or ugliness with but a word and move as a living shadow whisking children away to their deaths, to hear your name whispered, you could raise the dead as spectors, revenants, or draugr by infusing your or their own hatred and dark desires back into their corpse.%%%%A ginnregin would have gifts allowing them to act as a poor substitute for the Grimreaper or Hel herself.,,
Monster - Rétt-ligr,,1,,-6000,,False,,True,,Angrboða Required%%%%?You are the embodiment of all the fear, hatred, envy, greed, anger, and negativity that is directed toward you. Quite literally, you hold lesser domains and personifications to a vast number of negative aspects from poison, venom, illness, plague, death and decay, to malice, shadows, darkness, sorrow, hate, war, anger and so forth. All those negative feelings, if directed at you personally, empowering you and making you stronger, the norse gods do not need worship to be mighty and neither do you, but you will grow mighter in every aspect from these negative forces and can substitute these feelings for genuine worship in all areas.%%%%You are an endless well from which these emotions may be drawn either by yourself or others. All of this darkness manifests as a curse upon any who would harm you, any being that brings harm to you in any way , either directly or indirectly, will be cursed to the same level of injury or maybe even a bit more. If you would be cut, they receive an equally detrimental injury. If they harmed your child, they and their children may be struck with bad luck and illness. But should you be killed by the influence of another or kill yourself as a sacrifice, you may declare a death curse in response. This death curse will kill anything, normally being instant, if a being is equal in power and yet has protections your curse will take no longer than nine days, a lesser being with protections may take nine hours or a greater being nine months or even up to nine years, nine months, nine days, and nine hours..., but the curse will kill them no matter who or what they are accordingly.%%%%%%Capstone Boosted%%People in this world really don't understand the big picture or their place in it, but you have an idea, a general sense of the great tapestry so to speak. Wherever you go, you now have the ability to see the great tapestry of the world and the machinations behind it. Like all that is black within the world you act as a great tide bringing the world back to its roots or sweeping aside the chaff for a new beginning.%%%%All the powers and abilities that you possess of darkness, death, poison, destruction, and so forth can now be applied equally within the realms of healing, love, growth, flowers, joy, creation, and life. The inverse is also true and your powers have expanded to make you a minor deity and personification of change, decline, renewal, and revolution.%%%%It would suck if your powers, abilities, and weapons also discriminated, I would dare say that it might be a bit hypocritical of those gifts. So, your powers don't discriminate unless you want them to do so per their normal function. Have a spell that can only resurrect or heals humans? Now it will bring back dogs, cats, dinosaurs, elfs, robots, even gods if they are within your realms of power, whatever else you want to include within a category. Engineered a plague that only kills people with brown hair, well now it can be just as effective against blondes. You are the great equalizer.,,
An Epic Soundtrack,,2,,00,,False,,True,,At any time you may have an epic soundtrack of old and new original music, just for you and your adventures, by the likes of Richard Wagner, Patrick Doyle, Brian Tyler, and Mark Mothersbaugh. It plays in your head or accompanying you in the world for all or selected people to hear wherever your power and presence may be, it always appropriate to events or just your mood and whims as needed and you can always recall previous songs and put them on record if you like.,,
Multimedia,,2,,00,,False,,True,,You will gain copies of all the poetic eddas, lost or known, both in original stone and well translated book copies, along with a couple of really cool National Geographic videos on norse mythology and the ancient germanic peoples. Also included will be any media, like books or movies or comic books, even remotely related, such as Marvel's Avengers or the TV Show Vikings or American Gods.,,
Eyepatch,,2,,00,,False,,True,,A well crafted eyepatch that makes you look at least slightly more impressive and intimidating.,,
Fylgja,,2,,-500,,False,,True,,First free, multiple purchases possible%%%%?Much like Odin's two crows, you've now picked yourself up a familiar. These spirits take the form of an animal and are intrinsically part of your being. Normally, if harm came to one's Fylgja, harm would come directly to one's own self, but you will be exempt from this and any Fylgja will just disappear and be able to be resummoned by you if harmed.%%%%Intrinsically they are part of your soul expressed into the physical world able to freely enter dreams, realms of the dead, thoughts, or other esoteric conceptual spaces carrying messages and acting as heralds. It takes a great being to even have one, and each one represents a very slight growth in your luck and power. They are able to function and benefit in any way familiar should and you can express your power through them. They are spirits and as such do not have mortal needs.%%%%You will gain one free for each hamr you possess, corresponding to that hamr, including your starting one, so everyone gets one free. Those purchased here can only be mundane animals. They can do anything a normal animal of its kind can do, they love you and are loyal because they are part of you but they are still animals. If someone tried to read your mind or soul they would find a menagerie of beasts, having a Fylgja allows you to think as that animal and grows your hamingja.,,
Mannvirðing,,2,,-500,,False,,True,,First purchase free, mupliple purchases possible%%%%?Honour. Titles can be granted for many things. This is not a seperate name, or being known as a different person, this is simply something you are known for. Choose a title for yourself, you will be known for this or as a monikr. Invoking this claim to fame will have sway in certain circles, but be wary, your titles will become connected to each other. You will become known for all your deeds and where one title may have brought allies before, the attachment of another may harm your reputation with the same people, may be best to go with neutral titles, "giant slayer" may be a problem down the line. Each title represents a growth in your power, luck, fame, and your hamingja.,,
Disir,,2,,-1000,,False,,True,,Multiple purchases possible%%%%?You've got a minor divine being in your corner. As a mortal or lesser spirit, this being will act as a very involved guardian angel able to be summoned or dismissed at will, protecting you from harm and dispensing advice. It is as if wonder woman was protecting you and only you, or whatever you ask them to protect, such as a land or treasure. As a greater being, they will still function in their old capacity, but will also act as humble servants, friends, or agents at you discretion. If you have the ability to ascend beings such as make new valkyries, they may start ascended to your fullest capabilities without cost to you. They are loyal to a fault, viewing you as their charge, if you have a personality clash with one, you may freely change them out to one with a different personality.,,
