Name,,Type,,CP Change,,Active,,Chained,,Description,,Notes
Sjálfr Sjálfum Mér,,1,,-5000,,False,,True,,Whether it was by following the footsteps of Odin and hanging yourself from a branch of Yggdrasil, by killing a dragon and eating its roasted heart, or by other means, you have obtained Wisdom. As a result your sight has expanded beyond mundane perception. You can now, with focus, reach out with your senses to perceive the past, present and future, and realms beyond. How far you can see varies depending on many factors and what is near is easier to see than what is far away but with sufficient knowledge, power, experience and a very good vantage point, you will one day be capable of seeing the entirety of the Nine Realms and beyond.%%%%Wisdom fertilized you and caused you to change in ways that cannot be easily measured or explained. Your spiritual weight is greater now and so destiny cannot easily pull you along. On the contrary, you find it easier to enact change on its course, to a degree measured by your own power and means. No destiny is truly absolute when you are involved.%%%%This is a perk capstone booster.,,
Warrior - Hreysti Vægher,,1,,-1000,,False,,True,,You possess two qualities that separate a common warrior from a hero. The first is a fire in your chest. It burns through the greatest of fears and bodily pains and can drive you into eagerly achieving feats you would not have believed yourself capable of before. Where before you could have held off three men you would now have the ferocity to defeat them. It would take strong unnatural influences to make your spirit waver.%%%%But valor alone can lead to an early grave and so you also possess the discipline to accurately assess your surroundings and your own limits and to keep a cool head despite your burning heart without either diminishing the other. This also allows you to always be aware of your true feelings and desires beneath the flaring emotions of the present.,,
Warrior - Megin,,1,,-2000,,False,,True,,You are the ideal of a warrior made flesh. Not only do you have impeccable fighting instincts that allow you to instantly spot any weaknesses and opportunities present in a battlefield and fight in extreme environments, such as underwater, as easily as you can on solid ground but you also possess an indomitable physique.%%%%Your strength is great enough to fight monsters and giants barehanded and tear the weaker ones limb from limb. Your vitality so potent that you could swim through an icy ocean for days and nights non stop, fighting sea monsters all the while, as well as hold your breath for hours at a time. Your speed and reflexes are such that you could keep up with and react to some of the fiercest creatures in the realms or a small contingent of men without being overwhelmed.%%%%A mind of such keen intellect as to create and perceive ideal strategic capability, so as a force of three hundred could take on nine thousand to a stalemate, or even just one to a force of 30 times greater but less keen in thought, and write poetry of such magnitude as to be remembered for all of time.%%%%And finally, your peerless insight into the world and ability to perceive the stress points, fracture planes, or weaknesses within the physical, psychological, spiritual, or even supernatural, in all objects, persons, or even concepts or ideas around you.%%%%By striking and applying pressure at these points, you can split or shatter objects made of seemingly invincible substances or render insensate beings of far greater strength than yourself. This mental discipline is virtually effortless even in the heat of battle. It won't necessarily give you the means to leverage these weaknesses against your target, and it absolutely won't create a weakness where there was none, but this skill is formidable and can be used more generally to build better structure, forge weaknesses out of weapons and armor, or perceive the failings in society so as to act as a better ruler.,,
Warrior - Baldr,,1,,-4000,,False,,True,,The bold and the beautiful. First the bold, choose an archetype like hero of the people, eternal guardian, black knight, super villain, or even mundane things like substitute teacher. You will know how to act, talk, and behave to present this image perfectly; the expectations and stereotypes of the role and how to subvert them; how to promote your personal reputation and fame while filling or subverting this role.%%%%You will have or quickly gain all the skills necessary to fill this role and when and how to use them most effectively. You will be perceived as the ideal embodiment of this position to the point that you can easily take advantage of the presumptions of others who will not believe you to step out of this role. This is culture and setting specific so a villain in norse myth will be very different than a villain in a james bond movie.%%%%You don't just have the ability to subvert this role though, if you find aspects of this role disagree able through your action and presentaion the role will change in time to your ideal; feel like monologuing in a James Bond setting is dumb and the villains over time will take after your example and stop. It might take time but the idea of a supervillain could be shifted to overtaking the position of an anti-hero in the same vein as the role shift seen in Megamind. If you soften the archetype of the super villain - such as to forbid killing - there will be a minor compulsion and peer pressure for others to change their ways, with those refusing to change being considered less villains and maybe just idiots and douchebags.%%%%You have leeway for your actions to subvert or actually shift the role; even if not the most powerfull or strongest or most feared you will be the standard to which all others of that archetype are held. This will never hinder you and can be toggled on and off in part or whole as needed, just walking into a bank they may not assume you are there to rob it, or they may and be terrified but wont jump the gun and kick you out or call the cops until you actually do something.%%%%You know how to make your boasts truly impressive and inspiring, how to approach challenges to earn as much glory as can be had from them and how to skillfully rebuke naysayers without provoking undue ire. You can live as a warrior while making society and the law work for you rather than against you and these skills continue to work on any society no matter how removed they may be from the mythic Norse culture.%%%%Every new universe/jump you visit you may choose a new archetype, retaining all your skills and abilities and knowhow from the old one but it not being attached to your identity within the new place.%%%%%%Second, Beauty. Beauty is not a matter of appearance, it is a skill in grace and you are most graceful. Under the geas of your appearance no challenge is impossible, nothing truly beyond your reach. Any challenge or quest issued that you answer, even if it would have previously been truly impossible, is now ever so slightly within the realm of your capabilities. But sometimes that is not enough, sometimes the ugly resort to cheating and this can not be permitted as it would tarnish such victories.%%%%Within your purview the acts of others cheating simply fails, sabotage will undo itself, riging will, those committed to sweep their own or throw a match will find that they wish to be as beautiful as you and act with grace and distinction; all forms of others cheating will fail without exception and darkness will be exposed. Your beauty casts doubt upon those who, with darkness in their heart, come for you; they are compelled to honor, less likely to strike you from the back or attempt to poison your drink, harbor dark plots, conspiracies may crumble, and if someone succeeds in such villainy, never shall they go without exposure to the light of day.,,
Warrior - Hamrammr,,1,,-6000,,False,,True,,You have achieved unification with a spirit of wilderness by ritual communion with nature. While the most common choices for warriors were to be Berserkir (Bear), Úlfhéðnar (Wolf), or Svinfylking (Boars), you are free to choose any animal to build your shamanic state off of. No matter the animal you choose, the benefits are great as you become one with your inner animal spirit, representative of all of the strengths, nature, and capabilities of the Hamr it possesses.%%%%You are now a bridge between civilization and wilderness, one with the natural order, able to be in the balance with nature and understand disturbances in the great tapestry, both their causes and solutions. This perception expands into perceiving the role of man and how your two conflicting natures can complement each other.%%%%Talents of magic and skill that you wield dealing with hunting, agriculture, animal care, survival, and nature are doubled and you have unnerant instincts and ease in learning and developing these skills. Your wild instincts and senses are honed to a razor edge beyond what was previously capable for you, while all your instincts and senses are improved, one or two are now beyond compare, eyes of an eagle, the smell of a wolf, or so forth; you have a preternatural ability to sense danger and even the most carefully hidden aggression. Navigating through and surviving in the wilderness is second nature to you, even the most inhospitable locations are merely inconvenient as long as it's possible for a species to survive in them. You have gained an animal magnetism and the ability to understand and commune with animals of shared spirit and they with you.%%%%Much like your senses and instincts, all of your physical capabilities are improved, with one based on your hamr of choice becoming the thing of legends: strength for bears, agility or speed for wolves, and stamina or endurance for boars as just a few examples. You gain the ability to enter a battle frenzy to receive the sacred gift of ÓÐR, divine ecstasy, fury, and inspiration. Óðr is the source of poetic inspiration and philosophical insight as well as battle frenzy, with all of its grotesqueness and violence, is of a rarefied poetic sort – and, being a gift from the divine, it is inherently sacred.%%%%While in this state you are capable of fighting with supernatural ferocity as blows are turned away by the force of your spirit and your physical capabilities become several times greater. From within this state comes an endless rage as crazed as hungry wolves and as strong as mother bears, biting shields and slaying men, while you are harmed by neither fire nor iron, you can draw upon the unbridled wrath of nature itself within you and direct it towards your ends.%%%%You obtain the ability to become one with your inner beast. You can don the hamr of an animal and assume its form. Increasing your physical attributes and capabilities proportionally to the difference between the animal and a normal human. You can also astrally project yourself or your wilderness spirit through the realms and and even into dreams, having a vague awareness of what your other experiences till you rejoin.%%%%%%Capstone Boosted%%No longer simply hamrammr, you are eigi einhamr and able to hamhleypa or walk out of your own skin, instead of simply being able simply astral project out of your own body, you may take the hamr with you able to manifest both physically and spiritually or have your animal spirits do the same each hamr adding to your wilderness spirits, each one you, each one able to manifest separately.%%%%Unlike before where you had a vague awareness of your others, you are all now perfectly aware of yourself. You also gain another Hamr of your choice with all the benefits that would entail, this will apply to any hamr you later purchase in the item section. You are now able to clearly commune with all of nature, not just the animals and plants but with streams, rocks, and the breeze, while this may seem like an easy task the gods, most gods are only able to commune with some aspects with very few such as Frigg and Freyja able to communicate with all.%%%%You have obtained Wisdom by eating the roasted heart of a slain dragon. But before you did so you bathed in the dragon's blood, making your flesh invulnerable to physical damage. No mundane force can pierce you, to deal damage or to harm; regardless of scale, any damage would have to come from non-physical, divine, or magical sources.%%%%While bathing in the dragon's blood you drank from it, granting you understanding and the ability to speak the language of birds. Birds you speak to gain insight into the more subtle dangers approaching your person and are compelled to warn you of such threats and try to intervene. Simple understanding of this language imparts you words with greater weight and meaning, more easily swaying those with your tongue and enhancing all magics and abilities cast through the medium of sound song and story and actually using the language is even greater still.%%%%Lastly you have gained the Hamr of a great dragon, a titanic wurm on par with Fáfnir capable of flight, moving mountains, raising castles, turning kingdoms to ash, or poisoning the land itself. Your mortal physicality doubled again, but your transformed selves an order of magnitude greater still as the dragon wields the pinnacle of all hamr.,,
Trickster - Inspired,,1,,-1000,,False,,True,,You possess a natural wit and cunning that would leave the ordinary man dumbfounded. As long as it's possible you can often think your way past the most vexing problems on the fly and flashes of inspiration often lead you to surprising and unorthodox but effective solutions.%%%%,,
Trickster - Vixla Hömum Skipta Hömum,,1,,-2000,,False,,True,,Many beings change hamr in different ways for different reasons, but now you have a gift of forms unseen by most. You could live freely as an otter or a tree or rest as a stone beside the sea if you so enjoyed with none the wiser, any natural form within this world you wish to take is yours even so as to appear to be as someone else. You could grow to be a giant or dragon in size and shape but your strength and gifts would not grow with it, only ever as powerful as you were. As a man you could be a full woman and bear children or as a woman be a man and provide seed, even as other species.%%%%This provides a mastery of disguise, cloak, and dagger, even when not using this gift to take form, and a mastery to remain hidden beyond even Heimdall's gaze and prying eyes.,,
Trickster - At Inom Hvíta Helga Steini,,1,,-4000,,False,,True,,?The art of a deal and a debt. You now have learned and hold an intuitive knowledge and understanding of deals, gambles, contracts, oaths, truths and half-truth, prices, debts, bargains, trades, exploits, loopholes, laws, and all manner of such things that would make the like of any demon or trickster god like Mephistopheles stare in bewilderment of such prodigious genius.%%%%You know how to take advantage of this gift and the buttons to push in people to exploit them. But what good is a deal without the means to enforce such arrangements? All deals that you partake in are backed by fate, chance, the world, the powers that be and probability in greater proportions than your own.%%%%As a mortal commoner, the king and his army or perhaps even some elves or a Disir would get involved to enforce such a deal, as one of the Vanir all of mother earth would rush to enforce, the wrath of all of nature, the spirits, the valkyries and fate itself, if the scope of your power were beyond that even omnipotent beings could be trapped, bound, and cursed by a contract with you.%%%%That's not to say such overt displays of enforcement are necessary, it's simply an example of the backing you possess. What's more is this perview extends to any deal made in your presence when you so desire, off handed, handshaken, simply spoken, or otherwise; if a drunken man at a bar absently says he would give his wife and farm for just one more drink and you hear it, it's a deal and all that was promised is yours or someone elses for one more drink if you so wish to enforce it.%%%%These insurances do not apply against you, however if you don't follow through with your end this backing will not be there and if you break other peoples' deals enough you may become known as an oathbreaker and cheat so no one will want to deal with you.%%%%Oaths were so valued among the gods that Odin asked his friend at a gathering to stand up and give his seat to Loki, who had just killed his son Baldr not long before, so that they could drink together because in their youth Odin said he would not sit and drink in revelry if Loki was not afforded such opportunity also, this level of compulsion is present in all your dealings.,,
Trickster - Afarkaup Avarkostir,,1,,-6000,,False,,True,,Everything has a price in norse mythology and there is no means around that, but the price is sometimes negotiable or able to be paid by others, and you have already paid a great price it seems and in return this gift. The cost for you will be reduced by an order of 3 and your gains will be increased by an order of 3. The cost of what? Anything within reason really.%%%%If you went to purchase a cow for 50 gold, you'd hand over 17gold and get 3 cows instead or one cow that was 3 times better. How does that work; like, where do the extra cows come from? Seriously, just roll with it. If you were crafting a sword it would take up a third of the material and you might get three copies of it; it would take a third of the time to craft and be of three times higher quality. You can not cycle items this way by repurchasing something that has been acquired, enhanced, multiplied, or made through this, but god help the money markets as it's still fairly exploitable.%%%%Working out for an hour will take 20 minutes and only a third of the stamina and provide growth as if you worked out for three hours and received 3 times the gains per hour. While it can never reduce your cp cost, purchasing things like levels in an rpg setting with exp, items, or cp will grant you 3 times the amount, it functions as you please either in a gestalt fashion or increasing your capacity for hard limits and levels by an order of 3. You will receive 3 of any item purchased with cp.%%%%The costs you pay are now indifferent to the specifications, if you make a contract with a demon for your soul, you can substitute in anyone else's unless there are other stipulations like a powerful or good soul, if the specifications are for unique items or things so rare they might as well be, you may all but ignore such specificities with even a glancing notion of an attempt for equivalency. The ability to substitute is in direct proportion to how specific the deal is meant to be, how rare the thing being paid is, and how personal it is to you; something like gold you may MAY be able to switch out for jewels gemstones and other currencies if the dealer isn't a stickler but you could not switch out for fool's gold and receive the benefits of this perk, an heirloom magic necklace thats been in your family for generations could be switched out for a necklace of similar craft and make containing some magic blessings. This will not stop people from noticing a substitution has been made or getting miffed about it, but the deal will be considered valid if you try to stay within reason.%%%%%%Capstone Boosted%%Everything and everyone has a price and you know exactly what it is in a dollar figure or some other form of currency and trade. If no one has the authority to sell something to you, the cost can be sacrificed as a kind of ritual removing it from the world.%%%%Everyone knows what you've purchased is yours and you know if someone tries to steal your stuff. This extends to services also but it can't force someone to do something if they absolutely wouldn't do it under any circumstances, otherwise, you know exactly how much this service costs, unless it involves selling you something, then they have to sell it. As a nice aside you no longer need to track down the owner of the items, just yell out in the museum that you are purchasing a painting and just like batman acquiring a fancy hotel on a whim it will work itself out.%%%%You hold power over the things you own and may wield them completely and freely as you wish. You may place any arbitrary restrictions on that which you own and it can never be used against you unless you permit it to be so; all that is yours can be revoked and returned to you with ease. Objects, ideas, powers, gifts, thoughts, and skills acquired on loan or temporary trade count as yours for the full duration of the deal and can not be revoked and under deals or offers set for indeterminate durations they are permanent and irrevocable even if the contract is violated as they are now yours completely and utterly, I pity the fool who lets you borrow their hammer.,,
Healer - Bældæg,,1,,-1000,,False,,True,,Many believe some of the greatest gifts you can receive are love and happiness. No matter who it is, no matter where you go, people will have a great first impression of you and tend to like you. The more negative or abrasive aspects of your personality behavior will be immediately shunted in their minds like your friends who have gotten used to the fact that you always talk to loud or are a bit pushy.%%%%This is not a cure all, if your personality and someone else's don't gel this will not force true friendship, but it's a better start than almost anyone in real life gets. No more will someone be irritated with you simply because you showed up on their work break and people will always give you the benefit of the doubt. Becoming a celebrity is going to be way easier.%%%%But on a more personal note, if you've ever wondered how some people can just be carefree and happy you've now got that gift scalable and toggleable at will, reignite your childhood sense of joy and wonder at will. You may optionally give off light and glow soothing warmth at will, enough for you to not to have to worry about needing a camp fire on mount everest for you and some close friends.,,
Healer - Fjölkyngi,,1,,-2000,,False,,True,,Magic, True Magic in the world of Norse myth is telling a lie so convincing the world has no choice but to listen. Well that is what a certain version of Loki says and, funnily enough, he is not that wrong. Songs, music, stories, poetry, art, and oaths all have power. They have the power to change the world both figuratively and literally. The gift of magic combines multiple skills together and through will and power it enacts change.%%%%You have gained a gift and talent for using magic, which most mortals can not perform. Odin is particularly adept at songs to change the hearts of men to turn them into great burning warriors with skin stronger than iron and swoo women to his will. Frigg used this art to request oaths on behalf of her son protecting him from all harm and soothing fires in minds and homes. Because there is no better healer than preventing harm in the first place, you are particularly adept at that kind of magic.,,
Healer - Véurr Véoðr Vingþórr,,1,,-4000,,False,,True,,?Hallower. Thor is often thought of as a war god and he is, but he is much more. Thor is also the god of purification. You now hold this power, you can break any curse, wash away any poison (yes, norse mythology is full of irony), burn away any disease, consecrate any land or sustenance, refine any metal, or even clean the environment. You may do this in a similar manner to Thor.%%%%Choose a destructive element like ice, lightning, or fire, you gain control over this element and may wield it like Thor wields lighting, you may break things and purify them with your element then restore them except now cleansed. This also may mend or repair things, objects, places, and the like freely, but it can not replace what is lost. You may even perform this action on souls. Or you may be kind and skip the destructive part of your cleansing.%%%%Things you have consecrated could be considered holy or sacred, lands will become more verdant, bodies more vital, metals more mystical. All these abilities grow with your power over your chosen element.%%%%Oh , as an aside you can freely ordain marriages with the full backing of the universe no questions asked mister preacherman. It will be accepted as legal, even where it normally wouldn’t be.,,
