Name,,Type,,CP Change,,Active,,Chained,,Description,,Notes
Starting CP,,6,,10000,,True,,False,,,,
Location,,0,,500,,False,,False,,Niflheim, Primordial Realm of Darkness, Cold, Mist, and Ice. Within this realm lie the frozen rivers of Élivágar and the well of Hvergelmir, from which all the rivers run. Niflheim was the second realm to come into being after Muspelheim.%%%%Muspelheim, Primordial Realm of Fire. Home of the Fire Giants. This world is ruled by Surtr and it was the first realm to come into being from the void, with the following seven being made by the gods.%%%%Asgard, Realm of the Aesir. The realm of order and civilization that would come to be ruled by the god ?Óðinn. Asgard is the realm of the Aesir gods and it is a place that exists within the boundaries of law and custom. This realm exists at the top of Yggdrasil and it is connected to Midgard by the rainbow bridge Bifrost. Here lies Valhalla.%%%%Álfheimr, Realm of the Bright Elves. A gracious realm of light and beauty. This realm is ruled by the Vanir god Freyr.%%%%Midgard, Realm of Men. Forged from the corpse of Ymir, located in the middle of the World Tree, it is surrounded by a great ocean and all the other realms. This is the home of mortals. While it was fenced off from the other wilder, more dangerous realms by the gods there are places where the realms intersect and so it is still possible for things to find their way in, or out.%%%%Niðavellir, Realm of the Dwarves. Upon dark fields a dwelling stands forged by halls of red gold and within rests the ?dvergar hold? Sindri the ?Myrkheim, shelter of valorous dead. In these halls shall dwell good men and pure in heart.%%%%Svartalfheim, Realm of the Black Elves. A labyrinthine, subterranean complex of tunnels, caves, and mines.%%%%Jötunheimr, also known as Utgard, Realm of the Giants. The realm of wilderness beyond the boundaries of order and civilization. Jotunheim is the land of the Jötnar, the so called Giants; it is a chaotic place full of anarchy and chaos of untamed nature. This realm can be said to 'surround' Midgard so a lucky explorer may eventually find his way there from here.%%%%Vanaheimr, Realm of the Vanir. This is a fertile land full of life located ‘west’ of Asgard through Yggdrasil. Many practitioners of magic, and even Seiðr, make their home here. Step lightly.%%%%Free Choice - You may choose anywhere in the realms of Yggdrasil or even some place like Ginnungagap, the primordial void, if you want to be bored for a while.,,
Backgrounds and History,,0,,00,,False,,False,,People come from all walks of life. What’s your story? Any of these backgrounds can be taken as a drop in, with no history or memories. You may begin at any time.,,
Warrior,,0,,00,,False,,False,,Whether a hero of legend, a soldier of war or fortune, alone or in a vast army, or a veteran of strife, you shall be the rock that does not wither upon the shore. As a romantic idealist, the warrior poet stands alone and unblinkingly dares to do what others declare impossible. You are a skilled fighter and able gladiator prepared to face these worlds head on, trained not just on land but at sea and sail.,,
Trickster,,0,,00,,False,,False,,Politicians and entertainers alike. You have talents, not necessarily in fighting, though you will not find yourself particularly wanting there either, but in deceit, skill with hidden attacks against body and social standing alike. Sleight of hand and legalese are second nature to you and you can easily skirt about social circles from high society to the dregs of society.,,
Healer,,0,,00,,False,,False,,You have a noble spirit and a gift to mend and protect those you care for and the world itself. Trained not only in medicine and spiritual counselling to heal the hearts of man, but in agriculture and defensive fighting to guarantee its very survival.,,
Teacher,,0,,00,,False,,False,,Hamingja Required%%%%You may be or have been a traveler, wandering the lands learning all you can, discerning the different cultures of the world, trying to find a better way. You have trained to survive in lands far more foreign than simple far off shores and held tight to your skills. You know how to train others in these ways and have gained a profound sense of patience and inner calm to learn, analyse, and deal with the troubles of the world.,,
Monster,,0,,00,,False,,False,,Angrboða Required%%%%You are you. While this statement holds true for every being, this statement holds more weight in reference to you. Maybe you were a blacksmith turned into a dragon or a child born of hatred, either way no matter where you go or where you came from, you are an inevitability, written and spoken about long in advance of your arrival.%%%%People will be awed and in fear of you before you even make your presence known and once you do they will not be underwhelmed by the reality of you. Their minds coming up with something more monstrous or more imposing than you could ever fulfill? No! You are beyond anything as simple as a giant wolf; you are that which puts fear into gods and delivers upon that promise.%%%%People are not awed or in fear of you like they are of a villain or an enemy, you are the unconquerable given form, like an ideal or natural disaster given shape. Your nature and their hopes and fears determining how people anticipate your arrival.%%%%People have an impossible time trying to shunt you into categorical descriptions, someone might say you're titanic, beautiful, and or terrifying but they understand and feel the language can never do your reality justice.%%%%You may choose to be another child of Loki or not, but no matter your choices in this jump you will at minimum have a close family that loves you even and especially as a Monster.,,
Races, Age, and Gender,,0,,00,,False,,False,,The Lines Between. Races in the old mythologies are vague and even fluid at times, not so much a hard racial line but a measure of spiritual purpose and significance, more tribes than distinct connections and bodily distinction. As such, you need not make such affirmative selection; tales will fill with your deeds and the world will come to know what you are.%%%%Choose a single cosmological order to start your tale, you may choose any age that would be appropriate to your story, both in actual and appearance; you may choose to be male, female, something else, or in-between.,,
Mortal,,0,,00,,False,,False,,Most of the tales pertaining to mortals deal with humans, men and women, but some deal with the birds and the bees or sometimes even shrubs and trees. Mortals are generally not as powerful as the members of the other races but there are a lot more of them and there are always those who break the mold; there are always heroes or legends. You can choose any mundane species, you are now of its kind and, if you want, can be like Sigfriend or Sleipnir, a mortal descendant of a God, containing the barest sliver of divinity.,,
Vættir,,0,,-2000,,False,,False,,Whether you are of the ?Dvergar (dwarves), Alfar (elves), Ljósálfar, Hvítálfar, Dökkálfar, or something else entirely, you are now beyond the form of mortals. The Dwarves are dark skinned, sometimes pitch black in appearance, natural smiths and craftsmen, being strong enough to hold up the sky; some scholars believe that the Dökkálfar (Dark Elves) are these people by another name. The Light Elves are said to be luminous beings that are more beautiful than the sun and possess innate powers such as to cause, cure, and heal illnesses.,,
Guðkunnigr,,0,,-4000,,False,,False,,Jötnar - meaning “devourers” - are chaotic spirits of destruction, entropy and decay, who are often the enemies of the Aesir. They come in many shapes and many sizes, though a great many assume humanoid forms, and can possess a wide variety of magical powers such as shapeshifting.%%%%The Disir on the other hand are female guardian spirits of people, or land, or they could be fertility goddesses, and have been perceived as the ranks from which the valkyries are pulled. This also covers unnamed gods of other tribes. These are the things to which you may choose to belong.,,
Ginnregin,,0,,-6000,,False,,False,,The Aesir gods and goddesses, the main tribe of deities. They live in the celestial fortress Asgard and maintain the order of the cosmos. They possess the earth shaking strength to contend with giants and an affinity for war and power. The Vanir gods and goddesses, the second main tribe of deities, tend to be more associated with the “natural world” than the Aesir. They are often strong enough to contend with the Aesir but many are bent towards more magical pursuits instead. They possess an affinity for sexual and ecological fertility.,,
Ymir,,0,,-8000,,False,,True,,Twin, a name most perplexing for a solitary being. But no longer shall he be of singular company, you are now a primordial god. Colossal in size and scope of being, you are an origin of life itself, able to freely create new flaura, fauna, and the like with ease. You could "birth" new pantheons of gods without even noticing.%%%%Your anatomy could more easily be described figuratively than literally, as you are now something beyond mortal understanding; the ways by which you interact with the world is physics defying incomprehensible by even the most esoteric and eccentric fictions in the realms of science or fantasy.%%%%Many beings would come to be primordials or personifications of concepts like fire, earth, oceans, rivers, metal, forests, stone, or life, but none of these could be without you or your twin. You are a primordial and a personification of The World.,,
Hamingja,,0,,-2000,,False,,True,,Regardless of what skin they bear or race they belong, there are those who were born or forged their own way to greatness. For 200 more cp you are now counted among them. You may purchase this in addition to other racial options.%%%%Luck and power. Both in the conventional sense but also in a form of identity, the fame and power to which one holds claim, that which separates heroes and kings from commoners; it is an intrinsic aspect of one's own self.%%%%The higher you are in the cosmological order the greater your Hamingja is by virtue of birthright, but also the more rigid and unchanging. Greater beings are trapped by their Hamingja within the bonds of urd, often gaining little power if any at all by their own acts or deeds, simply changing the nature or focus of their power, while the lesser mortals with great effort and risk can grow beyond their station to put their names amongst the stars and stones.%%%%Your luck is so great as to elevate you from that of a nameless lesser deity or demigod to being counted among the lesser known Vanir, a mortal to being a hero as marvelous as Sigurd, a dwarf to being counted among the four pillars and kings, or from a powerful being of the pantheon to being on par with the likes of Baldr, Freyr, Frigg, or the All-Father himself. I can not fathom what a primordial like Ymir would become.%%%%No matter your nature however, you will retain the mortal gift of being able to grow, not simply change. Hamingja can be borrowed, split, gifted, and even traded temporarily and permanently; it can pass from dead ancestors to newborns, through either bloodline or spiritual succession.%%%%This perk can merge with your other luck perks expanding the power and luck you express through these worlds’ gifts while also removing and or allowing you to toggle their negative aspects.,,
Angrboða,,0,,-4000,,False,,True,,No matter the kind of being something is, some are simply more monstrous than others. For an added 400cp, you can be counted among the boogiemen of the gods. You may purchase this in addition to other racial options.%%%%You are now big, like actually as big as most people think the Jötnar are. As a Guðkunnigr, you could be a snake whose body encircles the world, or a wolf whose mouth reaches from bedrock to heaven and could devour the sun.%%%%You no longer obey the square cube law; in fact, you murdered it and all its relatives, like the cube 4d law, to wear their pelts like a fancy stitched hat. You can grow endlessly, though not necessarily quickly and can go toe-to-toe in physical might with beings an order of magnitude greater than yourself.%%%%You have gained the ability to kill anything, even that which can not die, that lacks the concept entirely, or was never alive to begin with; even the dead can die. Murdering an avatar would kill the source itself and what you kill ?stays dead. You can murder concepts like love or hope, though through more esoteric means; you could kill a concept in its entirety or just an instance of it, forcing ideas wherever they are to physically manifest so they can be destroyed.%%%%Any aspect of you or your power that is focused on death, destruction, consumption, chaos, war, poison, decay, entropy, madness, lies, hate, evil or the like is massively enhanced. Your touch can turn things to ember and dust instantly, your bite corrosive, your venom toxic to everything, and nothing - not even gods or greater cosmic entities or fate itself - can heal the wounds you inflict upon the world without your blessing. You are become death, the destroyer of worlds.,,
Útan Urd,,1,,-3000,,False,,True,,Urd, destiny, is not an absolute thing in the old myths. However, neither is free will. It is possible to alter the course of its flow in minor ways to avert or change events along the way but the nearer things get to the end the stronger and faster that flow becomes until eventually it becomes a fall. Though lives may be extended, this cannot be continued forever; it is a truth that the present must return to the past in order to begin anew, so to go against one's final end is akin to going directly against the full force torrent of destiny and history as it returns everything to the beginning.%%%%Your true nature makes you an exception to this. You walk above the currents of Urd and so while you can follow it if you so choose you are unimpeded by it's flow; if you were unlucky enough to come across your ordained final end you would find yourself the one being with the absolute free will to change%%%%%%For 300cp you can keep this advantage in future jumps and have also gained the gift of immortality, unaging and distant to the shores of time and death. You will not age, and are beyond the worry of disease or banal and mundane ailments. If the universe came crashing down to begin anew, you will find yourself standing upon its shores.,,
Viðurnafni,,1,,-500,,False,,True,,First Purchase Free%%%%?A nickname or title that you have earned. You can choose to be known by this and all who hear this title or nickname will know of your deeds and the truth that these deeds hold; they form a web of stories and events within your past that can be known.%%%%Every jump you may change the actual nickname and the details of the story that granted you this nickname and how widespread each nickname is. Beware if you do not possess the skills of such a title for should you be found out, doubt can spread to all the tales and titles for which you are known. This perk can write events or fake events into your backstory as needed in each jump, or simply carry the weight of the intent behind the title.%%%%Each title, whether true or false, whether believed or distrusted, carries weight and as such grows your hamingja.,,
Líf,,1,,-1000,,False,,True,,The first gift, life. You have been gifted a powerful soul and will. You are a skilled and well trained member or your race, fit enough to run, endure travel, and fight. You possess the reflexes and instincts to avoid freezing up and to hold your own against two or three normal warriors of your kind, though victory would prove difficult against more than one. You are competent at wielding bows, spears, knives, swords, axes and shields, and are comfortable wearing simple armor.%%%%Your body and appearance take on qualities of your choice, great enough to star in your own legendary saga. You could possess beauty enough to inspire poems, a heroic physique imposing enough to demand immediate respect in these lands, the roguish good looks to get away with a truly great deal of mischief, or a terrifying visage that could numb a mortal.%%%%Free for Vættir or greater.%%%%Free during the jump, 100 CP to keep.,,
Vit,,1,,-1000,,False,,True,,The second gift, of thought. You now hold a certain wit and charm about yourself; whatever your intelligence was before, you are at least above average now. You have also gained the skill of pithy retort and common banter, never again being at a loss for words.%%%%You also possess a talent for Flyting, argument as a contest, consisting of the exchange of insults, subterfuge, and shade, often conducted in verse, between two or more parties. It could be described as the art of eloquently insulting the opposition, usually as a prelude to battle, a battle in and of itself, or even as a friendly competition among comrades. While this perk doesn’t make you the best in the realms by itself, or even a master, you are an expert and could easily run circles around the common man.%%%%Free to Guðkunnigr or greater.%%%%Free during the jump, 100 CP to keep.,,
Jóð,,1,,-1000,,False,,True,,The third gift, of expression. Many times in many places it can be hard to understand or be understood. No longer, simply put you are omnilingual, you can learn, grasp, understand, and express yourself in any language you come across whether visual, auditory, pheromonal, or stranger you can learn to communicate with others in their language. You will never be misunderstood unless you desire to be so and you don't simply perceive the technicalities of the languages but have an intrinsic understanding of the feelings and emotions behind the language expressed.%%%%Free to ?Ginnregin? or greater.%%%%Free during the jump, 100 CP to keep.,,
Atgørvi,,1,,00,,False,,True,,First 100 CP purchase free, mutiple purchases possible%%%%Everyone has a skill, don't they, something they become known for; this is a single mundane skill of your choice.%%%%At ?100cp this skill is simply beyond peer by the standards of your kind, able to be counted within the realm of supernatural talent yet still within mortal grasp of understanding, as a swordsmith able to forge weapons that are too light and too sharp that could easily weather the ages environment or wear and tear even with sub par tools. As a runner being able to run upon the water or leap amongst the tree tops.%%%%At 200cp your talent has gone clearly into the realm of the supernatural skill, able to forge immaterial things like light or fire or wind into a blade or infuse it into your armor creating weightless objects, nearly indestructible weapons, or craft impossibly sharp edges as narrow as a wavelength from simple metals. If your skill was running, walking upon the air itself would be possible.%%%%At ?300cp your skills in your chosen area are only limited by your conceptual scope, forging the very idea of a blade out of the sounds of war, manifesting hopes or dreams into a shield. Gather the roots of mountains or the sound of a cat’s foot fall, forging truly indestructible objects immune to even being erased from time or casual loops. A runner able to outrun death and walk through dreams.%%%%%%At each purchase level your ability to learn, adapt, and master your talents within that skillset will grow by an order of 3, 9, or 27 with no cap to your abilities’ growth beyond the conceptual limitations of this purchase and with absolutely no end if purchased at 300cp.,,
Ríki,,1,,00,,False,,True,,Multiple purchases possible%%%%There are many beings with fantastical innate powers in the cosmos. Beings that can control the weather, change their form, or even nudge the course of destiny to obtain a desired outcome. This perk manifests as innate knowledge and influence over a domain. While ordinary mortals may only be able to display preternatural competence and relatively minor direct influence over their domain, beings with more innate power get increasingly more out of this even at the same purchase level.%%%%Choose a domain; this can be anything, a skill, an element of nature, or a concept. At a purchase of 200cp you would have this as a minor domain, wielding influence and power enough to astonish any being at your level, able to weaken or strength others within your concept, influence fate, or wield your element. A mortal with a domain over fire could provide substantial warmth on the coldest peaks of Everest, light buildings and large bonfires with a wave of the hand, "consume" an entire banquet for a hundred men in moments, or burn an enemy into ash. If of electricity, be able to power a small neighborhood of devices or call down a lightning bolt upon your enemy. A mortal with a minor domain over a kingdom would have a divine right to rule that land that no one could deny.%%%%At 400cp this is a ?major domain. A major mortal of fire would be able to rain down fire and pyroclastic flow like the second coming of Pompeii, create columns of flame to pierce the sky, or heal by burning away disease. A major mortal of war could will his side to victory in any battle he participates. A major mortal of a kingdom could call upon a force equal to all the power of the people and the land itself to shape that kingdom, build forts and increase performance in agriculture.,,
Nafn,,1,,-3000,,False,,True,,Multiple purchases possible%%%%?What is in a name holds many secrets. Firstly, you in all your forms are protected and secure within the power of your own true name, which can no longer be used against you. Choose a lesser being or race to your own and gain that form; it shall receive its own separate true name. You may take this form at will.%%%%No matter how familiar this form is to your other forms they will never be mistaken for each other, believed wholeheartedly to be seperate beings and nothing can pierce this perception unless you are observed taking on or dropping this form. You will gain an amount of lesser cp to spend on this form within this jump equal to half the amount of cp you spent on your main self; anything purchased with this lesser cp will be one third (1/3) as strong as if the purchase had been made by your greater self. The lesser form can not purchase this perk.%%%%Once per jump or every nine years, whichever comes first, this perk will act as a 1-up for any permanent death, mental entrapment, or imprisonment you wish; you safely appearing within a location of optimal choosing, locking you out of your main or lesser form as appropriate with only that "identity" dying.%%%%In future jumps each of your forms is separately provided all the real documentations, backgrounds, events, friends and families as needed to be within that world and prove your skills granting you spare identities and lives to slip into as needed with aspects shifting to accommodate these lives continuing as needed for your convenience. This will not let you be in two places at once but there will always be alibis for these other lives, friends having pictures and memories somehow, but anything notorious you do in one form will be retained. I.e., if you rob a bank in one form and it makes national news this won't provide that form with an alibi.,,
Upphaf,,1,,-5000,,False,,True,,This is not simply a domain over something, you are the embodiment of this something. %%%%ithout you this very thing or idea does not exist within whatever worlds you find yourself, the primordial of strength could never be beaten in a test of strength and all who would wield it do so at its discretion. A being of dream would be both the mantle, all its endless worlds, and every part of its story; one of death would not be just as the grim reaper, but the existential dread of endings. You could be the very thing of time itself and there by alter its nature, as you are its nature. You can not select something as broad as The World or Matter but Time, Space, Life, Death, Land, Sea are all options , but so are smaller concepts such as being the embodiment of a specific river or a specific star or the concept of stars themselves.%%%%The more power you have the greater influence that power has within the worlds and if there are other beings that act as this embodiment in future worlds you may replace, war with, coexist, or subvert them as you see fit, always carrying your concept with you. Due to your influence over this concept you can materialize it as you wish freely; bottle up hope, lightning, or time, wield victory as a banner, shine the light of day upon the secrets of the world, or manifest dream into reality only limited by your power.%%%%As an embodiment you hold the characteristics of your concept and you can no more be harmed by anything that could not destroy your very concept itself. The more specific your concept the greater the influence and power this concept holds and you hold over it; and if you held both a major domain over and embodiment of a single concept you would have absolute power and control in that aspect or realm.,,
