Name,,Type,,CP Change,,Active,,Chained,,Description,,Notes
Extended Time,,4,,00,,False,,False,,This war has raged for millennia. What's a few more centuries?%%%%You may increase your time here up to a maximum of 1000 years.,,
Bad Optics,,4,,1000,,False,,False,,While you can still perceive things without problem, everything seems just a little bit artificial. Anything you see is slightly pixelated, anything you hear sounds like it came out of a synthesizer, etc.,,
Beep Boop,,4,,1000,,False,,False,,If you are a CORE commander, your units will only respond with beeps and electronic tones.%%%%If ARM, your units will speak only in stock con-lag snippets with identical voices and will show no personality.%%%%You will have no problem understanding either. Your companions are the only ones exempt from this.,,
Rogue Unit,,4,,2000,,False,,False,,Drop In only%%%%You existence has been noticed, and the faction matching your chassis type believes that you have gone rogue. You will be designated as hostile, and the opposing faction is unwilling to accept any sort of diplomacy.%%%%You can never make allies among the ARM or CORE, and are now a third faction within party in the long war.%%%%At best, each faction will view you as someone to manipulate into causing trouble for the other.,,
Constant Combat,,4,,2000,,False,,False,,It seems like you can never get a moment's rest. Randomly and inexplicably, enemy units will pop up and take potshots at you.%%%%This will never be more than a small squad or a lone unit poking at isolated targets.%%%%More aggravating then anything, you'll need to set patrols and leave nothing undefended, or be prepared to do lots of repair work.,,
Humanity Preserved,,4,,3000,,False,,False,,You are tasked with the protection of a group of living humans (if ARM) or consciousness patterns (if CORE) The other faction suspects that they exist but does not know their location, and will attempt to delete (ARM) or kill/pattern (CORE) the group if they are found.%%%%If this happens, you will fail the jump.%%%%You can use any method you wish you hide or protect them, but they must stay within range of the galactic gate network.%%%%If you are a drop-in, you may choose either situation regardless of your original allegiance.,,
Humanity Preserved - Humanity Restored,,4,,3000,,False,,False,,It is not enough that humanity endures. They must thrive. It doesn't matter if they exist as data or flesh, so long as they remain free. Free from being harvested by the CORE for new data or by the ARM for new clone-stock.%%%%The long war has taken its toll on both sides, and now you must keep this population secret and safe even from your own allies.%%%%You will fail this jump if they are killed or captured for cloning/patterning.%%%%You also have the responsibility to ensure that the group is self-sufficient by the end of your time here, and if humanity is not safely on the path to restoration when you leave you will have failed the jump.,,
Final Victory,,4,,3000,,False,,False,,You must attain victory for your side, destroying the other faction beyond any chance of recovery.%%%%This requires at the very least the death of their commander, along with the destruction of Central Consciousness in the case of the CORE.%%%%However you cannot leave the jump until you do so, and if your time here goes over the set limit the opposing faction will slowly begin recovering old technology.%%%%Left alone for too long, they will become too powerful for even out-of-jump abilities to overcome, and you will eventually be killed.,,
KROGOTH COMES,,4,,4000,,False,,False,,At least once each year, a Krogoth unit will appear on the planet you occupy and begin wrecking your shit.%%%%It will be quietly teleported to wherever you really don't want a krogoth to be teleported to, often at the worst possible time.%%%%For fairness' sake, it will not appear within the first year of your time here, and will need at least ten minutes to get within weapon range of you, your faction's commander, or anything you must protect to prevent a fail condition.%%%%Krogoth units are durable enough that seven direct nuclear strikes are required to destroy them, and they are equipped with powerful gauss cannons, anti-air defenses, and the Blue Laser Of Death. Finally, when Krogoths are destroyed they explode with enough force to destroy nearby commanders, making the use of the D-gun to destroy them a nearly suicidal prospect.%%%%Over time Krogoth units will begin appearing more rapidly and in ever-larger groups, and will eventually lose their vulnerability to spider tanks.,,
Power Theft,,4,,4000,,False,,False,,Connected to you as they are, whenever an enemy commander manages to capture one of your units or structures they will also gain at random one of your powers, skills or perks.%%%%This will be immediately disseminated among the faction to upgrade new units at no cost, and any perks that provide copy-protection or would interfere with this drawback are disabled.%%%%Capturing your units will become a priority for enemy factions, even to the point of designing and equipping new units specifically suited for the task.,,
Power Loss,,4,,6000,,False,,False,,For the duration of this jump, all out-of-jump powers are lost and your cosmic warehouse is sealed.%%%%You will remain the near-equal to the current commanders in skill, but are lacking in experience.%%%%On the other hand, creativity and original thinking may give you an advantage against habits ingrained into the enemy over four thousand years of warfare.%%%%Ten years of war in this galaxy is not impossible to survive, but it will not be easy by any means.,,