Name,,Type,,CP Change,,Active,,Chained,,Description,,Notes
Starting CP,,6,,10000,,True,,False,,,,
Location,,0,,00,,False,,False,,1. Empyrrean%%A green and living world covered in wide grasslands and thick forests. It is the homeworld of the ARM, covered from pole to pole in wide oceans and long, thin continents. It has no deserts and a small polar region. Though rich with metal deposits and geothermal vents, ARM has refrained from exploiting these resources to avoid damaging this world's natural beauty.%%%%2. Thalassean%%A world of water with only a few small and scattered islands. While metal is scarce, the high winds and strong tides can supply energy through low-tech methods. Combat here is almost purely between naval units.%%%%3. Temblor%%Highly unstable, this world's tectonic plates are in constant motion and powerful earthquakes are a regular occurrence. Large structures can be severely damaged or even destroyed as the ground beneath them shifts, but the incredible amount of metal and seemingly endless geothermal activity makes the world a tempting resource.%%%%4. Rougpelt%%A barren world covered by red dunes and scattered seas, it is lacking in all resources of note. Shattered centuries ago by warfare, fragments of the planet's moon often rain down upon the surface in devastating meteor showers, a danger to even the advanced technology of the ARM and CORE. Conflict remains a constant here because Rougpelt is an important transit point in the galactic gate network, a crossroads that leads to worlds that are strategically important for both sides in the war.%%%%5. Tergiverse IV%%An arid world that was once covered by vast seas. The CORE drained the world dry and sifted the sea floor for useful resources. Only deserts and vast artificial canyons remain, the natural barriers incorporated into CORE fortifications.%%%%6. Dump%%A small rocky moon orbiting Core Prime. Its original name long forgotten, it has been used for thousands of years as a waste repository. The largest canyons were long ago filled with industrial waste, and there are enough wrecks here to build an army. Despite its proximity to Core Prime, Dump is not particularly well defended.%%%%7. Core Prime%%Center of the CORE empire, all organic life here was long ago exterminated as pollutants and terraforming turned the world into a single massive computer encased in a metallic shell. Once- living canals and oceans were re-purposed as oversized catch basins for industrial runoff. What seems at first glance to be urban complexes are only factories and storage depots, their designs informed by the residue of human thought within Central Consciousness.%%%%8. Your Coice%%You may choose to begin on any canon world within this setting, or even create a new world similar to one of the above examples. If you choose to create a new world, it must be part of the Galactic Gate network.,,
Drop In,,0,,00,,False,,False,,For thousands of years the war has raged - much has been destroyed and even more forgotten. You will awaken in your choice of a CORE or ARM commander, your self-repair systems suddenly reactivating after centuries of laying wrecked and dormant. Regardless of your previous loyalties, any organic or digital memories within your systems have decayed to nothing during the time spent deactivated.,,
CORE,,0,,00,,False,,False,,Based on Core Prime and directed by Central Consciousness, the sole surviving CORE Commander has struggled to battle the ARM on its own. After years of projections and deliberation the very last stockpile of irreplaceable resources were expended to construct you, the first new CORE commander to come online in more than a thousand years. Central Consciousness expects much, and watches your actions closely.,,
ARM,,0,,00,,False,,False,,Based on Empyrrean, the sole surviving ARM Commander has struggled to battle the CORE on their own. But with the chance find of an ancient resource stockpile, the ARM gambled those irreplaceable materials in an attempt to create a second commander...and won. You are a clone of the sole surviving ARM Commander, just as he is a clone of the very first, and the ARM has high hopes for you.,,
Sanity Enforcement Protocols,,1,,00,,False,,True,,Buried in dust for centuries. Alone with only the voiceless echoes of soldiers long dead. An unending war, a daily struggle to escape death, and the mass-production of living beings as cannon fodder. It's enough to drive a man mad, but the ARM and CORE long ago purged their ranks of such weakness. For the duration of this jump you will simply not be able to go insane. You can become stressed, distracted, morose and worse, but you will never be completely unable to function.%%%%Post-jump, you will not suffer angst from memories of what you've done or witnessed here, and you'll be left with a better tolerance for stress.,,
Strategic Minds,,1,,00,,False,,False,,There is no post-human intelligence active in this galaxy that does not have an understanding of warfare. The commanders of the CORE and ARM are copies of the greatest military minds that have ever existed, and that any are still alive after four thousand years of warfare should tell you just how talented they must be.%%%%Your mind has been altered to have a savant-like grasp of warfare, allowing you to personally manage a planet-wide campaign involving tens or even hundreds of thousands of units. Without such ability, you wouldn't last a hour in combat against the other commanders here.%%%%These modifications were not designed with an extra-dimensional traveller in mind, and you pay 600cp to retain these skills when you leave this jump.,,
Drop In - Mission Briefing,,1,,-1000,,False,,True,,On a personal or strategic scale, whenever you prepare for a fight you may opt to hear a dramatic narration of the impending situation.%%%%The message is brief and little more than a 'as you all know' pre-battle speech, but there will always be a small hint hidden within the message. It will be very subtle, never more than a slight poetic emphasis or change in tone, but catching it can give you a little forewarning of issues that you might not have otherwise been aware of.,,
Drop In - Old Ghosts,,1,,-1000,,False,,True,,Alone between two warring factions, you've learned to step lightly.%%%%Though taking longer to happen in more static environments, any signs of your existence are quick to fade. Physical tracks are obscured, leavings decay and disperse, and electronic signals degrade into random noise.%%%%Anyone seeking to track you had best be quick about it, because the trail will soon be gone.,,
Drop In - Foraging on the Enemy,,1,,-2000,,False,,True,,You have no support network, but there are many isolated units and abandoned structures just waiting to be taken over.%%%%You've become very good at capturing and converting enemy units, the process taking much less time.%%%%You'll also find that rhetoric, magic, or any other method of bringing someone or something under your control also receives a boost in effectiveness.,,
Drop In - That Unit is Dead,,1,,-2000,,False,,True,,When you are believed to be dead, only personally revealing yourself can convince someone to the contrary. Footprints, weapon signatures, the corpses of your kills, all will be dismissed as subterfuge or error.%%%%This does not mean that your actions will go ignored, and interested parties may still attempt to discover who is 'really behind' these occurrences.,,
Drop In - Tech Level 4 Stealth Systems,,1,,-4000,,False,,True,,While you laid dormant, the galaxy continued to fight and spiral down to ruin. But you remember technology from a time more advanced than the current age. Your stealth technology is better than what is available to the ARM and CORE, both more effective and energy-efficient.%%%%You also retain the skills and strategies of stealth, infiltration and sabotage to make full use of your technological advantage.%%%%Strangely, any out-of-jump powers based on stealth and subterfuge will also receive a boost to their effectiveness.,,
Drop In - Modular Unit Design,,1,,-4000,,False,,True,,When your options are limited, just cobble together something from what few designs you have on hand.%%%%You're very good at tweaking your technology to be modular and as easy to assemble as lego.%%%%Have a hovercraft chassis but need more firepower? That heavy laser turret can provide. Want faster artillery? You've got a few different mobility systems and engine designs to work with, you'll figure something out. Want to see how a battleship performs when you remove the cannons and strap on a dozen light laser turrets in their place? You can make it work.%%%%It may not work well, but it will work.,,
Drop In - Mental Diagnostics,,1,,-6000,,False,,True,,A few centuries spent rusting in the dirt can do terrible things to a mind.%%%%You've written specialized subroutines to sift through broken data and memories, and put safeguards in place to make recovering from future incidents easier.%%%%Your mind now has a protected, constantly updated 'backup' which stores your real memories and true behavioral patterns, and your mind will use this data to slowly repair itself back to full functionality after damage or unwanted alteration.%%%%At any time, you may compare this backup to your current mental state to run a comparison or scan for irregularities.%%%%Even if outside influence is continuously re-applied, your mind will never stop trying to break free, and the backup is completely write-protected.%%%%It cannot be forcibly altered to change your true nature by you or anyone else under any circumstances.,,
CORE - Backup Protocols,,1,,-1000,,False,,True,,A well-designed intelligence can recognize the value of a good backup plan. They are quite easy for you to create, clearly delineating the distinct stages of an operation and how each step can allow or prevent certain choices.%%%%And when something inevitably does go wrong and you must invoke these plans, there won't be any confusion as you switch mental gears - you'll jump right into your backup strategy as if it was what you'd been planning to do all along.,,
CORE - Final System Check,,1,,-1000,,False,,True,,Sometimes a world must be made geologically stable and coated in a metal shell. Sometimes organic life must be completely exterminated.%%%%When you are bent to the completion of a task, rarely are there lingering problems to trouble you later.%%%%This does not make you more powerful or better skilled, and does not allow you to slack off during the job.%%%%An organic mind might call it luck, but you are simply so very thorough in your work so that you never overlook things that might cause you trouble later.,,
CORE - Calculated Victory,,1,,-2000,,False,,True,,Based on available information, your subsystems can give you a chance of success for a particular scenario in the form of a percentage.%%%%The more detailed your knowledge of all factors that can influence the outcome, the more accurate this prediction is.%%%%This perk can be used to run simulations and answer hypothetical questions, but it cannot account for unknowns which may result in wildly skewed results.,,
CORE - Compact Systems,,1,,-2000,,False,,True,,Without the need to build around organic components, CORE units can be made smaller and more durable.%%%%You have access to the dumb AI routines used to assist unit design and construction, and with them create streamlined internal systems that allow for a reduction in size without complications.%%%%While current CORE units have already been built to optimal standards, any other technology you possess will be easy rebuilt into a more compact form...even if some allowances must be made for squishy meat-bodies.,,
CORE - Tech Level 4 Laser Sytems,,1,,-4000,,False,,True,,When Central Consciousness created you, it placed great care in your compiling and restored data integrity to what was once random noise.%%%%You have access to laser weaponry that is far more powerful and energy-efficient then the current CORE arsenal. While current CORE design philosophy means that these improvements cannot apply to existing stealth technology, it has allowed for a level of holographic resolution high enough to fool ARM sensors.%%%%Finding combat uses for this new technology is up to you.%%%%Any other abilities you have that generate or manipulate light will also show improvement.,,
CORE - Acceptable Tolerances,,1,,-4000,,False,,True,,CORE units are awash in energies so powerful that they can damage the machine that generates them, but only a commander has enough long-term worth that more than token protection is installed.%%%%This insulation protects against internal damage from trying to hold or channel more power than your body could normally handle.%%%%You can still injure yourself if you push too hard for too long, but a series of internal capacitors and regulators will easily and automatically smooth out moderate levels of sudden instability in your power systems.,,
CORE - Patterning,,1,,-6000,,False,,True,,The technology that brought humanity low is now in your hands. You know how to to create a digital copy of a human mind.%%%%You can perform a complete transfer from flesh to data, leaving the meat-body an empty shell, or only create a digital backup copy while leaving the original mind unharmed.%%%%Once thought has been transmuted into data, it is simple to create a virtual environment for the mind to enjoy...or to edit the resulting engram as you would any other piece of data. Consciousness is a complex thing, so editing it carries great risk. But copying an engram endlessly is easy, and gives you plenty of material to experiment with.%%%%This perk includes the knowledge of how to build the specialized technology that makes this all possible.%%%%How you use it is up to you.,,
ARM - Destruction Without Ruin,,1,,-1000,,False,,True,,While they could not sustain the effort of doing so, there was a time when the ARM tried to minimize the war's collateral damage.%%%%You can now prevent any kind of 'domino effect' from taking place as a result of your actions.%%%%For example, dropping an incendiary on a forest would burn any trees or units hit by the chemicals, and damage anything that walked through the resulting flames, but the heat would not cause untouched trees to combust and spread the flames.%%%%Any chemical/radiological/etc. leavings will not go away on their own, so if you must use certain kinds of weaponry then the after-battle cleanup will at least be easier on the landscape.,,
ARM - Still a Man,,1,,-1000,,False,,True,,Among the clone-troops of the ARM, some still hold on to precious memories and simple joys. Being able to only view a sunset through an IR filter does diminish its beauty, nor do you feel like less of a person if you cannot feel the colorful insect crawling over your battle-scarred chassis.%%%%You can keep the things that bring you happiness from being linked in your mind to unpleasant associations, and can keep those feelings strong as fresh in your mind, even if your current situation prevents you from fully enjoying them.,,
ARM - Cybernetic Sciences,,1,,-2000,,False,,True,,Embracing cybernetics was a compromise that allowed the ARM to fight the CORE on an equal level. Knowledge of the technology has been carefully preserved over time, and despite the modifications being performed automatically on each new clone you understand the technology very well.%%%%There is no organ, limb or sense that you cannot seamlessly replace.%%%%Teaching the brain to make connections with new technology is a simple practice, and you can even encapsulate the entire human body in an artificial shell it need never leave.%%%%There are many application for such technology besides warfare...though you'll have little chance to explore them while here.,,
ARM - Failsafes,,1,,-2000,,False,,True,,Unlike CORE units which are purely mechanical, the ARM had build around the more fragile organic pilots. In the right (wrong?) conditions, power surges or ammo cooking off could kill an ARM soldier long before the machine's functionally was completely lost.%%%%While these and other things can still cause secondary damage to your technology, you are at risk of being personally harmed from only a truly catastrophic mechanical failure.%%%%Even then, you will always have at least a few seconds of grace to try to avert disaster. Venting excess plasma, ejecting an unstable reactor core...it might not work, but a small chance of survival is better than no chance at all.,,
ARM - Tech Level 4 Plasma Systems,,1,,-4000,,False,,True,,The ancient material that went into your construction was from a better time, and your plasma technology is far in advance of current designs.%%%%Better magnetic fields allow for more plasma to be compressed within each shot, and both stationary fusion reactors and micro-generators within individual units can safely contain and produce greater amounts of power.%%%%Any other technology or abilities that employ magnetism will no doubt receive a large boost in effectiveness thanks to your greater understanding of the physics behind them.,,
ARM - Bio-Mimicry,,1,,-6000,,False,,True,,Though they were eventually forced to wrap their bodies and minds in a cybernetic shell, the ARM did what they could to emulate living creatures in their design philosophy. They developed a nanotech self-repair system that mimicked the organic healing process, and you have access to the original research. While this technology was inevitably copied by the CORE, your deeper understanding allows for not only faster healing and regeneration of lost limbs and organs, but for any cybernetics or implanted devices to be reconstructed as part of the healing process. Get an arm chopped off, and by the time it grows back any previously installed technology will also be fully operational. All you need to to worry about is providing energy and feedstock to feed the reconstruction.,,
ARM - Cloning Technology,,1,,-6000,,False,,True,,For all the ARM's talk of organic sanctity, cloning is a process as cold and industrial as the CORE's mass-copying of neural imprints.%%%%Needing only feedstock, specialized nanolathes, and a genetic template, your clones can be 'born' as adults with skills and memories encoded genetically.%%%%Clones you create will be almost impossible to tell apart from the original, and will not suffer degradation from being a copy of a copy of a copy, etc.%%%%Further sculpting of genes and flesh to your exact specifications during creation is simple.%%%%This perk includes the knowledge of how to build the specialized technology that makes this all possible.%%%%How you use it is up to you.,,
TA Soundtrack,,2,,00,,False,,True,,The Total Annihilation soundtrack can now be played on demand, heard only by you or blaring out across the battlefield for all to hear.%%%%Unless you choose to hear a specific track, whatever is most appropriate for your current situation will be automatically chosen.,,
Commander Chassis,,2,,00,,False,,True,,Mandatory%%%%In cyber-shell or digital form, you will enter this jump inhabiting the commander design of your faction.%%%%Drop-ins may choose between the ARM or CORE.%%%%The commander unit remains one of the most advanced pieces of technology in the galaxy, being amphibious and far more agile than it appears, equipped with both advanced cloaking and sensor systems, and retaining the most advanced nanolathe technology in use.%%%%While it is equipped with a D-gun, a unique disintegration weapon that no known defensive system can protect against, it was not built for front-line duty.%%%%The commander is only as durable as a tier-3 unit, with only a light laser cannon as a sidearm.%%%%If left alone, it can easily be swarmed and overwhelmed by the enemy.,,
Tech Level 1,,2,,00,,False,,True,,You are authorized to construct all of your faction's most basic units and structures. Land, sea, air, and misc.%%%%Drop-ins may choose which faction's database they get for free.%%%%Paying 100cp will grant you access to the other faction's level 1 tech, but these stolen units do not have tech level 2 designs in their memory storage.,,
Tech Level 2,,2,,-1000,,False,,True,,While you will eventually be granted access to more advanced units after a brief tutorial period, you may pay 100cp to have access to all of your faction's level 2 technologies from the very beginning.%%%%While you can capture enemy units and command them to construct loyal versions for you, spending 200cp will allow you to start with access to all the opposing faction's level 2 tech, but they cannot create tech level 3 structures or units.,,
Tech Level 3,,2,,-2000,,False,,True,,Once you have proven yourself to be fully operational, your faction will trust you with construction of all tier 3 units. For 200cp, you may begin the jump with such authorization.%%%%For 300cp, you have access to the other faction's level 3 tech instead. Note that the Krogoth and galactic implosion device are based on alien technology, and their designs won't be found in CORE databases.,,
Plushies,,2,,-1000,,False,,True,,War should not be cute...but now you have a pile of soft and fuzzy dolls, one for each unit within the Total Annihilation setting.%%%%They will respawn a day later after being given away as a gift, but trying to burn them as fuel or reclaim them for metal will get you nothing.,,
Genome Database,,2,,-3000,,False,,True,,Free for ARM%%%%Compiled by the ARM as they watched worlds burn, this database was made in the hopes of restoring destroyed ecosystems after the war ended.%%%%It holds a massive and varied library of plant and animal species, as well as the thought-engrams of the higher-order animals so that they won't need to be hand-raised after being cloned.%%%%It would take decades to go through the vast amounts of data here, but the sheer variety of lifeforms from so many different planetary environments makes this data of incredible value to anyone with an even a passing interest in the life sciences.,,
Tech Database,,2,,-3000,,False,,True,,Free for CORE%%%%Nanolathes and imprinted data remove the need for in-depth knowledge among CORE construction units. Subsystems handle the math involved faster than a human mind could ever hope to, but damage to CORE computer networks in the past made establishing backups for surviving information a priority.%%%%Never made for a human interface, this database holds pure theory but no blueprints.%%%%Deciphering it would take an enormous amount of time and effort, but the information within forms the basis of all CORE technology currently in use.%%%%ARM technology shares many similarities, but Central Consciousness deliberately excluded all information related to the organic and cybernetic interfaces out of disdain.,,
Tech Level 10 Database,,2,,-6000,,False,,True,,Ancient and heavily damaged, outside of a few tantalizing scraps there are only two complete sets of theory and blueprints that remain readable.%%%%The first details the construction of Commander units, which includes all details of its cloaking systems, advanced nanolathe and sensors, and the D- gun.%%%%The second set are schematics for building Galactic Gates.%%%%This is technology lost in the current day, and building either requires the expenditure of immense amounts of rare resources.,,
Light Laser Security Turret,,2,,-1000,,False,,True,,Warehouse Attachment%%%%No larger than a briefcase, this model can be mounted anywhere in the Warehouse to fire upon intruders. It cannot be hacked or co-opted, will never fail to recognize you or your companions/followers, and can be easily programmed to behave in specific ways other than 'shoot everything it doesn't recognize.'%%%%The laser never runs out of power while in the warehouse, and is powerful enough to destroy 21st century armored vehicles with only a few hits.,,
Jumper-grade Moho Metal Maker,,2,,-6000,,False,,True,,Warehouse Attachment%%%%The materials needed for constructing the most complex units are either extremely rare or incredibly difficult to produce.%%%%Metal makers handle most of the work, transmuting raw energy into desired materials.%%%%Normally they can only produce mundane elements in pure or alloyed form, but this modified maker can produce any material you can provide it with a large sample of.%%%%Take note that it will require a dedicated fusion reactor to produce more than a trickle of common elements, and energy needs are vastly inflated for materials with exotic properties.%%%%It the desired material is formed in part or whole from something other than mundane energy, like magic or soul-stuff, the Moho Maker must be provided with these energies instead.,,
Import,,3,,-2000,,False,,True,,Wait...you didn't think you could import a few dozen companions as additional commanders, did you? That would just be overkill.%%%%Instead, you may import any number of companions as any other unit you are capable of building at the start of the jump.%%%%Once per year they may change their choice of unit, and whatever they inhabit at the end of the jump can be kept as a vehicle or alt-form.%%%%Companions that respawn are not provided with free units, there must be one already constructed and open for them to inhabit.,,
Enhanced Annihilation,,5,,00,,False,,True,,Several extensive mods have been created for Total Annihilation over the years, and taking this option allows you to apply mods of your choice to your time here. This may include unreleased units that never made it into the game, unofficial patches, and efforts such as the Spring Project to expand the game's roster. The only limitations are that you may not choose total setting conversions, or mods that allow you to gain technology beyond what exist in the original setting.,,
