Name,,Type,,CP Change,,Active,,Chained,,Description,,Notes
Multi-Drop,,3,,00,,False,,False,,Max of eight, 50 CP for 1 - 4, 200 CP for 5 - 8.%%%%Import an existing Companion as another Shard-class core. They get one Origin, 700 CP to spend as they please, and a +100 CP Item stipend.,,
Multi-Drop - Multiplayer Madness,,3,,00,,False,,False,,Import an existing Companion as another Shard-class core.%%%%They get a copy of a Multi-drop’s build (their choice), but do not get any CP.,,
Just a Shard,,4,,5000,,False,,False,,Your powers and perks from before you got to this world are suppressed, like you don’t have them.%%%%Likewise, all your items in your warehouse are locked down so you can’t interact with them, even if you can still put things in the warehouse.,,
Stick to the Core Experience,,4,,2000,,False,,False,,You lose access to all altforms except the core form. Good luck using your kung fu when you’re a building. If you have shapeshifting, that doesn’t work either.%%%%You are going to be a building for this entire Jump. Though on the other hand, at least you won’t turn into a form that needs to breathe, given the atmosphere.,,
Team: Yellow,,4,,2000,,True,,False,,Your color is yellow. It appears on all your turrets, all your buildings, everything you build. In fact, yellow is your color this jump.%%%%And it’s also indistinguishable from the same yellow as everyone else in the party. Have fun with that issue.,,Retail Rocker
Starter Pack,,4,,2000,,False,,False,,It seems you’ve gotten only a very limited subset of your basic blueprints. You only have access to mechanical drills, copper conveyors, junctions, duos, and small copper walls.%%%%You’ll need to find the other blueprints on your own if you want to take them with you.%%%%Then you need to unlock those blueprints by destroying large amounts of the materials needed to construct the buildings. Enough to make, say, a thousand of them? That seems fine. I won’t make you do it all at once, though.%%%%If you purchased any Proprietary Documents, you do not get the notes for a building or structure until you get the blueprint.,,
Starter Pack - Map Lock,,4,,2000,,False,,False,,Not only do you have to deal with finding all the blueprints for all the stuff, certain blueprints are locked behind defeating specific enemy bases.%%%%So, for example, in order to get 14 the launch pad blueprints you have to attack a specific resource stockpile used during the civil war.%%%%At least you become aware of where these sites are once you encounter one of these locked blueprints.,,
Synthetic Intelligence means "Kinda Stupid",,4,,2000,,False,,False,,It seems your units are running on the most basic code ever. They’re a pain to deal with, flying directly through enemy AA to get to their destinations, getting stuck on power nodes and random rocks, and generally displaying the same kind of decision-making as would come from 100 lines of code tops.%%%%This not only applies to Mindustry units, but any other automated units you use.,,
Avatar Costs a lot,,4,,2000,,False,,False,,You may only spawn your Guardian Avatar for free once. After that, spawning it will consume resources, in accordance with the power of the Avatar.%%%%A Shard with no powers before this would require enough resources to make a Poly, while more powerful people would require significantly more to make their Avatars.,,
Intruder at the Gates,,4,,3000,,False,,False,,Normally the damaged enemy systems give up trying to force you from a sector after a few dozen attempts. Now, any base of yours that isn’t surrounded by your other bases will be under near-constant attacks from enemy forces teleporting in. At least they keep teleporting in at the same location. And the waves do get bigger and badder as time goes on.%%%%If you leave your borders stationary for too long, you’ll be seeing insane attacks.,,
Intruder at the Gates - Blitz,,4,,2000,,False,,False,,Oh, I’m sorry, I was mistaken - all of your bases will be under near-constant siege, not just your border bases.,,
Hot Drop,,4,,6000,,True,,False,,Oh, did I say Ground Zero was lightly defended?%%%%Sorry, my bad, it’s actually a massive, heavily fortified base with a dozen cores that you’ll have to destroy before you can leave the area.,,Retail rocker
Wave Shields,,4,,00,,False,,False,,Every instance of every unit you kill will be a bit tougher than the last. Not by a huge amount - a shot from a duo would probably make up the difference - but it doesn’t reset until you end the Jump.%%%%Have fun dealing with Crawlers capable of tanking Meltdown beams.,,
Rival Reclaimer,,4,,5000,,False,,True,,Must take with 500 CP of drawbacks%%%%When taking this Drawback, you do not get the +500 CP from this drawback at the start of the Jump. Instead, you get it at the end, and may open up this sheet and make additional purchases with your CP. Another Shard has fallen to Serpulo at the same time as you, but somewhere else.%%%%The intelligence controlling it is brutal and cunning. It will learn your tactics and adapt to them. The weaknesses in your tactics will be pressed hard. Any technology it recovers, it can reverse-engineer and mass-produce.%%%%This Shard has fought for the length of the entire war and not only has every single blueprint in its core database, but also all the design notes and the engineering skill to adapt its tools towards countering you. %%%%It is bloodthirsty and grows stronger. It will not stop until it is killed, and every single core that it created is turned to scrap.%%%%The Jump will not end until you defeat it completely. In return for going to this timeline, you get to keep Serpulo. In future Jumps, it can be imported into the setting somewhere out of the way, or just remain in a pocket dimension.,,