Name,,Type,,CP Change,,Active,,Chained,,Description,,Notes
Tourist - Explanitory Lables,,1,,-1000,,True,,True,,When you are looking at thing from a cell’s eye view, things may seem unfamiliar, even if you were trained in biology and medicine.%%%%Now, when you are examining something, you can get a small pop-up describing the type of object you are looking at, or the race / species of the person you are examining, as well as a few common facts about that object type or race / species. Covers about the amount of information that you might expect from a brief encyclopedia entry.,,
Tourist - Status Report,,1,,-2000,,True,,True,,It is important to know how your body is functioning, especially when you are living within it. You can now mentally access a set of ‘status reports’ on the physical status of your body.%%%%They are written from the point of view of your cells, and will report on how well your body is running at the current point in time. Very useful when you want to diagnose why you are feeling sore or what exactly this strange lump on your arm is.,,
Tourist - Friend Finder,,1,,-2000,,False,,True,,The body is a massive place, especially when you are the size of a single cell. The chances of you managing to meet up with the same cell are astronomically small. Now, however, the odds will lean in your favor.%%%%Circumstances bend to allow you to find people you know much, much easier, with you often finding friendly faces ‘just happening’ to have been walking by in the same area where you are.%%%%Can be toggled on and off at will.,,
Tourist - This City is Me,,1,,-4000,,True,,True,,You are living in a massive city-scape that represents your personal body, and now, that connection goes even deeper than it would before.%%%%You now have a sense of proprioception with relation to the large cityscape, allowing you to detect generally what is happening, as well as helping with navigation in the wider city. Even better, you can use this connection to apply some of the perks and powers that apply specifically to your body to the cityscape around you. For example, a regeneration power could lead to the infrastructure of the city healing itself, and a shapeshifting power could allow you to manipulate the layout of the city somewhat. These powers will be diffused and weaker than they are when operating solely upon your body, but they will still be significant enough to have a noticeable effect.%%%%In future Jumps, you can take a day to synchronize this power with a new city, though the power will break if you move beyond the city limits.,,
Tourist - This City is Me + Anthropomorphic Incarnation,,1,,00,,True,,True,,When you bond with the city, you’ll find that you’ve awakened certain spirits within it, tied to the various locations and infrastructures within the city itself.%%%%These spirits are invisible to the general populace, though they can reveal themselves if they so choose, and they are able to interact with and manipulate the location or infrastructure that they represent.%%%%Within this jump, they may be the spirits of different organs, such as the heart or lungs. In future Jumps, they can be spirits connected with parks, museums, or public buses, as examples.,,
Tourist - Anthropromorphic Incarnation,,1,,-4000,,True,,True,,Having cells acting and interacting like humans can help with understanding them and learning more about them, and this sort of understanding can apply to other things as well.%%%%You can now reach out and focus on some inanimate or non sentient object or living organism, and transform it into an anthropomorphic version of itself. They will gain a human form and basic human levels of intelligence, but will have thoughts, emotions, and priorities that revolve around their normal form and function. An anthropomorphized car may want to transport people and things around, while an anthropomorphized tree may simply want to sunbathe. You can choose instead to have the anthropomorphic form appear next to their normal self, in which case they must remain in very close proximity to their normal self.%%%%This power can allow you to communicate with and come to understand the target of the power better, and it is possible for changes in their behavior to be implemented if you are convincing enough.%%%%You can only target one thing at a time with this to start with, causing prior targets to revert to normal when you target something new, though you may be able to expand that number slowly over time.%%%%These anthropomorphic incarnations are not ordinarily capable of being taken as Companions, unless you would be capable of taking them as a Companion in their normal state without this perk.,,
Tourist - Your Cells at Work,,1,,-6000,,True,,True,,You are a body made up of cells, within a body made up of cells. You now have the option to have your body function like the city-body within this jump, having your cells be anthropomorphized and all possessing roughly human level intelligence. This means that your cells will work together, and that they are both capable of having a far greater impact while performing their various duties, and are capable of much greater levels of co-operation and creativity when working together to accomplish what they need to accomplish.%%%%You are also capable of forming an internal Avatar to communicate with your various cells, which will be recognized as being an ultimate authority within your body.%%%%If you have the Tourist Origin, you will be recognized as having this authority among the normal cells within this Jump. This authority, and the ability to communicate with and coordinate your cells, can allow you to have your body operate in non-standard ways, so long as you can convince your cells to do things they wouldn’t normally do. They will push back if your actions would be deathly harmful to your body.%%%%You can split your focus evenly between your normal body and this Avatar without any degradation in mental function on either end.,,
Tourist - Your Cells at Work + Cancer - Unrealistic Biologies,,1,,00,,True,,True,,It is not only your body that has humanoid cells now, is it? Now, you can either choose to have a general global effect that leads to all other living beings having humanoid cells, or an effect caused by deliberate interaction from you. In either case, those affected by this will act normally, for the most part, and the differences will not be openly discernable from a macro-level perspective.%%%%Their cells, however, will experience the alteration in capacity that your own cells have gained, though to a much lesser extent. When you are in fairly close proximity to someone who is affected by this power, you can form an Avatar of yourself within their body, and interact with their cells. You won’t have the same absolute authority as you would within your own body, but you can work to either help improve their cells, or undermine their body’s performance.%%%%Other beings capable of shrinking to a cellular level can also enter bodies and interact with these humanoid cells.,,
Nutrients,,2,,-500,,True,,True,,A simple box with a label of ‘Nutrients’ on the outside. Within, you will find 60 cans, each labeled with the word ‘Nutrient’. Each can contains a brownish slop with a vaguely meaty taste that, when consumed, provides all the nutrition that a human body (or closely equivalent race) needs for 1 day.%%%%Those that need more or less nutrients than a human in a day will have to consume an equivalent ratio of cans to gain the same effect. Refills each week. Anthropomorphized cells count as humans for the purpose of these cans.,,
Cell Maker Machine,,2,,-5000,,False,,True,,A tall glass cylinder filled with a mysterious greenish liquid, with a scientific control console attached to the base. There are attachments in the console that allow for the machine to be hooked up to a living being. When hooked up, the will begin to grow a clone of whatever is hooked up to it within the liquid.%%%%Growing a human (or anthropomorphized cell while in this Jump) takes approximately 1 week. Those with greater or lesser mass will take a proportionally shorter or longer amount of time. Increased and decreased biological complexity will also alter the rate of time to completion.%%%%The final clone will end up greatly resembling the donor in personality, knowledge, and mannerisms, though it will understand that it is a clone.%%%%If the process was interrupted and restarted, it is possible for editing errors to creep in.%%%%Only wholly biological abilities are manifest in the clone.,,
Worker - Uniform,,2,,-1000,,False,,False,,A clean, professional looking uniform, which can change color and style to fit whatever your job happens to be. Durable, stain-proof, breathable, and very comfortable, it also has a neat trick of being able to change color to match your mood if desired, becoming brighter when you are happy and energetic, and darker when you are tired or sad.%%%%It also can help provide a boost of energy to you from time to time to get the job done.,,
Worker - Delivery Boxes,,2,,-2000,,False,,True,,A stack of a dozen collapsed cardboard boxes and a set of mailing labels. When the boxes are put together, they are capable of holding roughly three times the volume their exterior dimensions would suggest.%%%%If one of the mailing labels is placed on the box, a red-uniformed delivery person will show up shortly thereafter to take the box for delivery.%%%%Delivery will be same day within a city range, same week within a country, and same month on a planetary range, and is completely untraceable and not interceptable up to the point where delivery is made.%%%%These boxes and mailing labels replenish once per month.,,
Worker - Handy Map,,2,,-3000,,False,,True,,A map of the human body, this not only showcases the various veins and other routes a cell can take, but also updates in real time to reflect damage and injuries, blockages due to clots, and other obstacles.%%%%In each new jump, you can choose to either synchronize the map to a city or to a living being.%%%%When synched to a city, it will provide a real-time updated map of the city’s streets and other transportation routes. When synched to a living being, it will show real-time updates about their health and general status.%%%%The map can be synchronized to a new city or living being once per year in future jumps.,,
Worker - Memory Library,,2,,-4000,,False,,True,,A massive set of bookshelves, containing countless memories stored in book form. Each book represents the memories of a single individual, stored in the form of a diary written from their perspective.%%%%When someone reads these diaries, they will be able to immerse themselves in the memory, essentially reliving it as if they were there.%%%%To start with, this library contains the memories of several thousand cells, going back a few generations. Blank books are provided on one of the shelves, and allow for new sets of memories to be added. To do so, the donor will have to sit down and start writing down their memories. This process will happen supernaturally fast, with a year’s worth of memories being transcribed in just around ten minutes. The process also sharpens the memory of the donor, refreshing old memories to allow them to be transcribed accurately.%%%%The donor can choose to leave out certain memories or to lower the level of detail provided, but they can’t falsify their memory of what occurred, even by psychic or supernatural means. They also won’t have to worry about their hand cramping from writing down the memories.,,
Defender - Weapon,,2,,-1000,,True,,True,,A simple melee weapon. Traditionally a knife, but any sort of melee weapon can be substituted. This weapon will never break, rust, or become dull, and if separated from you, it will appear back in its sheath or holder unless you deliberately handed it off. Even then, you can call it back to its holder with a thought.%%%%Wounds that this weapon causes bleed far more than they should and have a greater effect on the target than they normally would.,,Glaive
Defender - Detector,,2,,-2000,,False,,True,,A simple radar-like device that can detect the presence of germs and foreign invaders. By default, it emits a pinging sound when they are close, getting louder and more frequent as they draw closer. It can be modified to send alerts in other ways, and has been upgraded slightly to provide indications of direction and distance on an attached screen.%%%%In future jumps, it can be modified to detect other threats, such as specific species, the presences of weapons, etc., though it can only detect a single type of threat at a time, and its range and accuracy of detection increases the more specific the thing is it is designed to detect.,,
Defender - Antibody Shooter,,2,,-3000,,True,,True,,A large two-handed gun, capable of spraying large blasts of liquid antibodies. Comes with an auto-synthesizer and bio-scanner, allowing it to lock onto a specific target and scan it for weaknesses, and then synthesize an antibody specifically designed to attack those weaknesses.%%%%It takes some time to scan and synthesize, on the order of several minutes minimum, but this time can be decreased if data is prepared and fed into the bio-scanner ahead of time about the biology of the target.,,
Defender - Sneeze Button,,2,,-4000,,False,,True,,A small handheld remote with two buttons on it, red and green.%%%%When the remote is pointed at an individual or object and the green button is pressed, a ‘mucus bubble’ will rise up around the targeted individual or object. This bubble is very sticky and durable, but can be broken out of given enough time or force. When the green button is pressed while aimed at someone or something trapped in a mucus bubble, a ‘sneeze rocket’ forms around the bubble, before launching straight up into the air and exploding with the sound of a massive sneeze, causing the trapped person or object to be hurtled off into the distance.%%%%When the remote is pointed at a location and the red button is pressed, a sneeze rocket descends down from the sky and crashes on the target location, exploding with the sound of a massive sneeze and causing a large wave of overpressure to blast outward. Both buttons will go dim after being pressed, and can’t be pressed again until they light up again.%%%%The green button takes roughly 1 minute to relight, while the red button takes roughly 12 hours.,,
Invader - Cell Mask,,2,,-1000,,True,,True,,A simple ceramic mask depicting a fairly average looking face. Those viewing someone wearing this mask will see the wearer as being an ordinary cell, no matter what their actual body shape may be.%%%%Physical interaction can break this effect, though accidental bumping may be ignored. Similarly, if the mask is removed or broken, the effect will break. If someone sees the wearer putting on the mask, they will be immune to the effect of the mask for the next day.%%%%At the start of each new jump, you can select a different common race in that jump, and the mask will now make the wearer appear to be a member of that race instead. Note that the mask will not let you mimic a specific individual, it only gives you a generic appearance of your chosen race.,,
Invader - Capsule Net,,2,,-2000,,False,,True,,A net of tightly woven fibers, that can be used for both defense and capture.%%%%The net can be controlled mentally while held, allowing the wielder to stiffen it to the consistency of high-grade steel to block physical attacks.%%%%The net can emit a bit of acid in this state, burning at people or objects that touch it, aside from the wielder.%%%%The net can also be expanded and have sections broken off and thrown to engulf targets, causing a minor smokescreen at the same time.,,
Invader - Allergens,,2,,-3000,,True,,True,,A sack full of strange white lumps. These lumps are concentrated allergens, capable of disrupting the normal flow of the body by causing a tremendous overreaction within the immune system.%%%%When an allergen is tightly squeezed, it will burst out into a mist that will spread out into the local area, causing an increase in both violent behaviors and accidental collateral damage. This effect is especially potent on those who would normally be defending the area.%%%%This mist will fill the local organ within the body, and in future jumps, will cover several city blocks worth of area, and will last for several hours.%%%%The bag contains around 20 of these lumps, and refills at the beginning of each month.,,
Invader - Virus Hat,,2,,-4000,,True,,True,,A red hat with white patterns and designs on its surface. When placed upon someone’s head, they will rapidly turn into a zombie-like figure, desiring only to cause havoc, attack others, and spread more of the virus. The virus spreads by budding off small lumps from the hat, which then rapidly expand into more floating hats, which will seek out an attach to people, continuing the cycle.%%%%Particularly strong, willful, or healthy individuals can resist the infection for longer, and if the hat is removed soon enough, victims can be saved.%%%%If all the zombies and hats are destroyed or otherwise neutralized, a new hat will appear in your possession within 1 month.%%%%You can program specific behaviors into the hat before releasing it, such as causing the hat to target only specific types of people, leaving specific people alone, or engage in certain simple behaviors such as congregating in large packs or specifically destroying technological items.%%%%You can also set a time limit, causing all the hats to self-destruct after a certain time has passed, and once it has been deployed, you can initiate such a self-destruct just by placing your hand on one of the hats.%%%%Finally, you can customize the appearance of the hat, changing its color, shape, and form, though it still has to be something that attached to the victim’s head in some way.%%%%You are always immune to infection by these hats.,,
Backup,,3,,00,,False,,False,,Cells need to work together, and now you can call in your friends to help you. For 50 CP, you can import a single companion, and for 300 CP, you can import a full set of 8. Each of these companions will have 600 CP to spend and a free Origin. Companions cannot take the Tourist Origin.,,
Steroid Bot,,3,,-500,,False,,True,,A strange robotic figure. It is programmed to end violent conflicts by unleashing overwhelming violence against them until they cease. Useful as a potential weapon, but it is possible that you could find a way to reprogram it to be a little less indiscriminate.,,
Platelet Crew,,3,,-1000,,False,,True,,A full crew of frankly adorable platelets. They take up a single companion space, and are perpetual children. These two dozen or so platelets are cheerful and eager to work, and they can accomplish some amazingly big tasks when working together. They have the effects of Adorbs and Jolly Cooperation.,,
Other Cells,,3,,-1000,,False,,True,,If there is another cell or bacteria that you have befriended during your time here, you can take them along as a companion for 100 CP. They will have the effects of both of the 100 CP perks for the Origin that best fits them. As a note, you can befriend and take Parasites or helpful Bacteria, and they will get the 100 CP perks from the Invader origin.,,
Drawbacks,,4,,00,,False,,False,,You can take a total of 800 CP worth of drawbacks,,
A Familiar Body,,4,,00,,False,,False,,Rather than being within the body of a generic human, you can be in an entirely different body. You could choose to be in the body of one of your Companions (in which case they would spend the decade living a life on an ordinary Earth), or in the body of a generic member of some other race that you have come across in your travels. Experience what it is like to be a cell in a Vulcan or Kryptonian body.%%%%In such a case, all cells are still anthropomorphized to appear to be human, and they don’t gain any particular special abilities aside from those listed in this document. If you have taken the Tourist Origin, then this option is restricted to your personal alt-forms, and you cannot select to have a Companion take the place of the body.,,
Half Dose Clumsy,,4,,1000,,True,,False,,You have a tendency to fumble with things and may occasionally drop them, but you aren’t especially clumsy otherwise.,,Retail Rocker
Clumsy,,4,,1000,,False,,False,,You are somewhat accident-prone, often tripping over your own feet or knocking over a stack of boxes as you move by. Can be somewhat dangerous when you are running away, and may end up causing your fellow cells / bacteria getting annoyed at you. Can be taken at normal and half dose by Companions.%%%%,,
Double Dose Clumsy,,4,,2000,,False,,False,,You are so clumsy that it would be hilarious if it wasn’t happening to you. It seems like every action you take leads to a chain reaction of errors and issues, like you are constantly setting off Rube Goldberg machines of disaster.,,
Half Dose Lost,,4,,500,,False,,False,,You aren’t necessarily getting lost, but you do usually end up taking longer and less-efficient paths to get anywhere. This can be handy when you want to sightsee, but problematic when you do need to get somewhere in a hurry.,,
Lost,,4,,1000,,False,,False,,You were headed for the throat, but somehow ended up in the lungs. And when you try to back-track, you instead ended up in the spinal cord. Every so often, you will find your attention wandering as you travel from place to place, resulting in you getting mixed up and turned around.%%%%You can generally find your way in the end, especially if you can get someone to help guide you, but you’ll be repeatedly late and side-tracked while you are here. Can be taken at normal and half dose by Companions.,,
Double Dose Lost,,4,,2000,,False,,False,,You might as well give up on going anywhere deliberately. Unless someone grabs your hand and physically drags you somewhere, you are only likely to end up someplace by accident. And even in that case, there are good odds that they will end up getting turned around as well.,,
Half Dose Rigid,,4,,500,,False,,False,,Your first instinct is always to follow the rules or your Invader instincts, but if you focus, you can decide to do something else instead. Still, in the heat of the moment, when you don’t have time to think, you’ll find yourself falling back on the rules more than anything else.,,
Rigid,,4,,1000,,False,,False,,Cells have structure and rules that they have to follow, and you are more rigid than most. You are extremely strict and by-the-book. You will always feel a need to follow the rules, and don’t handle surprises or unexpected situations all that well.%%%%In the case of Invaders, this takes the form of following your instincts, even when it might be smarter to try something else. You can stop yourself from following an obviously self-destructive rule, but even then, you’ll feel a strong pull to do what you are “supposed” to do. Can be taken at normal and half dose by Companions.,,
Double Dose Rigid,,4,,2000,,False,,False,,You might as well be a robot, because when there is a conflict between what you want to do and the rules / instincts that are set for your kind of cell, the rules / instincts are going to win. You can do your own thing when there aren’t specific rules to follow, but when the time comes that you are called on or need to act like the cell you are, you’ll do so in the way that cell would act.,,
Half Dose Rage,,4,,500,,False,,False,,Your rage is confined to one specific trigger. This can be anything from hearing people laughing or seeing a germ hurt someone. The rest of the time, you can be perfectly kind and pleasant, but when you see your triggering event, you’ll immediately fly into a full rage.,,
Rage,,4,,1000,,False,,False,,Cell Smash! Something about the world you find yourself in just makes you so angry! Maybe it is how you are expected to do the same job, day in and day out. Maybe it is the fact that all these germs just keep coming in and attacking the body. Maybe it is all these goodie-goodie cells running around, stopping you from taking whatever it is that you want. Whatever the case may be, you have a hair-trigger temper, and you’ll find yourself lashing out without thinking at whoever happens to be around when something sets you off, and you’ll find that you keep getting enraged by things, even when they aren’t directly related to the source of your rage. Can be taken at normal and half dose by Companions.,,
Double Dose Rage,,4,,2000,,False,,False,,Just go ahead and change your name to Berserker. You are practically mad with rage, charging forward screaming and lashing out at those around you. This could be useful if you are a defender that can be kept pointed at the enemy. It is much less useful for a hair follicle that is just supposed to make sure a hair grows properly.,,
Half Dose Fluid Soaked,,4,,1000,,False,,False,,The fluid that you end up getting soaked in is water, and so it is less disgusting, but it can still be annoying to be getting soaked so often.,,
Fluid Soaked,,4,,2000,,False,,False,,It is almost like you are a water (or general bodily fluid) magnet. From blood to pus to urine, you’ll find yourself fairly often ending up getting soaked in some sort of fairly disgusting fluids. This can be fluids from the body itself, or fluids from your fellow cells (as you can all apparently bleed). Regardless of the source, you are guaranteed to find it at least a little bit nauseating. Can be taken at normal and half dose by Companions.,,
