Name,,Type,,CP Change,,Active,,Chained,,Description,,Notes
Universal Drawbacks,,6,,105000,,True,,False,,Taking Universal Drawbacks,,
Body Mod - Greater Essence Infusion - Body Mod Effect,,6,,-1000,,True,,False,,Send 100 CP to the body mod,,
Origin,,0,,00,,False,,False,,There are three different origins that you can choose from: Worker Cell, Defender Cell, and Invader. Age and Gender are irrelevant, so you can choose whatever you want for those, and, if you don’t want prior memories, you can freely choose to make any of the origins into Drop-In origins. For native cells, this will mean that you are a cell that just got injected into the body, with no memory of the prior body that you were taken from. For Invaders, you simply come into existence at the point when you are invading the body.,,
Worker Cell,,0,,00,,False,,False,,You are one of your average cells, tasked with some duty to keep the body running. You could be a common red blood cell, tasked with delivering nutrients and other supplies around the body. You could be a cell that works in the stomach lining to help with breaking down food to provide those nutrients. You could even be a tiny little platelet tasked with helping patch up parts of the body when they break. Any “non-combat” cell is a potentially valid choice.,,
Defender Cell,,0,,00,,True,,False,,You are one of the cells tasked with defending the body from threats, either internal or external. You could be one of the many variations of white blood cells, or maybe a T-Cell, or an antibody-crafting B-Cell. Regardless, you are going to spend the next decade in a nigh-endless war to defend the body from all that would try to break it.,,
Invader,,0,,00,,False,,False,,You aren’t a cell of the body at all. Instead, you are some foreign invader, intent on proliferating and tearing down the body. Oh, you could certainly try to live in harmony within the body, but good luck convincing the immune responders that you aren’t a threat. You can take the shape of a single bacteria, whether foreign or symbiotic, that could be found within the human body. If you choose to be a symbiotic bacteria, you can choose to gain discounts and take Drawbacks as if you were a Worker Cell instead of an Invader, if you want.,,
Tourist,,0,,00,,False,,False,,You aren’t a cell of the body, or even truly a cell at all. Now, your body is actually the body that you are inhabiting, and you are an avatar of yourself within it. Confused? Just don’t think too hard about it. Your “city-body” self will go about everyday life like you would normally, and your true self will exist as an onlooker within the confines of the body modelled on you. You won’t be immediately marked as an invader and you don’t have any specific tasks to do, unless you take a drawback for them, so you are free to run around and explore.%%%%This is automatically a Drop-In Origin, and you do have one important limitation: The well-being of your body and your true self are linked. So if you get damaged down here, it will end up affecting the larger body, and if your larger body gets damaged, you’ll suffer that damage as well. Also, Perks that you possess will not apply to this body, so things like immunity to damage or disease will only apply to your avatar, not to the body as a whole, and such immunities won’t prevent you from experiencing damage when your body is harmed.,,
Adorbs,,1,,-1000,,True,,True,,You are utterly adorable. You have the appearance of a child, though you do keep your physical powers, just in a far cuter package. You could get a raging monster to pause to admire how adorable you are.%%%%In future Jumps, you can toggle this to assume a cute, child-like appearance.,,
Cell Division,,1,,-5000,,True,,True,,Mitosis. A very important process of splitting off new cells from old ones. And now, it is something that you can do as well.%%%%Once per month, you can split off a duplicate of yourself. This will take about eight hours to do, and while you are doing so, you can shape what they will be like. Their mind will be based on your own, though you can accentuate certain factors, and they will be unshakeably loyal to you. Their body will be based on your current form, though you can mix in features of alt-forms that you have.%%%%You can choose to divide perks or powers that you have between yourself and a duplicate, either giving them an entire perk or splitting a perk or power between the two of you. Split powers may grow back over time, though it will take quite a while.%%%%You can have up to twelve duplicates at a time, and they will recombine with you at the end of each Jump, granting you their memories and returning all powers to you. They also recombine with you if destroyed, though some memories may be lost in that case.%%%%You can recreate specific duplicates again at a later date if desired.,,
Cell Division + Cancer - Unrestricted Cell Growth,,1,,00,,True,,True,,Twelve duplicates at a time? Not any more.%%%%There is now no limit on the number of duplicates you can have at a time, no time limit on how often you can split, you can split off three duplicates at once, and it only takes about an hour to split off a duplicate.%%%%You share a mental connection with all of your duplicates as well, and if you happen to die while you have a duplicate, there is a chance that you could swap over to one of the duplicates and morph them into yourself instead. This does come with a risk of memory loss, so it is probably best to just avoid dying altogether.%%%%Additionally, it is possible for you to turn your duplicates into completely independent beings, which won’t necessarily be loyal to you, but could be taken as Companions if you have a method of doing so.,,
Cancer,,1,,-8000,,True,,True,,Why be satisfied with the limits that your position in life have placed upon you? Thanks to some quirk, your chains have truly been broken, and your limits no longer exist.%%%%You can grow and grow, practically without limit, expanding in strength and power. Your body is constantly mutating and changing, and thanks to this perk, all of those changes are optimized towards making you better. Whether improvements to your muscles, mind, or some esoteric power you’ve picked up on another world, you will now never stop changing and becoming better.%%%%Level caps or their equivalents are removed, and your ‘stats’ can always improve. While in this jump, your body may feature some large growths and may end up looking distended or grossly mutated when you use this ability often.%%%%However, after this Jump, such mutations will only appear if you choose. Powers and perks that you have picked up in other Jumps can improve over time. These ‘mutations’ will generally make the powers more versatile, and only very rarely will they become more powerful. Such mutations take time, and you’ll likely only see one or two powers mutate in any given Jump.,,
Worker - Will Boost,,1,,-1000,,True,,True,,There is a job to do, and you are the one to do it. No matter how boring or thankless a task may be, you can always muster up the will to get it done. This doesn’t truly eliminate boredom, but it does allow you to set it aside and not let it wear at your mind while you do the job in front of you.,,
Worker - Rules and Regs,,1,,-1000,,True,,True,,The body only works when everybody know their job.%%%%Now, and in future jumps, you will automatically gain a comprehensive knowledge of the rules and regulations that apply to any job or position that you happen to hold. You may still need to take a bit to remember relevant rules, but you are guaranteed to have the knowledge available to know what you should do in a given situation, at least as far as the rules are concerned.,,
Worker - Navigation,,1,,-2000,,True,,True,,There are over 100,000 miles of blood vessels in the average human body, not to mention all the lengths of nerves, digestive tracts, and other organs. And when you are a tiny cell, those distances seem even longer. With so many routes to take, it is extremely easy to get lost. But not for you.%%%%You have a flawless sense of direction, and you can practically sniff out what the shortest route is to get from your location to your destination. This doesn’t guarantee that you won’t run into problems on the way, but you can be sure when the path you are taking is the shortest path to get where you want to go.,,
Worker - Tireless,,1,,-2000,,True,,True,,The mitochondria is the powerhouse of the cell, and yours seems to be working in overdrive. You now have nigh-boundless energy and stamina to do your job, able to go for days on end running whatever tasks you have been assigned without rest. When you do reach the point where you need to take a break, you’ll find that a 10 minute break leaves you as refreshed as a week-long restful vacation.,,
Worker - Memory,,1,,-4000,,True,,True,,Red blood cells aren’t the only helpful worker out there. Memory cells are vital at helping cells remember what they need to know, and now, you could fulfill that function as well. Not only do you have a perfect memory, with indexing, but you also have the ability to share your memories with others at a touch, and you can take in memories the same way.%%%%,,
Worker - Memory + Jolly Cooperation - Inherited Memory,,1,,00,,True,,True,,You now can access a sort-of ‘group memory’ from whatever group or organization you happen to join. This consists of the commonly shared memories of members of the group, and extends backwards to when the group was founded. This memory isn’t quite perfect, and the older you go, the more the memories will have faded, especially when you reach memories from before any of the current members were part of the organization.,,
Worker - Jolly Cooperation,,1,,-4000,,True,,True,,Cells have to work together to get things done, but when they do, they are able to produce amazing results. You now provide a passive boost to the productivity and output of any group or organization that you are part of, and this boost is heightened with regards to projects or tasks that you are working on directly.%%%%The more members are working together towards a specific goal, the bigger this boost gets.,,
Worker - Activation,,1,,-6000,,True,,True,,Some cells need a little bit of help, bringing out their full potential. That is where the process of activation comes in. You now know how to ‘activate’ those around you, unleashing their dormant potential to grant them a tremendous boost in power. This boost requires that you present the target of this ability with either an enemy to fight or a task to perform, and the boost itself will only function with regards to that enemy or task.%%%%On a basic level, this boost consists of a tremendous boost to physical strength and power, capable of taking a nerdy weakling and turning them into a ripped shonen protagonist. It also comes with a large boost in skill related to either combat, when directed at an enemy, or the specific task the target has been given. In cases where the target possesses some other latent abilities, they too are activated by this, but again, only when directed at the specified enemy or task. This boost is temporary, and the target will eventually revert back to their prior state.%%%%They will also revert if they spend too long trying to fight a different enemy or complete a different task. Once per day, you can use this ability on yourself.,,
Worker - Activation + Cancer - Unrestrained Potential,,1,,00,,True,,True,,Who needs direction? Certainly not you, nor anyone who you are going to be using this ability on.%%%%Now, when you ‘activate’ someone, you don’t have to give them a specific task or enemy. You just pump them with power, and let them loose. You can even push extra power into them to help them push past their own limitations. Sure, this comes with some danger of them getting damaged when their bodies can’t handle the strain, and if you push too far, they could collapse from the overload, but hey. Small price to pay for power.%%%%And if they do manage to survive being pushed past their limits, they’ll find that those limits have been moved higher when they end up reverting back to their old form. Oh, and you can ‘activate’ yourself now as often as you want, though you’ll have to watch out for the same overload problems as everyone else.,,
Defender - Combat Experience,,1,,-1000,,True,,True,,The human body is constantly under attack by germs and viruses. So, there is no time for any of its defenders to panic while fighting to protect it.%%%%You now have combat instincts engraved into your body, allowing you to react quickly and precisely in combat and other high-stress situations. Comes with high levels of physical conditioning, and the ability to suppress those instincts if you want to appear less-threatening.,,
Defender - Natural Killer,,1,,-1000,,True,,True,,Those defending the body from threats are not honorable. They can’t afford to be. They have to be ruthless killing machines, and now, you could be among the best. You have an eye for weakness, being able to take just a glance and figure out the best way to kill whatever happens to be in front of you. You also don’t have to deal with pesky things like squeamishness.%%%%You can still care about life, but when something needs to die, you can set that care aside and do what needs to be done with a smile on your face.,,
Defender - Favored Enemy,,1,,-2000,,True,,True,,Antigens are molecules that are presented to defending cells to provoke an immune response. Now, when you are presented with an antigen (or other traces, evidences, or signs of an enemy), you can lock onto that enemy and give yourself a boost in performance while pursuing or fighting with them.%%%%You will find it easier to track down the enemy you’ve locked onto, and you’ll have a moderate boost in strength, speed, and skill when you’ve engaged them.,,
Defender - Cell Traversal,,1,,-2000,,True,,True,,You don’t have time to go the long way around while pursuing a virus, so you need to travel straight through a cell wall. With this, you can squeeze your way through any gap that you are able to fit at least a portion of your body through, even if it is just a finger.%%%%This power acts quicker when you are actively chasing someone or something.,,
Defender - Antibody Creation,,1,,-4000,,True,,True,,Preparation is the key to victory, and now, you can prepare a solution to any enemy you face. A solution in the chemical sense, anyway.%%%%You now know how to synthesize a special liquid that can be attuned to a specific enemy, acting like an acid on them when they are exposed to it. You can modulate how potent of an effect it has, from dissolving away at them, to merely giving burns, to even just targeting their clothes and equipment.%%%%This liquid does take some time to make, generally around half an hour to an hour, but it can go much quicker if you have access to some DNA or other similar chemical identifiers. With time and experimentation, you may find out how to have other effects aside from just acid, such as knocking them unconscious or sealing away their abilities for a time.,,
Defender - Antibody Creation + Lucky Defender - Premade Solutions,,1,,00,,True,,True,,You now have the ability to create special ‘blank’ solutions, which are apparently unattuned to any given enemy. However, when you carry these ‘blank’ solutions with you, and you get drawn in to face a surprise enemy, you’ll find that they are attuned specially to that enemy.%%%%You’ll have to make more ‘blank’ solutions afterward, as all prior made ‘blank’ solutions would have been attuned specifically to that surprise enemy.,,
Defender - Lucky Defender,,1,,-4000,,True,,True,,It isn’t easy to defend someone you know when you are both living in an area the size of a human body. It takes time to get anywhere, so there is no guarantee that you’ll arrive in the nick of time to save the day. Except now, there is.%%%%You’ll find that when your friends or people you know are in danger, you can get urges that will help you to arrive just in the nick of time, sometimes even allowing you to seem to teleport with how quickly you’ll be able to traverse distances to get there in time. In addition, you can more generally find yourself winding up in positions to help defend random people.%%%%This doesn’t make it so more people need defending than before, it just helps bend probability a bit to ensure that you are in the right place to help.,,
Defender - Consumption,,1,,-6000,,True,,True,,One of a white blood cells most iconic behaviors is the ability to eat invaders whole, both as a method of stopping them, and as a method of gaining information about them to help recognize future threats.%%%%Now, you can consume pieces of an enemy (or just some random being, animal, or thing) to gain information and knowledge about it. This includes both information specific to them, and more general information about their group, race, civilization, etc. If left alone, the information gained is somewhat random, but it can be focused on specific insights that you want to gain.%%%%Any body pieces will do, though flesh and blood works best. For those who are a bit squeamish, more metaphorical methods can work, such as eating a photo of them or a voodoo doll designed to look like them, though these methods result in much, much less information (your body will process non-food items consumed for this purpose just fine, treating it as “generic food”).%%%%In addition, if you don’t want to actually eat whatever it is, you can substitute holding it in your hand and absorbing it into your body through your palm instead. This still transfers the absorbed mass to your stomach, so you can get full from doing this, and it takes as long as if you were eating it bite-by-bite normally.,,
Defender - Conspumption + Cancer - Unrelenting Hunter,,1,,00,,True,,True,,Why stop at information? You can now gain not just information and knowledge, but also abilities and skills from those that you consume.%%%%Your body will have to evolve and adapt to use those abilities and skills, and particularly strong-willed individuals may leave traces of their personality and thoughts behind to bother you, but it still a great way to gain a bunch of strength. You do have to consume the entire individual to gain their skills this way, but like before, you can absorb them via your hand if you don’t feel like getting your teeth dirty.%%%%As a side benefit, you can metabolize absolutely anything now, whether you are eating it for use with this ability or not, and the limits on the amount you can eat have been broken. No worries about getting fat.%%%%You can also absorb things via your palm much quicker, taking only about 10 seconds to absorb a whole body.,,
Invader - Enviro-Protect,,1,,-1000,,True,,True,,You don’t have the luxury of being brought up nice and safe in a warm body. No, you’ve had to endure the wildly hostile environments that exist outside of a human’s skin, and you’ve evolved protections to help defend you. You can now endure extremes in temperature, pressure, air quality, and other such environmental concerns without issue.%%%%This protection focuses specifically on environmental factors, not deliberate attacks, so naturally extreme heat won’t bother you, but someone trying to set you on fire will still cause you to burn like normal.,,
Invader - Hovering,,1,,-1000,,True,,True,,If a bacteria or virus wants to really be successful, it needs to be airborne. You can now throw yourself into the air, loosening yourself from the bonds of gravity to float through the air.%%%%While you can move yourself about, it is more of a gentle glide than anything else. If you want to move faster, you’ll have to find your own methods of propulsion.,,
Invader - Stealth,,1,,-2000,,True,,True,,What good is it to make it into a nice body, when the alarm just gets raised right away? No good at all, which is why you’ve become a master of stealth. You excel at remaining unseen and finding out-of-the-way locations to hide in. As a bonus, you won’t trip automated alarms or sensors, so if someone is going to raise the alarm, they’ll have to do it manually.%%%%Once the alarm is raised, however, this protection disappears, so don’t think they can’t track you down once they know you’re here. Best to just stay hidden.,,
Invader - Natural Weapons,,1,,-2000,,True,,True,,You never know when you’ll have to fight against some uppity white blood cell, so you need to have weapons close at hand. Or maybe, close in hand. Whether it is a set of claws, a stinger, poison gas sacs, or something else, you’ve got some kind of natural weapon that you can use to defend yourself. You can retract or conceal these natural weapons easily, rendering them effectively undetectable until you bring them out again. At the start of a new Jump, you’ll have the option to alter what form these natural weapons take to fit your new body, but they do have to be natural. No adamantium claws or laser cannon eyeballs.,,
Invader - Minion Maker,,1,,-4000,,True,,True,,If you actually go out yourself and cause a mess, you are liable to end up getting dog-piled by a bunch of goody-goody defender cells. That’s why you need to infect some cells to make into your minions and have them go do your dirty work instead.%%%%Now, if you spend about four hours concentrating and interacting with someone, you can brainwash them into becoming your minion. It is possible to break this time up over several ‘sessions’, but doing so will increase the time required as the power wears off a bit in-between. Also, it may take longer to wear down those with above average willpower.%%%%Minions you make will retain their old personality, except for the fact that they will be loyal to you and want to follow your orders. Giving them an order that conflicts with their old personality can cause some internal conflict that might break them free eventually, and if you don’t interact with them at least once a week or so, the conditioning will start to degrade.%%%%However, aside from that, they will faithfully carry out your orders as best they can. Minions do not count as Companions unless you pay to somehow take them with you.,,
Invader - Minion Maker + Immuno-Confusion - Mayham Sowing,,1,,00,,True,,True,,Even if you can’t make someone into a full minion, doesn’t mean that they can’t work for you. Now, just by interacting with someone for five minutes or so, you can implant a thought or urge into their head that they will want to act on in some way.%%%%You can’t control how they will act on it, and they can simply choose not to, but either way, they won’t realize they are being influenced by you.%%%%This power is more effective when used to try and incite actions that will cause chaos.,,
Invader - Immuno-Confusion,,1,,-4000,,True,,True,,What is better than tearing through your enemies and watching them fall before you? Watching them tear each other apart as you turn them against each other, of course. The human immune system is typically a well-oiled machine at fighting against invaders, but if you throw a few wrenches in the gears, it can end up being its own worst enemy.%%%%You now excel at sabotaging attempts to stand against you, turning defenses aimed at you against themselves, and just generally ensuring that attempts to defeat you do more damage to those opposing you than they do to you.%%%%Whether it is dodging at just the right moment to have someone stab their ally, or arranging things so some automated defenses kill the defenders, rather than yourself, you’ll find it basically instinctive to act to make your enemies sabotage themselves.,,
Invader - Adaption,,1,,-6000,,True,,True,,There is an eternal arms race between the bacterial and viral forces seeking to infiltrate the human body, and those pesky defenders trying to keep them out. And now, you are at the bleeding-edge of that race. Any time that you are exposed to a danger or damaging influence, your body will immediately start adapting to be able to counter that threat, eventually rendering you immune to damage of that type.%%%%This effect also extends to your mind and soul and any other vector for attacking yourself, though it works fastest on physical threats.%%%%These adaptations aren’t eternal, and if you never face damage from a given source for several years, the immunity may begin to fade as your body adapts to face more current threats, but regular dangers will soon prove to be no danger at all to you.,,
Invader - Adaption + Cancer - Unreal Evolution,,1,,00,,True,,True,,Why wait until you are attacked to adapt? Now, so long as you are aware of a threat, your body, mind, and soul will start adapting to neutralize it, and do so much, much faster than it otherwise would. It can even adapt ways to reflect the threat back towards the source or gain benefit from it rather than damage.%%%%It is true that you’ll have to keep an eye out, so that you don’t accidentally ‘counter’ a pat on the back with a reflexive spiky shell or something, but the safety that is provided from being able to adapt to threats before they actually attack is more than worth it.,,
Tourist - I Belong,,1,,-1000,,True,,True,,You might be new to this neighborhood, but you’ll find you can fit in soon enough.%%%%Whenever you move somewhere new (or when you start a new Jump), you’ll find that you can easily and quickly pick up on the local customs and mannerisms, to the point where people will probably assume that you are a local before too long.%%%%As long as you don’t do anything to specifically draw attention to the fact that you are new or not from around here, you’ll be easily accepted as belonging wherever you happen to be.,,
