Name,,Type,,CP Change,,Active,,Chained,,Description,,Notes
Double Dose Fluid Soaked,,4,,3000,,False,,False,,Frankly, you’ll be spending more time soaked than not now, and no matter how often it occurs, you’ll never be able to fully suppress the nausea and disgust it causes. What is more, some of the fluids may end up actually being somewhat dangerous, like stomach acid, so you’ll have to react quickly to either avoid the spray or clean it off quickly.,,
The Smell,,4,,2000,,False,,False,,Bodies smell gross, and you are having to live inside of one. Now, the body will be constantly giving off all kinds of odors, most of them noxious, and you will have to live with it. Gives no points if you lack or remove your sense of smell. Gives 100 CP to companions who have a sense of smell.,,
Half Dose Greedy Glutton,,4,,1000,,False,,False,,While you are certainly hungrier than normal, it isn’t enough to drive you completely mad. You’ll just find yourself needing to eat more often than you otherwise would, and so you’ll need to find a way to account for the extra food you’ll go through.,,
Greedy Glutton,,4,,2000,,False,,False,,You need more! You aren’t satisfied with just the normal amount of nutrients that a cell normally needs. No, you are far, far hungrier, and you’ll feel compelled to do whatever it takes to get those extra nutrients, up to and including killing other cells to steal their own nutrients. Hopefully, you won’t get driven that far, but you are at the very least going to be a nutrient-based kleptomaniac. Can be taken at normal or half dose by Companions.,,
Double Dose Greedy Glutton,,4,,3000,,False,,False,,No matter how much you eat, you will always feel a gaping hunger inside, demanding to be filled. If you ignore it, you will waste away, so you have to eat, but it will never end up satisfying you, and you’ll continue being driven to greater and greater extremes to try and satisfy the gnawing hunger in your belly.,,
Scrapes, Bruises, and Bumps,,4,,3000,,False,,False,,Worker, Defender or Tourist only%%%%The body that you are in seems to be far more accident-prone than most. The infrastructure of the body is constantly getting damaged, and you seem to always be at ground zero when it does. So, you’ll need to get good at dodging away from massive pits forming, veins rupturing, and other catastrophic damage that could result in you getting killed or flung out of the body. Grants 150 CP to companions with the Worker Cell or Defender Cell Origin.,,
Inverted,,4,,2000,,False,,False,,Invader Only%%%%All of the bodies around you seem to be unnaturally resistant to injury, making it much much more difficult to actually invade their bodies. Even typical weak points, like the mouth, are much harder to get into than normal. Grants 100 CP to companions with the Invader Origin.,,
Half Dose No Downtime,,4,,1500,,False,,False,,You have a set of tasks to complete, but the deadlines are much more flexible, giving you time to rest for at least a bit. You still won’t have time to have a ‘life’ outside of completing the tasks, but you at least have a little bit of room to sit and breathe.,,
No Downtime,,4,,3000,,False,,False,,Cells don’t have time to take breaks or go out and see the sights, and now, neither do you.%%%%You will be given a set of tasks to complete. If you are late on any of them, it counts as a failure for this jump, and the timing on them won’t give you much, if any, time for things like sleep.%%%%When you complete a set of tasks, you’ll immediately be given a new set, and you’ll have to keep up that pace throughout your entire time here.%%%%Even if you are an Invader, you will somehow still be given a list of tasks to complete, relevant to you.,,
Paranoia,,4,,3000,,False,,False,,There are germs everywhere! Everywhere you go, you are seeing enemies and monsters. Unfortunately for you, this is pretty much just all in your head. Many of those you see as enemies are actually your fellow cells. If you are a Worker Cell, they’ll be looking at you oddly for running away from them. If you are a Defender Cell, they’ll be screaming at you to stop attacking them.%%%%What’s worse, you also keep mistaking enemies for friends, wandering up to actual hostile bacteria as if they were your fellow cells. For Invaders, you have much more of the latter than the former; you can never seem to recognize which cells are Defenders out to attack you until they already are, and you may end up mistaking harmless cells for a mass of Defenders trying to take you down. You might even mistake some of the Defenders as being your fellow bacteria, here to back you up.,,
Half Dose Paranoia,,4,,1500,,False,,False,,You may mistake friendly or neutral cells for enemies, but at the very least, you aren’t going to be mistaking enemies for friends.%%%%If you recognize someone as an ally, you can be sure that they are who you recognize them as.,,
Half Dose Autoimmune Response,,4,,2000,,False,,False,,You will still set alarm bells ringing in the immune system, but it is now more of an inconsistent glitch than a constant problem, and defender cells will be a little more willing to talk things out rather than just attacking. Only a little, though, you’ll still probably have to avoid an attack or three before you can get them to listen. Unless you are an Invader, in which case they’ll still attack like normal.%%%%You only have to spend a fifth of the jump inside a body if you have this Drawback as an Invader.,,
Autoimmune Response,,4,,4000,,False,,False,,Something about you just sets alarms ringing. Literally. You will register as an invader to the defenses of whatever body you are in.%%%%For Workers and Defenders, this means that you are liable to get attacked by the various defenses, and you’ll have to either avoid them or try and talk your way out. Be careful, because most Defenders are the type to attack first and ask questions never.%%%%For Invaders, this means that the defenses of the body will be even more sensitive to your presence, and they will be supernaturally good at arriving at your location very shortly after arrival. If you are an Invader, you’ll need to spend at least half the jump inside a body if you have this Drawback.%%%%Can be taken at normal or half dose by Companions.,,
Double Dose Autoimmune Response,,4,,6000,,False,,False,,Welp. It looks like every single cell, bacteria, and virus considers you to be an enemy.%%%%Every cellular organism, except for your Companions, will attack you on sight, from white blood cells to bacteria to cute little platelets. If they see you, they will attack.%%%%Invaders who take this don’t have any special requirement to spend time in a body, because they will still be being attacked, even outside of the body. Only take this if you enjoy fighting for your life against unending hordes for a decade. As a final note, they don’t lose their own intelligence when fighting against you, so it is possible for those attacking you to adapt and learn over time.,,
Blood Doesn't Bleed,,4,,5000,,False,,False,,Worker, Defender, or Invader only%%%%You are now a cell. Not an anthropomorphized cell, but an actual cell of whatever type you happened to choose.%%%%The world is now ‘realistic’, save for the fact that you can still think like normal. You’ll be limited to the capabilities of your realistic cell body, though you could find a way to use other powers that are not tied to having a particular form.%%%%Companions can get 200 CP if you take this Drawback.,,
Black Body,,4,,6000,,False,,False,,Worker or Defender only%%%%Normally, you are put into a body that is in relative good health. Not perfect, but not bad either, the quintessential average human being. That is no longer the case here.%%%%You are now in a body that is on its last legs. Disease-ridden, addicted to a variety of bad-for-you substances, hosting a plethora of health issues, this body isn’t likely to live out the entire decade. So, you are going to have to work hard to ensure that the body doesn’t completely collapse on you, which is a tall order to ask from a single cell.%%%%Worker or Defender Companions will get a full 300 CP if you take this Drawback.,,